start	end	text
2676620	2678680	porque es mentira que
2678680	2680480	los gays no pueden tener hijos
2680480	2682240	vos podes tener hijos si queres
2682240	2683160	wow
2684280	2686680	atajate ese diverse board
2687520	2688320	igual
2688320	2690140	entiendo lo que decís
2690140	2692400	y entiendo que quizás no seas tan
2692400	2693620	diverso como yo
2693620	2695860	entonces respeto tu ciencia gay
2695860	2697680	expresada desde tu experiencia personal
2697680	2700620	pero bueno, yo teniendo
2700620	2702660	oh shit
2704680	2706380	teniendo yo mi gay card
2706380	2708340	tranquilos Berkovich del mundo
2708340	2709880	sepan que estoy
2710620	2712120	legitimado digo para decir lo que acabo de decir
2712120	2714300	que nadie se asuste, que nadie crea que quizás solo
2714300	2715840	estoy opinando como un humano no?
2716500	2718380	nadie, por favor
2719960	2720480	salvenos
2720480	2722780	de personas diciendo sus opiniones
2722780	2724620	y que eso interese a otras personas
2725360	2726220	que mundo
2726220	2728640	aterrador no? seria ese en el cual
2728640	2730540	solo los no periodistas
2730540	2732440	osea, imagina un mundo donde los no
2732440	2734520	periodistas puedan opinar de cosas
2734520	2736820	oh, aterrador
2736820	2738940	quizás se nos acaba el curro no?
2739860	2740540	boludo
2740540	2742100	gay card
2742100	2744640	lo dije por eso, había mucha gente también
2744640	2746440	preguntándome al respecto del
2746440	2748500	Cavani Gate, al respecto de que fui a ver
2748500	2750660	a Divididos, fui a ver a Divididos
2750660	2752400	invitado por Micaela Luzardi
2752400	2754440	directora de esta emisora
2754440	2756440	y pude ver al poderoso
2756440	2758000	Catriel en vivo
2758520	2759860	tremendo Divididos
2760520	2762740	tremendo, yo acá hice mi review del rock
2762740	2764920	de ver babasónicos en vivo, fue el primer recital
2764920	2765680	del que fui en mi vida
2766880	2768840	y ahora este es mi segundo recital
2768840	2770180	entonces como experto en rock
2770180	2772560	les quiero decir algunas cosas que sentí
2773300	2774920	aclaro, Aleberkovich, soy periodista
2774920	2776860	especializado en eventos
2777640	2778920	musicales y rock
2779460	2780400	así que también
2780400	2782440	está todo bien eh, osea, opino desde
2782440	2784460	como super periodista
2784460	2786620	por favor que nadie se asuste, que nadie permita
2786620	2788800	que un humano opine de algo desde su lugar
2788800	2790820	de humano eh, eso es lo peor que nos puede
2790820	2793040	pasar como sociedad, gente opinando y que otros
2793040	2794600	los escuchen eh
2794600	2797000	que me pasó como experto en rock
2797940	2798960	lo primero que
2798960	2801000	sentí es que la música estaba muy
2801000	2801920	fuerte
2806480	2808920	yo por supuesto le pregunte
2809980	2811020	a Miki
2811020	2812820	si me iba a poder sentar
2813340	2814920	que lo vivo que le pregunte a
2814920	2816940	Ival Jagroski cuando me invitó a ver
2816940	2818340	babasónicos, le dije hay asientos
2818340	2820080	y me dijo
2820080	2821660	pero que te pasa, me dijo
2821660	2823280	si son unas entradas que
2823280	2824760	ah ok listo
2826880	2828520	solo me quiero sentar
2828520	2830420	solo me quiero sentar
2830420	2831560	ah no bajala, bajala un poquito
2831560	2833700	bajala un poquito por favor, solo un poco
2833700	2835920	ahí, ahí está perfecto
2835920	2837540	ese fue mi aporte
2837540	2838800	el mismo recital
2838800	2841020	un poco más bajo
2841820	2843700	es un evento super disfrutable
2843700	2846340	es como, yo estaba sentado
2846340	2849000	y me senté así
2849000	2850820	a observar
2850820	2851520	el show
2852340	2854420	el espectá, no, no, no
2854420	2855180	hola
2855180	2858320	y cuando arrancó dije oh
2858320	2859820	diablos
2861060	2862660	oh maldición
2862660	2864300	dije porque de verdad
2864300	2866640	esto quizás suena muy innovador pero
2866640	2868040	son, son un poco la
2868040	2870340	aplanadora del rock eh
2872780	2874440	es un término que acabo
2874440	2876520	de ver, es como que yo
2876520	2877800	estaba ahí sentado y dije
2878440	2880800	esto me está
2880800	2882440	pasando por encima
2882960	2884500	sus, le dije
2884500	2886180	enana
2886180	2888440	esto me está aplastando
2889360	2890640	y ella me dijo
2890640	2891220	que
2892440	2894180	yo le dije esto me está
2894180	2895760	aplastando
2896440	2898160	por encima
2898160	2900180	que tras la guitarra
2900180	2901460	se le iba
2901460	2904020	por el diván
2904020	2905460	y
2906920	2907680	jajaja
2907680	2910340	y la gente me decía
2910340	2911560	quiero
2911560	2914100	por favor saludar a los
2914100	2915920	agoveros que estaban en la aplanadora
2915920	2916660	del rock
2916660	2920020	es la antítesis de babasónicos de verdad
2920020	2922160	como dos estímulos fue increíble
2922160	2923820	porque pasé por babasónicos que eran
2923820	2925420	uu swap
2927680	2928720	swap, swap
2928720	2929840	swap, swap, swap
2929840	2931500	y la gente te rozaba
2931500	2932300	y te tocaba porque si eso
2933380	2934660	y esto era como
2936900	2938140	y yo dije wow
2938140	2939540	y cuando subí una historia
2939540	2941680	la gente me decía baja el pogo
2941680	2943040	reward y yo dije
2944100	2945560	no, elijo no hacerlo
2945560	2947380	elijo mirar desde acá pero
2947380	2948900	disfrutar este espectáculo
2948900	2951640	es tremendo como divididos hace grande a la argentina otra vez
2951640	2952600	me encantó
2952600	2954120	el show es así
2954120	2956600	primero hay una parte que esta muy fuerte la música
2957200	2958460	esta muy fuerte
2959740	2960260	eee
2960260	2961880	es así no les voy a mentir
2961880	2963540	quieren review board de rock
2963540	2965980	en la revista la rolling board
2965980	2968080	como crítico de rock bivalance es
2968080	2969480	la primera parte es muy fuerte
2969480	2971320	muy muy alto el volumen
2971320	2974760	después en el medio hay un momento hermoso
2974760	2976380	hay un momento tipo beautiful
2976380	2978840	donde mojo canta como unos temas soft
2978840	2979720	y catriel
2979720	2980260	no le
2980260	2983240	no puedo empezar a
2983240	2985080	retratar la cara en bole que tiene catriel
2985080	2986920	en el momento suave
2986920	2988680	porque catriel esta
2989900	2991680	sobre capacitado para lo que esta haciendo
2991680	2993800	esto lo pude ver con mis ojos de apreciador
2993800	2994800	de la verdad y la fineza
2994800	2996840	eso es lo que le jode a los opinadores profesionales
2996840	2998880	que cuando uno es sensible a la verdad y el arte
2998880	3000060	la puede apreciar en cualquier lugar
3000060	3003580	ups perdón se me cayó una verdad
3003580	3004720	sobre la mesa
3004720	3006560	les quería decir que
3006560	3007240	catriel
3007240	3009660	no se si vieron alguna vez a catriel en vivo
3009660	3012400	pero el chabón no toca la batería la cae atrompadas
3012400	3014180	osea ir a ver divididos
3014180	3016460	es ir a ver como catriel
3016460	3018560	se agarra piñas con una batería
3019480	3020840	el solo de catriel
3020840	3021900	casi me mata
3022580	3024260	el solo de catriel que era como
3028600	3030800	y vos estabas asi mirando
3030800	3031460	yo estaba tipo
3031960	3033980	oh oh oh oh no
3033980	3035240	catriel por favor dejame ir
3036480	3037700	y de repente bajaba
3037700	3038320	y decías
3039680	3040820	creo que termino
3041380	3042220	y volvía
3042740	3044340	y yo decía no por favor
3045040	3046840	entonces en la parte del medio
3046840	3048940	que a mi me gusto mucho
3048940	3051040	era suave y catriel estaba tipo
3051040	3053060	tu tu pata tu
3053060	3055140	tu pata tu
3056420	3057720	y esta era la cara de catriel
3064620	3066400	y despues venia la otra parte
3066400	3068040	donde todos se vuelven
3068040	3068920	locos
3068920	3071680	y despues la musica esta muy fuerte
3071680	3072940	saben porque esta muy fuerte
3072940	3074820	porque no podes hablar
3075980	3077320	no podes intercambiar
3077320	3078600	no se puede hablar
3078600	3082240	es una aplanadora del rock
3082240	3084100	entonces a mi me gusta
3084100	3086300	los espectaculos en los intercambios
3086300	3087560	exponer verdades
3087560	3089960	hablar y agarrar y decir
3089960	3091800	yo la vi asi yo la vi asada
3091800	3092840	oh mira esta parte
3092840	3095580	y no se podía era muy muy muy muy
3095580	3097260	poderoso su rock y hace a la argentina
3097260	3099120	grande otra vez lo interesante que es
3099120	3100740	cosas a las que solo se acceden en maga
3100740	3103440	es que ambos fenomenos agrandan la argentina
3103440	3105460	la argentina esto es lo que no tienen
3105460	3108300	los refutadores necesita del suapa suapa
3108300	3109680	liberado en su esencia
3109680	3112300	y necesita de la aplanadora del rock
3112300	3113420	pasandote por encima
3113420	3115840	porque de esa variación de estímulos
3115840	3117700	es que se construye el tejido
3117700	3119600	de lo argentino y quiero agradecer
3119600	3120980	la cantidad enorme de agoveros
3120980	3123120	yo no lo podía creer cuando me fui
3123120	3125800	de ese coso de ese recital
3125800	3127680	como se llama esta mierda recital
3128500	3129340	me fui
3129340	3131560	yo se lo juro boludo saben que yo
3131560	3133560	no les miento jamas a costa de mi mismo
3133560	3135220	no les miento jamas
3135220	3137300	me empezaron a gritar boludo
3137300	3139700	desde el publico
3139700	3140520	todos rebobros
3140520	3143540	y fueron super amorosos
3143540	3145360	y les quiero agradecer por eso tambien
3145960	3147600	como que su reaccion conmigo
3147600	3149140	fue inversamente proporcional a todo
3149140	3151720	que habian descargado en lo que sea que necesitaron hacer en ese pogo
3151720	3153180	se cagaron a piñas
3153180	3154740	y conmigo solo quedo amor
3154740	3157540	y entonces me decían rebobor rebobor rebobor
3157540	3159460	veni y se sacaban fotos
3159460	3161020	y yo escapaba de ellos
3161740	3163540	que hay gente que les llama la
3163540	3165620	atención mi chivo pero que son nuevos en maga
3165620	3166820	boludo que
3167460	3169420	me estan jodiendo
3170120	3171720	lo termino asi
3171720	3173700	si obvio pero que
3173700	3175080	deben ser nuevos boludo
3175080	3176620	si quieren ya saben
3176620	3178620	si quieren ver
3178620	3180600	analisis que no transpiren
3180600	3182360	vean periodismo
3183080	3185020	esto no es periodismo
3185020	3186300	esto es maga
3186300	3188480	aca las verdades sudan
3188480	3190480	aca transpiran
3190480	3192920	tengo un ratito para hablar un poco de lo que
3192920	3194020	quería hablar tambien
3194020	3198240	que es lo de
3198240	3199680	el cavani gate
3201080	3203080	ay dios que cosa fascinante
3203200	3204840	ustedes saben
3207020	3208820	esto lo digo como periodista deportivo
3210040	3210600	perdon
3210600	3211880	recuerdo a la poblacion
3212560	3215440	que no lo digo como argentino
3215440	3216860	que disfruta del futbol
3216860	3217600	hincha de boca
3217600	3219880	porque sino ustedes saben que no podria hablar
3219880	3223020	si alguno de ustedes solo es un argentino hincha de boca
3223020	3224320	por favor antes de hablar
3224320	3226740	podemos hacer eso
3226740	3228500	podemos hacer eso durante unos dias
3230560	3236600	podemos hacer eso durante unos dias
3236600	3237420	como
3238700	3240660	osea antes de hablar
3240660	3242860	fijense si estan autorizados
3242860	3244940	que es una practica que yo voy a incorporar nada
3244940	3245540	para mejorar
3246900	3249100	para laburar mejor
3250200	3250720	entonces
3251260	3252080	el pub
3252080	3253580	permiso al everkovich
3254280	3256400	entonces si alguien tiene una opinion en twitter
3256400	3257260	o en algun lado
3257260	3258480	o en un medio lo que sea
3258480	3258480	
3258480	3259640	hay que decir
3260480	3261200	tramitaste el pub
3262460	3264820	esto lo estas diciendo con pub o sin pub
3264820	3266380	perdon estas a la altura
3266380	3267100	de tu opinion
3267100	3269600	no no se capaz tener que estudiar
3271740	3272660	como estas
3272660	3274980	opinando como argentino como periodista
3274980	3276580	no no dale como argentino
3277620	3278980	ya me parecia
3278980	3280500	si no
3280500	3282160	lamento decirte
3282160	3284600	que estas haciendo mucho daño
3284600	3286620	no como el que afirma
3286620	3287580	que no es una política muy suelto de cuerpo
3287580	3290380	que montonero fue todo un comploto organizado por la cia
3290380	3292420	donde mandaron a los pobres chicos a morir
3292420	3294440	al igual que la política desmalvinizadora
3294440	3296680	al respecto del ejercito nacional
3296680	3298180	cuando agarran y te dicen
3298180	3300500	los pobres chicos que fueron a morir
3300500	3300940	oh no
3302400	3305060	se me cayo un poco de linea
3305060	3306060	se me cayo
3307760	3308200	perdon
3310200	3311060	dejé un poco de
3311840	3312860	dejé un poco de line
3312860	3313460	en la mesa
3316100	3317740	tramito el pub
3317740	3319100	tramito el pub
3319100	3320200	para decir
3320200	3321460	me resulta increíble
3322480	3324460	como verdaderamente ya me doy cuenta
3324460	3326560	que es una decisión
3326560	3327460	lo que hace
3328680	3329760	esto ya es como
3329760	3331560	vieron que los estados
3331560	3333320	tienen política internacional
3333320	3335040	mas allá de las administraciones
3335040	3337960	la continuidad política de los estados
3337960	3339720	a mi me gusta mucho la política internacional
3339720	3341100	y se basa en la costumbre
3341100	3342880	es decir se basa en lo que los actores
3342880	3344880	estaduales hacen para afuera
3344880	3347000	y mantienen a través de distintas administraciones
3347000	3348780	por ejemplo México
3348780	3350320	con el asilo político
3351460	3353100	Argentina con hacerse los boludos
3353620	3355120	la mayor política internacional
3355120	3356340	de Argentina es hacerse los pelotudos
3356340	3359000	si estalla ahora una gigantesca guerra mundial
3359000	3361040	atómica, yo lo he dicho muchas veces
3361040	3363120	la postura internacional de Argentina debe ser
3363120	3364180	ruido de mate
3365720	3367100	upa, quilombo che
3367620	3369200	eso es política internacional
3369200	3371240	eso es política de estado argentina
3371240	3372960	mas allá de las administraciones
3372960	3375520	y cuando viene alguien y ofende esa política
3375520	3376860	daña para mi
3376860	3378760	esto lo digo como argentino sin pub
3378760	3380280	a lo argentino
3381020	3383040	hay una política exterior en boca
3383040	3384880	que ya se consolidó
3384880	3387020	a través del macrismo, es decir hay una continuidad
3387020	3388820	hay una continuidad entre el macrismo
3388820	3390840	y el sagrado consejo del fútbol
3390840	3393540	entonces atención a esto que voy a decir porque es calibre pesado
3393540	3395060	es una continuidad política
3395060	3397700	y es el mercado de humo
3397700	3399700	yo pensé equivocadamente
3400440	3402160	que el mercado de humo
3402160	3404200	era sello angelicista
3404200	3405980	de manual y quizás lo trajo
3405980	3407920	angelici, pero es una política
3407920	3410000	que con mucha sabiduría
3410000	3411700	el consejo del fútbol ha respetado
3412260	3414160	y ahora tenemos una continuidad
3414160	3415820	bostera que es
3415820	3417700	el mercado del humo
3418500	3419860	ustedes han notado
3419860	3421760	que hay cosas que se hacen
3421760	3423700	solo por y para preservación
3424240	3425360	del mercado de humo
3425360	3426540	no está basado
3426540	3428220	en ningún lápiz de realidad
3428220	3430320	no se sustenta en nada
3431840	3433080	y sin embargo
3433080	3435400	se mueve, es pur si mueve
3435400	3437220	y yo creo que ya hay que disfrutarlo
3437220	3439780	es como el eterno pase de Ibrahimović
3440440	3441760	es tipo che
3441760	3443280	se dice que viene
3443280	3444960	y yo no sé si les pasa a ustedes
3446400	3447760	pero cabaña boca
3447760	3449240	es como que
3449240	3451140	un discurso en Plaza de Mayo lo cierra el indio
3451140	3452320	a esta altura
3452320	3454480	es un
3454480	3455900	es un latiguillo
3455900	3457880	y yo siento que también todos
3457880	3459840	somos parte de ese mercado del humo
3459840	3462280	porque me parece que es igual que la economía de Mentions
3462280	3464660	está sosteniendo familias al mercado del humo
3464660	3465940	o sea hay gente
3466560	3468260	hay programas deportivos
3469160	3469760	enteros
3470320	3472640	que viven de la idea
3472640	3473820	de que es Latan
3473820	3476520	y Ibrahimović juega algún día en boca
3478120	3480460	y yo siento que ese smoke
3480460	3482880	el mercado, como está acá diciendo Gregor Gaming
3482880	3484460	hay que defenderlo
3486600	3487480	como bostero
3487480	3488500	como bostero
3488500	3489560	propongo a los bosteros
3489560	3491500	porque esto sería muy bostero de mi parte también
3492160	3494900	no, no es la perspectiva gallina de la fuerza
3494900	3496240	que es medio agarrar y decir
3496240	3497780	que papelón esto que estamos haciendo
3498400	3499920	está muy bien billetera brito
3501000	3502740	pero tiene demistick
3502740	3504100	está muy bien billetera brito igual
3504100	3505400	está haciendo unos moves
3505400	3507700	no está un poco distraído con la política
3508260	3509700	pregunta para el Thanos Carpati
3510500	3512900	no está un poco jugando
3512900	3514660	tirando las lines en simultáneo
3514660	3516000	y sin embargo River
3516000	3517320	no está tan bien
3517320	3519700	son preguntas que las hago como periodista deportivo
3520840	3522940	Pav, tramitado eh
3522940	3525220	son preguntas que hago como periodista deportivo
3525220	3527520	que a veces veo que billetera brito está
3527520	3529640	queriendo jugar unos partidos
3529640	3531780	un par de partidos en simultáneo
3531780	3533700	alguien notó lo canoso que está Gallardo
3535000	3536620	le pasó el efecto Obama
3536620	3538400	después ese presidente boludo
3539200	3542020	lo vieron se dieron cuenta con independiente
3542020	3543200	dos hechos salientes
3543200	3545320	la vuelta del gran Don Julio Falsioni
3545320	3546600	el inmortal
3546600	3548180	el inmortal
3548180	3550080	a todo es
3550620	3552900	cuando Falsioni es DT de tu equipo
3552900	3554500	tu equipo juega con una ventaja
3554500	3556740	que es que nadie quiere que pierda
3556740	3558660	todo neutral que mira eso dice
3558660	3560880	ay no que no pierda Falsioni boludo
3560880	3562480	no, no tengo ganas de que pierda Falsioni
3562480	3564620	vieron lo canoso que estaba
3565480	3566100	Gallardo
3566620	3568360	que está pasando ahí
3568360	3570620	Gallardo se encerró en la Torre de Marfil
3570620	3572620	perdió el poderoso pase de Suárez
3573960	3575240	eso se le
3575240	3576600	escapó de la billetera brito
3576600	3578700	la quiso cerrar así y se le escapulló
3578700	3580060	entre las tarjetas
3580060	3583100	entre las black cards y apareció en nacional
3583100	3585040	todo por no estar en la libertad
3585040	3585760	que feo
3585760	3588620	y Gallardo apareció tocanoso
3588620	3590800	todo blanco
3590800	3592700	todo con los ojos desorbitados
3592700	3594400	pero no va a ceder nunca a Gallardo
3594400	3596600	hoy va a morir en su verdad y está muy bien
3596600	3599300	y ahí están los gallinas buscando esa ciencia
3599300	3600760	los bosteros
3600760	3602560	que tuvimos el gran insumo de la foto
3602560	3604140	del patrón Bermúdez
3604700	3606580	detectada certeramente por Luquita Rodríguez
3606580	3607960	el intérprete de la realidad
3607960	3610380	tenemos que defender nuestro mercado de humo
3610380	3611740	yo creo que también
3611740	3613900	doy otra programa a Goberna y ya me retiro
3613900	3617620	que lastima me quedaría más tiempo hablando con ustedes la verdad
3618760	3620680	como bostero todos tenemos que defender
3620680	3621600	el mercado de humo
3621600	3624480	cuando hay un rumor nuestro deber bostero
3624480	3626800	es agrandarlo es retrucarlo
3626800	3628740	es decir tengo información
3628740	3630720	que lo confirma
3630720	3632680	porque están alimentando un periodista deportivo
3634280	3634980	están
3635800	3638520	están salvando familias boludo
3638520	3640880	o sea por cada tweet
3640880	3642840	que venda humo sobre boca
3644500	3646740	el pollo viñolos llega a la casa y dice
3646740	3647860	familia hoy se come
3647860	3650200	e imagínense los pollitos llorando
3650200	3651860	a punto de morir
3652840	3653240	diciendo
3653860	3654880	gracias papa
3654880	3657860	nos hemos salvado otra vez
3658880	3659860	a cada
3659860	3661760	decían se rumorea CR7 está
3661760	3663080	mirando con ganas la bombonera
3664100	3665540	CR7 quiere un final
3665540	3668160	épico para su carrera
3668940	3669680	Cristiano
3669680	3671860	Ronaldo va a dirigir la reserva de boca
3674220	3676180	yo escuché lo mismo
3676180	3678160	yo escuché lo mismo
3678160	3680260	el mercado de humo
3680260	3682180	salva al mundo nunca hay que enojarse
3682720	3684620	con el humo el humo tiene un propósito
3685540	3686180	sagrado
3686180	3688540	el humo hace girar las
3688540	3690180	manivelas de la argentinidad
3690820	3692200	cuando cada argentino
3692200	3694200	llega a su laburo y tiene que pasar
3694200	3696180	tiempo con esas otras personas que desprecian
3697180	3698460	necesita decir
3698460	3700040	viste lo de Cristiano
3700040	3700580	a boca
3702180	3704140	en eso se basa toda nuestra sociedad civil
3704140	3705840	si no sacas eso
3705840	3708140	el estado argentino se cae a pedazos
3708880	3710820	protect the smoke
3710820	3712400	at all costs
3712400	3714000	cada vez que aparece alguien a decir
3714000	3715000	no lo de Cavani
3715000	3718320	que decís si yo lo vi
3718320	3719920	yo hablé con Cavani
3719920	3722600	y tengo el pub de Aleverco
3723360	3724000	cagón
3724000	3726040	tengo el pub y te puedo decir
3726040	3728520	con total certeza que CR7
3728520	3730140	es el nuevo reemplazo de Ibarra
3730680	3732140	quiere arrancar como DT
3732140	3734080	se está rumoreando
3734080	3735040	está pasando
3735040	3736680	y en cada
3736680	3738540	ya me voy
3739320	3742140	en cada vuelta de humo
3742920	3744160	que asciende
3744160	3746320	la Argentina compatriotas
3746320	3748460	por cada discusión crece la Argentina
3748460	3750820	por cada trompada somos más fuertes
3750820	3752140	por cada solemne que nos bardea
3752660	3754620	el cuero se nos hace más duro
3754620	3756280	por cada nuevo insulto
3756280	3757920	hacemos un mejor meme
3757920	3759820	por cada uno que se ofenda
3759820	3761940	nos reímos más y más fuerte
3761940	3764700	porque nuestro reinado será largo
3764700	3766680	ya tuvieron su etapa ellos
3766680	3768100	se viene un ciclo
3768100	3769340	de hegemonía nuestra
3769340	3771780	y después nos van a patear en el piso
3771780	3773720	como corresponde
3773720	3775240	las nuevas generaciones
3775240	3777780	las que ahora tienen 10 u 8 años
3777780	3779400	todavía demasiado estúpidos
3779400	3780940	para contradecirnos
3780940	3783440	ustedes son demasiado viejos para ganar
3783440	3785080	no llegan con el aeróbico
3785080	3787660	citará residente cuando están asustados
3787660	3789660	y los chicos todavía son muy chiquitos
3790220	3792700	tenemos unos 10-15 años sólidos
3792700	3795020	10-15 años son nuestros
3795020	3796700	chau agoveros
3796700	3797880	chau
