start	end	text
1217820	1219560	Y ese es el lente con el que miro todo.
1219840	1221460	Y ese es el lente con el que voy a vivir
1221460	1223000	el superclásico también.
1223000	1226000	Es también el proceso...
1228340	1230240	Para que sea una apuesta real tiene que doler.
1231440	1232100	Y puede ser.
1232380	1233620	Yo perdí 30K.
1233700	1234700	Dice el chiqui.
1234740	1235660	Uh, chiqui.
1236580	1237900	Chiqui, vos sos de Racing.
1238480	1240800	La tenés súper adentro, chiqui.
1241180	1243440	Chiqui, la tenés muy adentro.
1243660	1245400	Eso es algo que quería pasar un momento
1245400	1246780	y decirte que acá te leo en el chat.
1247540	1248820	Pásame, Maxi, pasame un audio más.
1248960	1250100	Y dígame también de qué quieren hablar.
1250460	1251280	¿Todo bien?
1251740	1252020	Bien, vos.
1252020	1254120	Yo creo que me sorprende sinceramente
1254120	1256480	en los casinos y en los bingos
1256480	1259480	es la cantidad de gente de tercera edad que hay.
1259540	1259840	¿Y si?
1259840	1263020	Yo creo que si mañana se cierran todos los bingos
1264060	1266000	todos los jubilados van a llegar a fin de mes.
1267920	1271780	El problema era ese, no el 82% móvil, ¿no?
1272000	1274020	O sea, era, digo, che, nadie está viendo...
1274700	1276580	O sea, todos se concentran en su ingreso
1276580	1280460	y nadie pone una ficha en el egreso de los jubilados.
1280460	1284460	O sea, el mercado jubilado mueve muchísimo, Aguita.
1284860	1286900	Se dió una gran propuesta de campañeta, como
1286900	1289620	basta de creer en los viejos, ¿sí?
1289920	1292600	Los viejos se la están patinando todas.
1293240	1293880	Agarra...
1293880	1295780	Oh, por favor, estoy viejo.
1295940	1297100	¡Taca, el casino!
1297300	1297920	¡Pa!
1297940	1298580	¡Tomá!
1298700	1300000	¡La concha de tu hermana!
1300780	1301840	¡Tengo 90 años!
1301940	1302680	¡Taca, taca!
1303760	1304460	¡Bingos, papá!
1306540	1307680	Pasá, pasá, nomás.
1308680	1311680	Che, reborte, tenés que posicionar en contra de las apuestas, viejo.
1312200	1315380	Es la máquina ganándole al hombre de manera definitiva, ¿eh?
1315920	1320780	Es un fenómeno antropológico no suficientemente tratado
1320780	1322800	y es hora de tratarlo ahora.
1323500	1325360	¡Qué compleja que está la máquina!
1325520	1327120	¿Leyeron una nota de Harari?
1328020	1329060	Estoy con esa estos días.
1329220	1330180	¿Una nota de Harari?
1331080	1331760	¿Lo tienen Harari?
1331760	1338000	Filósofo, teólogo, no sé qué, ciencia israelí, ciencia judía, parágrafo judío.
1338660	1342760	Y el chabón tiene esta tesis en la cual las máquinas finalmente hackearon
1343640	1348800	el sistema de la humanidad, el sistema cultural.
1349260	1350060	¿Por qué él dice?
1350160	1356780	Es la primera vez que algo no humano está adquiriendo capacidad de narrar lo humano.
1357180	1358200	Capacidad narrativa.
1358500	1360700	Una cosa es una máquina con un fin instrumental.
1360700	1363200	Otra es una máquina que puede contarte una historia.
1363680	1366640	Porque, por definición, lo único indelegable es nuestro propio relato.
1366740	1368160	Es narrarnos a nosotros mismos.
1368480	1370480	Algo que siempre estuvo entre potestad de hombres.
1370960	1374740	Harari dice, es la primera vez que hay una máquina lo suficientemente sofisticada
1374740	1377600	para crear unidades de cultura.
1377960	1380280	Y en esas unidades de cultura establecer relaciones.
1380620	1384140	Y esas relaciones pueden ser muy íntimas, si te lo pones a pensar.
1384480	1385560	Relaciones de confianza.
1385760	1388720	Y él dice, así es como el humano ha construido su componente gregario
1388720	1391160	durante toda su historia como especie.
1391640	1395040	Y recién ahora hay algo que puede narrarlo afuera de sí mismo.
1395720	1401440	Esto para mí, que soy un narrador, que soy un juglar del siglo XXI,
1401560	1404660	yo que soy un trovador popular, me parece terrible.
1405280	1408580	Porque al mismo tiempo no deja de ser la construcción de Dios.
1409020	1413640	Porque vos fijate que la legitimidad de la mayoría de los textos sagrados
1413640	1418820	proviene justamente por, en teoría, ser letra no humana.
1419120	1421340	Ser letra de algo de otra especie.
1421760	1426380	Y es la primera vez que algo tendría la capacidad de narrarnos en nuestro código
1426380	1428480	pero que no es humano a la vez.
1429960	1436740	Entonces estamos en el albor, en los albores de un terror existencial desconocido.
1437240	1441920	Estamos a las puertas de que algo cambie en términos epistemológicos
1441920	1443120	para nuestra especie.
1443540	1444960	Full Westworld, dice acá.
1445220	1448480	Exactamente, Full Westworld, antes de que la cancelen la temporada.
1448840	1450960	La creación de Dios en términos predictivos.
1451120	1455240	Una idea también muy borgeana.
1455600	1457640	Juan Manuel Russo pone, ¿esto es footboard?
1459740	1463940	Disculpen, estamos hablando de curry, ¿no?
1465180	1468200	Estamos hablando de los puntos de curry en el Game 7.
1468320	1469160	¿Sí? Puede ser.
1469260	1471100	Hay algo ahí. Hay algo ahí definitivamente.
1471100	1473740	Quiero decirles una cosa más. Quiero decirles algo más.
1474660	1476880	Hice la tarea como agovero.
1477040	1478820	¿Qué debe hacer un agovero?
1479880	1482880	Detectar cuando y dónde hay algo ahí.
1483200	1485860	H-A-A. Hay algo ahí. Hay algo ahí.
1486140	1491600	Es en teoría para lo que ustedes, manga de hijos de puta, fueron creados, fueron construidos.
1491740	1494340	No para intentar ponerla entre ustedes.
1494800	1499460	¿Qué se piensan? ¿Que no los ve el resto de Twitter tirándose onda?
1499460	1500320	¿Eh?
1500620	1510160	¿Que no ven a Agob, Habermas comentando algo a Agob, la única mujer?
1511500	1514180	Poniéndole, hola, ¿qué haces hoy viernes a la noche?
1514220	1517640	Eso no es un diálogo entre Habermas y Agob, la única mujer.
1517920	1524960	Entonces, si desplazan un poco esa profunda soledad que habitan, van a recordar su fusión originaria.
1525240	1527460	Que es detectar ciencia y verdad y producir doctrina.
1527660	1531700	Así que yo hice la tarea y les quiero traer algo.
1531920	1533780	Les quiero traer algo que detecté.
1533940	1539420	Hace no tanto la semana pasada, ¿cuál fue el día que hubo una corrida, una buena corrida financiera?
1539480	1542380	Una solid ass corrida financiera.
1542600	1544860	No me acuerdo qué día fue, pero fue la semana pasada, ¿no?
1545120	1546540	Una buena corrida financiera.
1546760	1547400	Me di cuenta de algo.
1548360	1549660	Detecté con mis agobantenitas.
1553640	1555760	Detecté a todo esto y esto lo hacen todos los agoveros.
1555760	1556660	Los agoveros somos seres sintientes.
1556880	1559080	Somos seres extremadamente sensibles.
1559320	1566820	Todo agovero tiene antenitas que pasan y sale y detecta los espíritus subyacentes en su tierra, en el suelo que ama.
1567540	1568320	Detecté esto.
1569440	1581480	Un día de corrida financiera es metafísicamente indistinguible de un día en el cual pierde la selección argentina por goleada o un partido que no debería perder.
1582840	1584760	Atención, síganme ahí.
1584760	1589660	A la sociedad civil anímicamente les pasa lo mismo.
1590260	1591940	Atención, sigan conmigo.
1592160	1593400	Un día de corrida.
1593540	1595180	¿Qué es un día de corrida, por definición?
1595380	1597340	Un día de pérdida de activos.
1597780	1601040	Un día donde la mayoría de la gente está nerviosa y de mal humor.
1602520	1605400	Remóntense al primer partido mundial con Arabia Saudita.
1608060	1613880	La calle se siente exactamente igual.
1614980	1623680	El día que Argentina perdió con Arabia Saudita fue metafísicamente igual que una corrida financiera.
1624140	1626720	Hay algo ahí, atención, y vamos a empezar.
1627400	1628740	Atención, atención.
1629880	1632400	Primero, o sea, sintomatologías similares.
1634160	1639180	Primero, miedo, enojo, tristeza e incertidumbre.
1639920	1643840	Es un día donde la mayoría de interacciones interpersonales salen un poco mal.
1645460	1649900	Donde agarras y tu amigo te peleas.
1650180	1650920	Te peleas.
1651180	1654860	O sea, el día que perdí con Arabia te peleas con tu novia, te peleas con un amigo,
1655080	1656640	salís a la calle y alguien te putea.
1657160	1660080	Día de corrida, los grupos de WhatsApp están raros.
1661720	1665020	Máxima información, todos están muy nerviositos.
1665280	1667520	Todos en modo no rompan las bolas.
1668100	1671240	Segundo síntoma, muy buenos memes.
1673600	1679640	Ambos días metafísicamente son días ideales para contribuir a la histeria colectiva de Twitter.
1680000	1687580	Mirad Twitter, son días paradójicamente muy nerviositos y muy divertidos a la vez.
1687580	1691500	Son días donde uno está como en una suerte de éxtasis nervioso al mismo tiempo.
1691720	1694280	Y ahora viene la tesis tres, está la más polémica.
1694460	1697220	Pero por favor, a gobernos y a gobernas, tenganme paciencia, hay algo ahí.
1697980	1700940	Un poco al argentino le gustan esos días.
1702700	1706560	Un poco al argentino le gustan esos días.
1707620	1711460	No estoy diciendo, qué lindo una corrida financiera.
1712180	1716780	¿Se entienden? No estoy diciendo, oh, mirad, problemas de ladera llena.
1716780	1718760	No, son una mierda.
1719040	1725660	Otro paralelismo, tanto en Arabia Saudita como en corrida financiera, todos perdemos plata, salvo cuatro o cinco que hicieron negoción.
1726660	1732980	Otra, hay un hijo de R1000 puta que le jugó dos palos a Arabia Saudita y está como diciendo, sape.
1733340	1739160	Y la corrida es lo mismo. Nunca entendés bien cómo hay alguien que vos no conoces haciendo mucha plata con eso.
1739500	1743540	Hay alguien que tiene su sueldo dolarizado y dice, sape.
1743540	1746280	Es lo mismo, es el mismo estado anímico.
1746640	1752280	¿Y saben por qué digo que un poco al argentino le gusta ese día?
1752600	1758380	Porque hay algo que conecta en la fibra supervivencial del argentino que se activa.
1758760	1761940	Y el argentino se pone en survival mode esos días.
1762680	1767540	Tanto cuando la fibra argentina pierde vibra, catástrofe, que salen, o sea,
1767540	1773700	Nunca hay mejor día que una catastrófica derrota de la Argentina y que una corrida financiera para un tachero, por ejemplo.
1774680	1778620	El tachero hace, tachero mode activated.
1779480	1785880	Y el chabón dice, hoy se labura fuerte. Va a hablar con todos los pasajeros que suban.
1786060	1789300	¿Viste cómo está la cosa, pa? No se puede creer.
1789380	1793180	Y al mismo tiempo, yo esto, ya lo viví, hijo de puta.
1793180	1797580	Se pone en modo argentino. Argentino activa survival mode.
1797940	1802600	Agarra y dice, ¿por qué esto no lo puede entender un sueco?
1802880	1813180	Jamás entendería la mezcla entre vértigo y adrenalina de que te llame un familiar más 60 y te diga,
1814380	1815480	Comprá tú un, Tommy.
1816600	1817000	¿Cómo?
1818780	1819960	¿De qué estás hablando?
1822140	1823800	Yo esto ya lo viví, Tommy.
1824460	1828220	Haceme caso, compra atún, hijo de puta.
1828560	1831960	Y voy a decir, che, factor uno, no como tanto atún.
1833220	1835340	O sea, ni siquiera siento que estoy resguardando mi capital.
1836540	1838960	Si lo conservo, tampoco tendría quién vendérselo.
1839780	1843780	O sea, no sé quién me va a después comprar ese atún a precio actualizado.
1844100	1847240	Sé que no lo voy a comer y solo voy a tener mucho atún.
1847240	1849380	O sea, ¿por qué haría eso?
1849660	1851460	¿Cómo se nota que no lo has vivido, hijo de puta?
1851880	1853880	¿Cómo se nota que no hiciste la colimba, boludo?
1854660	1857520	¿Qué tiene que ver? ¿En la colimba compraban atún?
1859160	1860460	Gil, Gil.
1860720	1863700	El argentino se pone en survival mode.
1864080	1866620	Santiago Sotelo dice, all in tirapostas.
1867000	1868460	Los audios de ese día.
1869360	1871280	Ta, ta, ta, ta, ta.
1871380	1872360	Es día de corrida.
1872740	1873800	Es día de corrida.
1873800	1875060	Te despertás y decís.
1875420	1875820	¡Uy!
1876100	1877140	¡Metele que hay corrida!
1877460	1878340	Ta, ta, ta, ta.
1878500	1879040	Salía a vender.
1879220	1879600	¿Vender qué?
1879680	1881120	No, no, no, no tengo nada.
1881460	1882180	Vendé, vendé.
1882420	1882980	Mové la guita.
1883280	1883940	Mové la guita.
1884180	1886260	Solo estoy perdiendo poder adquisitivo.
1886420	1886880	Nada más.
1887080	1887920	No hay nada que pueda hacer.
1888080	1888520	¿Qué hacemos?
1888620	1889100	¿Qué hacemos?
1889540	1890300	Tu novio.
1890500	1891440	Entra tu novio a tu casa.
1891600	1892160	¿Qué hacemos?
1892480	1893000	Che, ¿qué hacemos?
1893140	1893740	¿Algo hay que hacer?
1893900	1894380	No sé.
1894540	1895160	Hagamos algo.
1895360	1898120	Para que mande un audio a Pepito que sabe.
1898180	1898860	Pepito la mueve.
1898920	1899800	Tiene bitcoin.
1900800	1903360	Pepe, ¿qué es lo que hacías vos?
1903680	1905360	¿Cómo tenés criptoactivos?
1905880	1906440	Tranca.
1907320	1909040	Me cruzo un tweet de más latón.
1909320	1910200	Esto es bullish.
1910560	1912020	¿Cómo que es bullish, Carlos?
1912760	1914560	¿Cómo que es bullish, Carlos?
1915080	1916620	Mi sueldo vale la mitad.
1917380	1918440	Estoy confundido.
1918600	1919240	Otro tweet.
1919640	1920560	Sos un boludo.
1920980	1921940	No entendés.
1922300	1924260	Está muy bearish.
1924580	1925240	Ta, ta, ta.
1925360	1927240	El sueco no lo entiende, papá.
1927640	1929040	El sueco no lo entiende.
1929040	1932320	El sueco agarra y dice que la mayoría vale cuánto.
1932440	1932700	¿Cómo?
1933120	1935100	Tenemos siete tipos de cambios, sueco.
1935340	1935740	Pa.
1936040	1937220	Paliza táctica.
1937660	1938780	¿Cuánto está el MEP?
1940440	1941800	Uy, mirá la que tiró masa.
1942060	1942920	Atajate este tweet.
1943280	1944380	Taca, taca, taca, taca, taca.
1944800	1946860	Hay algo ahí.
1947780	1950020	Chavo, yo ese día era Billy de Last of Us.
1950300	1951480	Me metí en el bunker.
1951920	1952600	Ese es otro.
1952880	1954860	Salen los gordos apocalipsis.
1954960	1955940	Ha llegado.
1958040	1959000	El argentino.
1960340	1960940	El gordo apocalipsis.
1961900	1964400	No, la verdadera categoría de tuiteras es el gordo se viene.
1964780	1967120	Es el mejor día para los gordos se viene.
1967480	1968340	Los gordos se viene.
1968440	1969340	Están todo el mes así.
1969740	1971500	Diciendo, ¿hoy cuánto está el dólar?
1972020	1972680	Uy, su madre.
1972760	1973360	Lo mismo que ayer.
1974420	1975540	Te países una verga.
1976200	1977360	Te países un embole.
1977820	1978760	Estabilidad financiera.
1978780	1979440	¿Para qué?
1979780	1980360	¿Para qué?
1980660	1982360	Y, en cambio, cuando arranca.
1982360	1985360	Cuando con soda recontranfría.
1986420	1987380	Dólar catarpa.
1987580	1988860	De repente aparece uno tipo.
1989180	1992260	Che, están muy baratos los vuelos a Río de Janeiro.
1992680	1993380	Están muy baratos.
1993540	1994100	Hay una anomalía.
1994180	1994920	Hay que sacar ahora.
1995320	1995460	Para.
1995660	1997620	No me puedo pedir vacaciones.
1997780	1998580	No entiendo cómo haces.
1998900	1999500	Saca ahora.
1999920	2000640	Taca, taca.
2001000	2001960	Estás muy bearish.
2002140	2003160	No la estás viendo.
2003400	2004160	Hijo de puta.
2004420	2005900	El gordo se viene ahí y sale.
2006380	2008140	Hace criptonegocios.
2008720	2009440	¿Tenés wallet?
2009660	2010760	¿Qué es una wallet?
2011300	2015080	Esta billetera se la compré un linchera hace 5 años.
2015940	2016900	Esta es la wallet.
2017100	2019440	¿Lo estás diciendo en inglés por algún motivo que no entiende?
2019880	2020800	No entendés.
2021180	2022560	Estás muy bearish.
2022580	2024580	Los shorteados.
2025340	2026660	Yo no entiendo nada.
2027120	2028000	Yo esos días.
2028480	2029780	Hace ya varios años.
2030420	2031760	Yo hace varios años que ya me resigné.
2032600	2034360	A que no voy a.
2034940	2036200	Para mí es lo mismo que el casino.
2036440	2037620	Fíjate cómo hay una conexión.
2037800	2038540	Para mí es lo mismo.
2038840	2039520	Hay algo ahí.
2039520	2041160	Los días esos yo se digo.
2042060	2045520	Hoy voy a ser más pobre a la noche que a la mañana.
2047380	2047480	Fin.
2048120	2050060	Ese es mi thrill.
2050520	2052300	Pero qué divertidos son esos días también.
2052760	2053980	Los memes que circulan.
2054180	2054520	Los taca, taca.
2054620	2057000	Si hay audio acá, mandame nomás.
2057800	2060080	Adhiero totalmente al diagnóstico de la semana.
2060780	2063120	Y agrego que el argentino no le gustan.
2063260	2065000	Los necesita a los días así.
2065560	2067840	Necesita día donde pueda decir después.
2069000	2071060	Primero hay que saber sufrir.
2071400	2072540	Sí, sí, sí.
2072940	2074720	El argentino está sobre adaptado.
2075080	2078020	Son las crisis que después hacen que cualquiera de nosotros vaya a España.
2078360	2080000	Y se los garcha a todos esos muñecos.
2080380	2081080	Eso es real.
2082660	2083360	Eso es real.
2083500	2085060	Cuántos españoles puedo ofender.
2085380	2087360	Con este clip.
2088080	2088420	O sea.
2089980	2091000	Hostia, tío.
2093800	2096040	Joder, este reborsica es la leche.
2096040	2097860	Me hace reír mucho.
2098520	2101080	Por eso cualquier argentino puede migrar a cualquier lugar del mundo.
2101480	2102280	Y cuando llega.
2102540	2104480	Pasa cuatro días lavando copas.
2104740	2106820	Y después dice, disculpame, Manolo.
2107100	2108240	¿Cuántos tipos de cambio hay acá?
2109000	2110660	¿Tipo de cambio? Hostia, joder.
2110700	2111540	¿A qué te refieres?
2111860	2113940	El esquema Ponzi que me voy a hacer acá.
2114140	2115220	Dicen lava copas.
2116360	2118860	Manolo, ¿querés invertir en una oportunidad única?
2120200	2121160	Oh, chaval.
2121700	2123260	Hostia, que suena bien lo que me dices.
2123260	2125260	La verdad es que creo que es una gran oportunidad.
2126300	2127600	¿Me podás hacer?
2127880	2129540	Joder, gilipollas de rico.
2130060	2130520	Sí.
2131640	2132200	Podés.
2132640	2135460	Es un agobpeso, Manolo.
2136520	2137260	Es un agobpeso.
2139120	2140380	Pero estás medio veris.
2140600	2141980	Te veo cara veris.
2142200	2143720	Tenés que estar bulis, Manolo.
2143960	2146920	Es así. El argentino está hecho para ese survival mode.
2147400	2149340	En el que se
2149340	2150340	renueva.
2150340	2151720	En el que se renueva.
2152700	2154340	Pásame audio si hay
2154340	2156160	del argentino en crisis.
2157380	2158500	Rebord, yo vivo en
2158500	2160280	Canadá y la estabilidad
2160280	2162340	económica que se vive acá es agonizante.
2166320	2167880	Es insoportable.
2168620	2169980	Es insoportable.
2171020	2172040	Es insoportable.
2172920	2174500	Un día en Canadá
2174500	2176780	se despierta.
2176780	2177940	Oh.
2178480	2179940	Hace un poco de frío acá.
2180280	2181020	En Ontario.
2183200	2183800	Oh.
2184340	2186660	Hola mi vecino canadiense. Hola.
2187500	2188420	Los imagino medio
2188420	2190060	nomadopésicos a los canadienses.
2190520	2192360	¿Qué hay de nuevo? Nada.
2193660	2193980	Nada.
2194160	2195880	No pasó nada de ayer a hoy.
2196020	2197420	Nada. No.
2198100	2200660	Bueno, hablamos a la noche y te juntás
2200660	2202420	y decís ¿qué hay? No hay nada.
2202860	2204260	Absolutamente no pasa nada.
2205120	2206260	No hay absolutamente nada.
2207300	2208140	Stable board.
2208640	2210200	Argentina hago mano.
2211840	2212500	Maxi, perdón.
2212560	2213440	Me dijiste que había más.
2214560	2215440	A ver, pásame.
2219160	2220660	Rebord, sí, vos sabes que te estás
2220660	2221920	escuchando duchándome
2221920	2224600	y corté la ducha. Igual ya había terminado.
2224800	2225560	Para decirte sí.
2225880	2228500	No sé, cuando fue lo de los ministros el año pasado
2228500	2230220	mi vieja agarra, frenó
2230220	2231700	la conversación y dice
2231700	2233420	y sí, Mauri,
2234340	2235520	bienvenido a la Argentina.
2236080	2237960	¿Qué? Y tenía razón
2237960	2240040	y estaba buenísimo, era re divertido.
2240200	2241760	De pronto, vos no sabías
2241760	2243840	si en media hora iba a seguir existiendo el
2243840	2244360	gobierno.
2245400	2247620	El argentino, como dijo el otro compañero,
2247660	2249620	lo necesita. Sí, papá.
2250360	2251680	El juego cambió.
2251840	2252460	Es lo mismo.
2253820	2255840	Y yo creo que evidentemente hay algo
2255840	2257840	de nuestras crisis cíclicas.
2258040	2259860	O sea, si en 20 años
2259860	2261400	si estuviéramos con celebra estabilidad
2261400	2263620	20 años, por el valor
2263620	2265540	cultural que representa para el argentino,
2265820	2267780	quien llegue al gobierno debería generar una
2267780	2269420	crisis de proporciones sin precedentes.
2270020	2271800	Porque todos nosotros generacionalmente también
2271800	2273680	tenemos derecho a decirle a una nueva
2273680	2275240	generación, bienvenido,
2275440	2276800	esto es Argentina.
2277740	2279620	Anda acostumbrándote, hijo de puta.
2280040	2281080	Está shorteado.
2281560	2283780	Y por agarrar tener un pibe y decirle
2283780	2285440	che, ¿te acordás tus ahorros?
2285500	2288040	Lo que teí para tu cumpleaños. Sí, te lo saqué.
2288040	2290320	Lo cambié a dólar y lo vendí
2290320	2291620	y lo perdí.
2291760	2293460	¿Qué? ¿Cómo, papá?
2294120	2296200	¿Cómo que perdiste todo lo que era
2296200	2298080	mi plata? Bienvenido a la Argentina, hijo de
2298080	2299800	puta. Esta es tu primera lección.
2300120	2302160	La concha de tu madre. En Argentina,
2302320	2303620	cocodrilo que duermes cartera.
2304040	2305700	Y vos estabas durmiendo, bobo.
2305940	2307200	Papá, tengo cinco años.
2308180	2309820	Papá, tengo cinco años.
2311320	2312440	Se me acaba de caer un diente
2312440	2313980	y me habías explicado a la mañana
2313980	2315200	que viro el ratón Pérez.
2316080	2318420	A las 10 a.m. había venido el ratón
2318420	2319820	Pérez y yo tenía
2319820	2322280	un billetito bajo mi almohada.
2322700	2323960	Ese billetito no está más.
2324460	2325400	Avispate, Gil.
2325740	2327880	¿Qué estás tomando de la leche? ¿Qué son las 16 horas?
2328280	2330160	Ah, tomó una siesta el señorito.
2330940	2331820	Jaja, siesta
2331820	2333640	con los mercados abiertos.
2333820	2335800	Ah, bueno. No, para que el pibe me salió
2335800	2337000	finlandés, el hijo de puta.
2337500	2339100	No, tuve, tuve un hijo.
2339380	2340740	Tuve un hijo, pero es noruego.
2341020	2342160	El boludo este.
2343180	2344540	Papá, manda mensaje
2344540	2345460	a su grupo de amigos.
2345740	2347920	¿Sabes lo que hizo el boludo de mi hijo en plena corrida?
2348380	2350120	Pegó una siesta. Ah, bueno.
2350620	2352580	No, devuélvelo.
2353560	2354040	Devuélvelo.
2354460	2355520	Pasame audio si tenemos.
2356300	2358080	Rebor, querido, te está faltando el condimento
2358080	2359240	más especial de esos días.
2359660	2361660	Ese audio que llega por WhatsApp con el lema
2361660	2363880	de reenviado muchas veces que dice
2363880	2366120	que el primo del conocido
2366120	2368000	del tío que se lo reenvió, la hija que
2368000	2370460	labura con alguien del adentro del barco central
2370460	2372320	que van a tomar todos los dólares
2372320	2374460	y te reenvía tu abuela, tu tía, tu amigo
2374460	2376660	y alguien lo manda al grupo y dice, che, me llevó esto.
2376720	2378620	Y antes de consultar por los dos, lo reenvió
2378620	2379300	siete veces.
2379700	2382580	Sí, sí. Por eso
2383020	2384500	es peak performance
2384500	2386320	de los tirapostas ese día.
2386740	2388480	O sea, los días de corrida en Argentina
2388480	2390440	son días para los gordos se viene,
2390920	2392620	para los tirapostas y para los
2392620	2394340	agoreros del apocalipsis. Todos ahí
2396220	2396660	hacen...
2396660	2398560	Vamos, muchachos, que salimos a jugar.
2398560	2400020	Hoy se juega fuerte.
2400360	2403180	Taca, taca, audio, audio, audio, audio.
2403400	2404440	Comprale licks.
2405100	2406620	¿Qué es una
2406620	2408040	lelick, tía?
2408640	2409820	¿Vos no sabés qué es?
2410100	2412420	Yo no sé qué es. No sabemos
2412420	2414940	cómo se usa. No puedo comprarla.
2415120	2416120	¿Tenés cuenta comitente?
2417320	2418660	¿Qué? ¿Tenés cuenta
2418660	2420240	comitente o no, boludo?
2421380	2421940	Audio.
2422420	2423820	Contestarle el audio a la abuela.
2424180	2426640	Y aparte, en la generación de los sabios de la
2426640	2428440	Argentina, todos las vivieron.
2428700	2430840	Y vos, siempre que accedes a una, podés decirle
2430840	2432600	al otro, yo la viví, papá.
2432720	2434680	Yo la viví. Comprá
2434680	2436500	a Tun, hijo de puta.
2437080	2438740	Y el tío que dice se viene.
2439240	2440800	El argentino está con la borde alta.
2441260	2442360	¿Arrancaron los saqueos?
2443580	2444800	Muchachos, ¿ya eligieron su chino?
2444900	2446120	No. ¿Cómo? Pará.
2446880	2448460	¿Qué está diciendo? ¿Cómo?
2449420	2450720	¿Ustedes los eligen?
2451500	2452620	No podés ir al que vas
2452620	2454120	siempre. ¿Pensaron eso alguna vez?
2454120	2456540	No podés ir al...
2456540	2458300	No podés ir al que conoces.
2458600	2460340	Habría que organizar un sistema.
2460960	2462180	Tendríamos que tener una saquea.
2463160	2464300	Vos te metés
2464300	2465900	como un Tinder de saqueos.
2466140	2467740	Vos te metés y te cruzas de chino.
2468460	2470360	Entonces, si vos vivís... O sea, vas a
2470360	2472620	tener que ir al chino de otro barrio porque la verdad que es
2472620	2474560	engorroso. Es una situación socialmente
2474560	2476160	super awkward. ¿Te imaginas?
2476580	2477780	Vos vas.
2478040	2480640	Lo que hagas choreando a tu chino de confianza.
2480880	2482100	Pero lo que hagas choreando mal,
2482100	2483960	le sacás todo lo que tiene
2483960	2486240	y al otro día la cosa se estabilizó
2486240	2488300	y volvés y decís...
2488300	2489100	¿Cómo está Juan?
