start	end	text
2878660	2884940	hacer. Solo nunca voy a renunciar a mi derecho inalienable como argentino de decir, hermano,
2884980	2891000	esto es una locura lo que está pasando. Nada tiene sentido. Pedazo de sipayo, hijo de re-mil-puta,
2891980	2900240	boludo. La tenés hervida. Me pone nervioso. Me pone nervioso como director técnico. Tenés el arco
2901320	2907840	vacío. Democracia, sí o no. O sea, digamos. ¿Van casa los putos? Depende si son castores o elefantes.
2908580	2914480	¿Te coges a tu hermana? No. Lo voy a sacar en un flyer. No me cojo a mi hermana. No me jodas con
2914480	2919140	el cuarteto. ¿Qué opinás de Thatcher? O sea, digamos, bueno, nos tocó en una guerra. La gente
2919140	2925780	hace cosas raras en las guerras. ¡Criminal de guerra! ¡Criminal de guerra! Hermano, boludo,
2926500	2933240	su línea de apertura. ¿Esto es por Argentina ya? A nadie le importa masa. A nadie le importa masa.
2933820	2938880	Ni a masa le importa. A nadie le importa masa. El debate todo se trata de mi ley. Usó todo el tiempo
2938880	2942160	para preguntarle cosas a mi ley. Yo hubiera hecho lo mismo, pero porque me resulta fascinante.
2942760	2949520	¿Qué pensás de esto, Javo? O sea, digamos. Es el mejor podcast de la historia. Es el mejor podcast
2949520	2958760	de la historia. ¿Y esto? ¿Estás de acuerdo? O sea, digamos. I mean, let's say. Es una locura.
2959040	2964720	Es una caja de sorpresas. No sabes qué respuesta puede salir. ¿Cómo no va a ser fascinante de mirar?
2965820	2973220	¡Es una locura, boludo! ¡Es una locura! ¿Clonarías? ¿Harías esto? ¿Harías lo otro?
2973600	2980100	Mirá, Federico Cavallo gastó 20 pesos en decir el maga de hoy es una garcha. ¡Sos un boludo! ¡Sos un
2980100	2986220	boludo! Todos ustedes son boludísimos. Yo quiero agradecerles por este tiempo de locura absoluta
2986220	2991500	en la República Argentina. Por supuesto, estamos en la recta final y ahora ya, ¿viste? Entre
2991500	2997300	argentinos nos entenderemos, entre personas que quieran a su país a groso modo y que no estén,
2997860	3002780	no sé, no les parezca normal clonar animales, más o menos nos entenderemos. Y si la República
3002780	3010560	Argentina acompaña otra propuesta que no le gusta Malvinas y quiere reivindicar a Mbappé y quiere
3010560	3015940	que Boca no gane la copa y sacara a los negros de mierda donde sea que haya que sacarlos y colgar
3016000	3021360	fiches mientras se violan un gordo bien morocho para aclarar a quién se están cogiendo y a quién
3021360	3029340	no. Por ese lado, no pasa nada, no es un problema. Lo que queda es la parodia, son los ciclos
3029340	3034840	acelerados y me parece que en esta recta final se puede uno dar un tiempito para agarrar y decir
3034840	3041460	qué raro que está todo, qué extraño cómo hemos llegado hasta acá. Yo voy a volver a repetir algo
3041460	3046140	que he dicho durante todo este año. Para mí el desempeño electoral del peronismo este año y
3046140	3053020	después de este gobierno hoy es un milagro. Es un milagro que el peronismo esté en balotage.
3054560	3062260	Es un milagro. Esta elección estaba perdida para el peronismo. El amplio consenso mayoritario en
3062260	3067820	la República Argentina no quiere la continuidad de un oficialismo que ha fallado en cumplimentar
3067820	3075640	sus propias expectativas. Yo eso lo sigo pensando. Hay un solo motivo por el cual el peronismo está
3075640	3086280	en balotage. Ustedes. Es el único motivo. El único motivo por el cual el peronismo hoy por hoy está
3086280	3094380	en balotage es porque ha habido una suerte de supervivencia del más inepto que ha llevado a
3094380	3101900	las peores fórmulas narrativas a ser la primera línea de discusión. Y eso es fascinante. El motivo
3101900	3105580	por el cual lo digo con esta liviendad es porque ya es demasiado tarde para hacer cualquier cosa.
3105820	3112800	Ya está. La suerte está echada. Electoralmente se ha cruzado el Rubicón. Vieron cuando César vuelve
3112800	3118600	de su conquista de las Galias y a él le ordenan no ingresar en Roma, no cruzar el Rubicón. César
3118600	3124040	cruza el Rubicón y le preguntan qué va a pasar ahora. La suerte está echada. No importa qué va
3124040	3129360	a pasar ahora. El domingo ya está definido. Lo que sea que va a pasar el domingo ya se definió.
3129600	3135120	Solo queda acelerar y contemplar la absoluta locura en la cual está sumida la República Argentina.
3135800	3140260	¿Se entiende lo que estoy diciendo? Yo solo quiero reiterarles en sus momentos de mayor
3140260	3145920	duda o confusión, el peronismo no debería haber calificado al balotage y solo, solo,
3145920	3152020	solo existe porque cuando le preguntaron a uno de los dos candidatos si banca o no la democracia,
3152020	3158500	dijo, o sea, digamos, depende cuánto lubriques a los niños, el pedófilo se los coge o no.
3159960	3166380	Y alguien dijo, ¿qué? Y eso pasó a una segunda entrevista donde dijo, hey, hey,
3166700	3172340	me están sacando de contexto. Lo que yo quise decir es que el Estado es peligroso como pedófilo
3172340	3180300	en Jardín de Infantes. Y están desnudos los infantes. Ay, ¿por qué? Casi, casi, casi. Y
3180300	3185120	cuando tenés que hablar de diversidad sexual, género, homosexualidad, de cis,
3185460	3189940	cada uno puede cogerse al tipo de animal que quiera, siempre y cuando el animal
3189940	3198520	te firme un consentimiento por escrito. ¿Cómo? ¿De qué hablas? ¿De qué están hablando? ¿De
3198520	3203700	qué están hablando? Timadísimos compatriotas, yo les agradezco por el tiempo compartido,
3203760	3208940	por pasar cada lunes y disfrutar. Realmente desde que estoy en modo basta Tommy, se vive mejor,
3208940	3217180	alubaba y se vive mejor. Y yo como todos los argentinos, realmente como todos los argentinos,
3218680	3225840	estoy hinchado las pelotas. Yo sé que es difícil de entender esto para cualquier sector que en este
3225840	3230580	momento y con mucha justeza y ahora sí respetando cualquier posición ideológica que se tenga para
3230580	3236560	con esto, esté dejando todo por convencer, por persuadir, por entender lo que está pasando,
3236560	3241300	gente que está legítimamente muy asustada y un clima de violencia cada vez más elevado. Hay
3241300	3247480	cientos de motivos de preocupación. Yo en general acá en Maga trato de realmente divertirme un rato,
3247700	3250940	porque no me parezcan serias las cosas que suceden, sino porque me parece que lo más serio a veces que
3250940	3254660	uno puede hacer es reírse de lo que sucede, porque es una forma en la que se transita la vida o al
3254660	3260780	menos es la mía. No tiene por qué ser ni compartida ni tienen que estar todos de acuerdo. Pero sí creo
3260780	3268180	que el ánimo general es hartazgo. Cuando la política se pone muy intensa, la gente se quiere
3268180	3275040	bajar porque está hinchada las pelotas. A mí realmente me gustaría hablar de Shingeki. Me
3275040	3280120	gustaría hablar de Loki. No la vi ahora, no estoy al día. Me vi el último especial de South Park,
3280480	3285620	se los recontra, recomiendo, inteligentísimo. Estoy al día con Rick and Morty. Me gustaría hablar del
3285620	3293440	partido de boca de la otra vuelta. Estoy seguro que hay algo ahí. Me gustaría hablar de un montón
3293440	3300160	de cosas. Urgen algunas cotidaneidades que parece que por inverosímiles uno no tiene que dejar de
3300160	3305520	tratarlas. Aunque sea para volver a recuperar algo parecido a lo que eran nuestros estándares de
3305520	3311700	discusión, hace no tanto. Hace cuatro meses era otro el campo de juego de lo posible en la República
3311700	3318260	Argentina. Y me parece que entre risa y risa uno eso lo puede recuperar de a poquito. Habiendo dicho
3318260	3322760	eso, lo que estoy es hinchado los huevos. Yo realmente creo, yo no sé qué va a pasar el domingo,
3323040	3330840	pero creo que es compartida esta sensación que tengo. Esta suerte de basta, basta, basta baby,
3331340	3338360	basta Tommy. Esta sensación de que vos no podés tuitear del desempeño de Merentiel que tenés 17
3339200	3344880	imbéciles, 17 imbéciles de las fuerzas del retraso aclarándote lo que pasó con lo que sean sus
3344880	3352760	boletas entero violado. No me importa, boludo. La Cámpora estaba así en su peor momento. La Cámpora
3352760	3359100	por lo menos gobernó. Ustedes se saltearon la parte de hinchar las pelotas. Es increíble. Y lo
3359100	3363800	mismo, lo mismo. Un nivel de intensidad insoportable. Así que me parece que por suerte vamos a poder
3363800	3369780	dejar esto atrás como argentinos y argentinas. Por supuesto, lo sabe todo el mundo acá. Yo tengo
3369780	3374380	mi posición, tengo lo que prefiero. Siempre la he puesto por delante, lo he hablado para después
3374380	3380340	agarrar y reírnos de lo que sea que pasa. Pero me parece que lo que va a primar en el electorado es
3380340	3388000	algo no tan analizado hasta ahora porque se calcula esperanza, miedo, expectativa, cambio,
3388000	3395220	continuidad. Nadie está midiendo lo hinchada las pelotas que está la gente. Hay ganas de cambiar
3395220	3403620	de tema. Voy a votar al que me deje cambiar de tema. Al que me deje hacer un maga hablando de
3403620	3411400	Shingeki no Kyojin. Estimadísimos compatriotas, mañana voy a gelatina. El miércoles estoy en par
3411400	3419300	en la mano. El jueves me parece que me invitó Grego que va a combatir con Roberto Galati a las
3419300	3426880	piñas. Voy a ir para allá. La semana que viene en lo que sea nuestro país, en lo que sea que sea
3426880	3433180	nuestro país, me voy a Uruguay. Aparte tengo ese chiste a mano. Puedo agarrar y decir me voy. Me voy
3433180	3438520	a este país. Me voy a Uruguay. Queridísimos compatriotas, gracias por tanto. Sepan que han
3438700	3442620	cambiado las políticas de usos y condiciones en Basta Tomy. Así que nos vemos en redes sociales.
3442660	3450440	Ahora tanto entra Twitter y bloqueo. Es como desmalezar. Es como sacar parásitos de un jardín.
3450920	3456600	Así que gracias por estar un rato acá, por divertirnos. ¿Qué me dicen acá? ¿Vas a gelatina?
3456660	3466100	Sí, lo acabo de decir. Metete al boxeo. No quiero. ¿Qué más hay acá? Búnker el domingo. No tengo
3466200	3473080	ganas. No tengo ganas. Vayan a las imitaciones. Vayan a las imitaciones. Va a haber como 8. 8,
3473100	3478140	9. Vayan al que quieran. Vayan al que quieran. ¿Sabes por qué está acá Rebord? Rebord va a
3478140	3486060	hablar en Maga, loco. ¿Qué hay? 15.600 personas mirando esto. The goat, papá. La cabra. Por eso
3486060	3492560	vienen a Basta Tomy. Y por eso quieren que hable Tomy en algún lugar. Basta Tomy. Nos veremos en
3492560	3496320	Argentina que sea. El lunes que viene. Programa especial. Ahí sí. Maga programa especial.
3497140	3499620	Chao, papá. El dos es Mirko Lapios. Váyase a la concha de su madre.
3503540	3505980	Nacional. Nacional Rock noventa y tres siete.
3513280	3514940	Pogo. El nacional rock.
3517980	3523860	Los viernes desde el auditorio de Radio Nacional. Sumate al Pogo más grande del
