start	end	text
1362660	1366460	grandes galardones de mi vida, se lo quiero contar al movimiento agrobero. Fui reconocido por Myrtle
1366460	1373140	Grand. La foto, esa famosa foto se suscita porque Myrtle me llama, Myrtle me ve y hace un gesto así
1373140	1380480	me dice, vení Tomás, vení. Y hablo con Myrtle y nos sacamos una foto y después también me crucé a
1380480	1387180	Moria Kazan, La One, Mami Mo, que eso fue ya una celebración de otras características. Moria hizo un
1387360	1394160	despliegue performático de gran felicidad cuando nos encontramos. Y de alguna manera eso está solo
1394160	1403820	separado un par de horas de que me empome John Kennedy. John Kennedy, ¿qué mierda está pasando?
1404720	1411300	Yo le digo a mi amigo, no bueno y nos ganó John Kennedy. No ese Kennedy que pensás, este es negro
1411300	1421080	y rubio. Es un negro dorado. ¿Y qué está pasando? Y nosotros ahora en el debate estamos viendo,
1421160	1427100	no se sabe si Myrtle se va a presentar o se vuelve loco. ¿Cómo le fue a Myrtle? Le fue bastante bien,
1427400	1435340	porque no enloqueció. ¿Qué está pasando? ¿Cómo están midiendo las cosas? Me dicen. Tuvo una
1435340	1439720	discusión real con una persona, una discusión real, no tratando de convencer a alguien ni algo,
1439720	1445840	en donde yo le contaba por qué le decían que hablaba con los perros. Y esto es lo que
1445840	1450500	iba a modo de ejercicio. Yo no estaba haciendo una chicana, le estaba contando a un amigo que hoy
1450500	1456660	por hoy la chicana era, bueno y lo gastan porque habla con los perros y dice que habla con Conan
1456660	1463260	y qué sé yo que esto que el otro. Me dice, ¿quién es Conan? No, bueno, Conan es una octava generación
1463260	1474220	de perros clonados que él. Y él me dice, ¿qué? Claro, yo me di cuenta de algo. Vieron lo absolutamente
1474220	1480780	normalizado que está que una persona haya clonado como hay una octava generación de Conans. ¿Por qué
1481260	1487640	eso está dado como normal? Me pasó a mí también. O sea, yo hablando y le digo, a ver, trata de ponerte
1487640	1492920	un poco al día así, es clonado, ok. Esa no es la polémica. La polémica no es que sea clonado,
1492920	1499160	la polémica es si habla, si no habla, si le contesta. Me dice, ¿cómo clonado? Y tiene razón, boludo.
1499360	1509260	Hemos dado como normales una serie de premisas que no tienen ningún puto sentido. ¿Cómo clonás un perro?
1509280	1516460	Porque eso es una opción. Yo puedo clonar al drucio si quiero. Yo puedo clonar a mi gato. ¿Qué significa
1516460	1523480	que una persona tenga un nivel de attachment emocional con un bichito para clonarlo una y otra
1523480	1531460	vez? ¿Qué está pasando? Es una es una premisa de villano de James Bond. Tener un perro clonado. Y
1531460	1537880	eso es normal. No es normal para ellos, para los libertarios, para mi ley. Es normal para mí. Para
1537880	1545140	mí es normal. Discutiendo con alguien, me encuentro a mí mismo diciéndole, no, pero, ay, Dios. Hay que
1545320	1550840	dedicarle todos a estos que se van a vivir a otro lado. Hippies. Sí, bueno, a ver, tiene un perro,
1550960	1555220	octava generación clonada. ¿Cómo clonás un perro? ¿Cómo empezás a clonar un perro? Si yo quiero
1555220	1560440	clonar al drucio, ¿cómo hago? ¿Cómo hago a Marolio el Séptimo? ¿Cómo hago al drucio de Seventh?
1560800	1565600	¿Qué es clonar un perro? ¿Qué mierda está pasando? ¿Cuál es el sistema de decisiones que te tienen
1565600	1572180	que llevar a decir, che, se está por morir mi perro? O no se está por morir mi perro. ¿Cómo pasa?
1573080	1578740	¿Nunca me ofrecieron clonar un perro? ¿Eso es lo que podemos hacer todos? ¿Todos podemos clonar un
1578740	1585600	perro? ¿Todos podemos clonar un perro? Yo lo que quiero establecer es lo que se ha corrido la vara
1585600	1590480	de lo normal, porque eso no le preocupa a nadie. ¿Ahora cuántos ejemplos de pedofilia usas? Eso es
1590480	1597880	lo raro. Que es otra cosa. De vuelta, de vuelta, está todo tan raro. La realidad argentina en esta
1597880	1604020	fase final de locura absoluta lo estoy diciendo solo a modo de reflexión general. Yo de acá no
1604020	1606960	pretendo inclinar a nadie en ninguna dirección. Estoy diciendo lo que pienso y lo que hablo con
1606960	1612740	mis amigos, porque prendo la tele y cada día tiene menos sentido que la anterior y la sociedad
1612740	1617740	argentina entera acelera un lugar de locura total, que claro, como discutís el vértice de la locura,
1617940	1627860	hay un camión de locura que pasa por detrás y decís, bueno, eso es más o menos charlable. ¿No? ¿Se
1628480	1633500	acusan absolutamente de todo? De hablar con el perro, de cogerse a la hermana. Él sacó sus
1634520	1640500	desmentidas. Mi ley se coge a la hermana. Falso. ¿Qué mierda está pasando? ¿Por qué hay que
1640500	1646780	ver un flyer de un tipo que puede ser presidente en siete días que aclara ciudadano? Yo soy un
1646780	1650780	ciudadano argentino. Yo también quiero información. Entonces, yo voy a la página del que ande a tu
1650780	1656160	presidente y de una persona que puede ser presidente. Una semana me dice... Este me hizo
1656160	1665640	reír mucho mal. Una semana me dice, un país normal o cagar en un balde. ¿Cómo? ¿Cómo,
1665780	1676580	Javitox? ¿Cómo? Dice que dice. OK. OK. Comunicación memética. Un país normal o cagar en un balde.
1676620	1681680	No, creo que quiero el otro. No, cagar en un balde. No quiero, no. ¿Qué les pasa? ¿Cómo
1681680	1687300	pues están gorilas, boludo? ¿Cómo pues están gorilas? Hay un desprecio total por la persona que
1687300	1692300	te puede llegar a botar. ¡Ey, negro! ¿Querés dejar de cagar en un balde? Escuchemos una cosa,
1692440	1700320	negro violado. Espetamos. Hicimos una pegatina. No por González Catán. Y pusimos unos buenos
1700320	1709300	afichos que están culeando un negro. El negro. Sos vos, hermano argentino. Ese que está acá,
1709300	1717160	todo recogido. Sos vos. Está súper culeado, boludo. Está súper culeado por el estado. Mira,
1717240	1723180	acá está, masa. Te está reculeando. Y yo quiero que no te culeen más. Pero quiero que sepas que
1723180	1731140	hoy estás muy violado. Súper, súper, súper violado. Flyer. ¿Qué les pasa, boludo? ¿Qué? ¿Qué
1731140	1738340	mierda está pasando? Y a la otra semana, a la otra semana, el Flyer lo que dice es, vamos a desmentir
1738340	1745820	unas fake news. Yo no me cojo a mi hermana, ¿ok? Es la aclaración más rara de la historia. Nunca
1745820	1751660	había alguien tan cerca de detentar el destino conjunto de nuestra espiritualidad, de nuestra
1751660	1758060	nación, de nuestra administración pública, diciendo, nunca me cogí a mi hermana. Por eso
1758060	1765360	confía en mí. Que no me garcho a mi hermana. ¿Qué pasa? ¿Por qué aclaras eso? Es incómodo
1765360	1770660	para todos. Tiene que ser incómodo para tu hermana. Tiene que ser raro para tu hermana también. Y la
1770660	1776180	acabas de ver. Vos le decís a Karina, eh, che, eh, Kari, estaba pensando, viste, que mucha gente dice
1776900	1785400	que cogemos, que tenemos mucho sexo entre hermanos. Mucho. Y no es verdad que tenemos sexo. Estaba
1785400	1795340	pensando aclararlo con un Flyer. ¿Cómo lo ves? Dale, mandale cumbia. Y de alguna manera, y de
1795840	1801360	la única que le jodes, ¿qué dijiste que no me gusta el cuarteto, hijo de puta? Eso es una falacia
1801360	1809820	ad fernetum. Así que, no, no, no, esa no va a pasar, eh. Que clono perros, que voy a romper
1809820	1816620	las naciones con China, con Brasil, que cagasen un balde. Todo eso vaya y pase. Pero, ¿qué dijiste
1816620	1821480	el cuarteto? A mí me gusta el cuarteto. Y después ves el archivo y es el chavo gritando y diciendo,
1821480	1828460	que clara el día del cuarteto. Pero la que importa es, no me vas a hacer una falacia ad cordobésum
1828460	1836560	a mí, eh. A mí me encanta el cuarteto. ¡Uh! La cosa que más, hubo diez tweets aclarándolo del
1836560	1847540	cuarteto. Pero el cuarteto, ese era el único problema. ¿Por qué? ¿Por qué, boludo? Todo,
1847540	1852660	todo está distorsionado y lo hemos dado por sentado. Esto es la reflexión. O sea, queda,
1852840	1860500	¿qué quedan? ¿cinco días? ¿seis días? Acá ponen la falacia ad mona Jiménez. No te voy a permitir
1860500	1865940	que digas lo del cuarteto, porque lo de mi hermana ya lo aclaré en un flyer. Pero lo del cuarteto
1865940	1873960	es grave. No me vas a decir eso, ¿sí? Y después el universo de respuestas es tan gracioso, si lo
1873960	1879160	estuviera pasando, no sería increíblemente peligroso, es el año más divertido de la
1879160	1885320	República Argentina para haber existido. Es el año más divertido. Nunca un año fue tan gracioso,
1885580	1891540	si no estuvieramos todos al borde del abismo. Sería tan gracioso, boludo. Las discusiones,
1891700	1897400	boludo. De vuelta, voy de vuelta. Así como das por sentado que... Sí, papá, podés actualizarte,
1897500	1903940	ponete al día clon a los perros, ¿ok? Dale, eh. Abuelito, que hay que llevarte la mano, eh. No
1903940	1909180	sorpresa al abuelo no se da cuenta de clon a los perros. No, hay más. Hay más. Hay más cosas que
1909180	1915440	uno tiene dadas por sentado y ni siquiera te las pones a pensar. Estamos hablando... A mí me
1915440	1919160	pareció fascinante una serie de preguntas que también sucedieron durante las últimas semanas.
1919560	1925940	La falancia ad víncula. Rebor, venía a Córdoba, odias el cuarteto. No te voy a permitir que me digas
1925940	1933880	algo con el cuarteto. ¿Qué pasaba con el cuarteto? ¿Por qué era tan importante? Fui a Córdoba, boludo,
1934780	1944020	eh... Acá ponen año divertido, 150 de inflación, reborde en campaña. Es increíble que no se
1944020	1951440	encuentra. Esto no es una campaña. Esto no es una campaña. Ayer hubo un debate donde si uno de los
1951440	1959440	dos candidatos era un ficus con un cartel colgado que decía 150 de inflación, ganaba el debate.
1959440	1967380	Una planta. Un pequeño potus. Esto no es una campaña. Esto es una observación sobre cosas
1967380	1973840	que como argentino no puedo creer. Les digo otra. Conversación mano a mano con alguien, ¿no?
1973940	1985000	Che, eh... ¿Estás a favor de la democracia? O sea, digamos... ¿Qué es eso? ¿Qué es eso? ¿Qué
1985000	1992200	es ese conector puesto ahí? ¿Cuántas aclaraciones puede necesitar alguien? Estoy hablando de la nota
1992200	2002800	de Jaime Bailey. Jaime Bailey, Jamie Bailey. Para otra cosa, alto garca, Jaime Bailey. Es un mala
2002800	2009860	leche. ¿De dónde es Jaime Bailey? ¿Es ecuatoriano? ¿De dónde es Jaime Bailey? ¿Es chileno? Es un hijo
2009860	2015600	de puta Jaime Bailey, boludo. No le den notas a Jaime Bailey. Todas las notas a Jaime Bailey.
2015700	2022200	Si Jaime Bailey le dice todo... ¿Y Vancaza a los putos? O sea, digamos, si yo me quiero coger un
2022840	2029380	carpincho y el respuesta más rara de la historia para Vancaza a los putos, boludo, pero inmediatamente
2029380	2036360	pues el hijo de puta Jaime Bailey sale a hacer una declaración diciendo... La verdad que lo vi muy
2036360	2043260	mal al chaval. Un hijo de puta, boludo. ¿Quién hace eso? En la misma nota. Dio la nota, la difundió
2043260	2047380	por todos lados, todos diciendo, eh, que buena nota de Jaime. Y después el chaval se guarda como una
2047380	2053620	suerte de maga personal de Jaime Bailey, como diciendo... La verdad fue súper preocupante lo que
2053620	2062200	pasó con Javier Millet. ¡Para! ¡Para! ¡Caradura, boludo! ¿No era asesor de Fujimori? Peruano tiene que
2064180	2069520	ser. ¿Sos asesor de Fujimori? ¿A qué vas a correr, la concha de tu hermana? No, la verdad que lo que
2069520	2074540	pasó fue extremadamente peligroso. El chaval estaba ahí, callado, todos en todos sitios y siendo...
2075260	2079460	¿Qué opinas de los putos, jabó? Espláyate un poco más.
2083780	2091440	Democracia, dos puntos. Es un bait master el Jaime Bailey. Y después te hace un disclaimer
2091440	2099660	donde no tenés derecho a réplica de nada. Es solo garca, boludo. Hemos naturalizado ese tipo de
2099660	2105240	respuestas. Que si no fuera toda una reverenda mierda sería muy graciosa, boludo. Es un género,
2105260	2111540	es un género. Estás a forno de la democracia. O sea, digamos, es un sistema que, por supuesto,
2111920	2117000	que tiene muchas falencias y tiene otras virtudes. Y sí, o sea, y sí, porque... Y si no, y si no
2117180	2126900	estamos yendo a elecciones, cómo no voy a... ¿No? ¿Bancarla? ¿Eh? Sí. ¿Qué tan difícil? ¿Bancás a los putos?
2128300	2135440	Sí, está todo bien con los putos. Nada más, boludo. Nada más. Es un distinto. El chabón le pega distinto
2135440	2139200	igual, eh. Eso hay que reconocerlo. ¿Bancás a los putos? Si vos te querés coger un elefante...
2140800	2144860	Garchate al elefante, pa. Pero más vale que ese elefante te da consentimiento con vos,
2144860	2151700	porque en algún punto un puto es como un castor, ¿sí? Putos, animales, discapacitados,
2152440	2158000	no jubilados. Hablando de eso. ¿Sean quiere cogerse un jubilado? ¿Eh? ¿Qué?
2161600	2166580	¿Pero qué dijiste del cuarteto, hijo de puta? Porque el cuarteto sí que me gusta, la concha
2166580	2173820	turbana, ¿eh? El cuarteto sí que me gusta, ¿eh? No es ni como los putos ni como la democracia. Lo del
2173820	2179020	cuarteto es en serio, pa. No me rompan las pelotas, o sea, digamos. No me rompan las
2179020	2188360	pelotas. Hemos naturalizado. Hemos naturalizado. Habla de Loki. Habla de Loki. ¿Cómo cree que
2188360	2194320	hable de Loki, boludo? Acabo de ver los comentarios. Habla de Loki. Pero sí, ese es el país. Es del
2194320	2201540	país hoy. El país es locura. Todas las discusiones no tienen sentido porque no hay piso. No hay piso
2201540	2208700	para las discusiones. O sea, digamos, es una gran oportunidad para la creatividad y el caos.
2209340	2215080	Falacia ad esquiaretum. Falacia ad esquiaretum. Me vuelve loco que lo que más le moleste sea
2215080	2221600	lo del cuarteto, boludo. Es como tipo, ¡eh! Con eso sí que no se jode. Hijo de puta. Tengamos
2221600	2228320	límites, ¿eh? Caretas. La concha de sus hermanas. Me cojo a mi hermana, vaya y pase. Sí que hagas
2228320	2234800	un mal de este batullo. Si te gusta la poronga y por eso básicamente sos medio marsupial que se
2234800	2240980	quiere coger un canguro. Y bueno, es tema de cada uno. No vamos a andar jugando. La democracia es
2240980	2246740	perfectible. Pero el cuarteto. Con el cuarteto no, pa. Pero no lleves a declarar un día nacional
2246740	2254380	del cuarteto, ¿eh? Porque eso es una hija de remil puta. ¿Eh? Hija de remil puta. Board, board, board.
2254380	2261580	¡Loki! ¿Por qué hay tanta gente? Jamie Batley. Poner acá. En serio, muy garca lo de Jamie
2261580	2267960	Batley, boludo. Muy garca lo de Jamie Batley. Hacer toda una puta presentación. Y en el medio
2267960	2272480	de todo esto, en el medio de todo esto, para... No es solo eso, no es solo eso. Ahí me pasa,
2272620	2277440	la otra vuelta fui... Creo que lo conté en vivo, no lo conté acá. La otra vuelta para ir a... Creo
2277440	2283860	que fue para Mar del Plata. Yo estaba... Voy a un IPF y entra un loco que está cargando nafta. Bocha,
2283860	2294960	una cantidad de nafta. Y entra y me ve y dice, ey, vos sos el de TikTok. Y yo digo... No manejo
2294960	2298420	TikTok, no lo tengo. Tengo cuenta de TikTok, sé que hay gente que sube los recortes, pero yo no
2298420	2302980	uso TikTok, no entro. Ya está. Basta, Tommy. Hay cosas a las que me quedo fuera. No voy a perseguir
2302980	2306660	redes sociales, voy a hablar donde tenga que hablar y que la gente lleve la máxima, ¿verdad?
2306660	2310580	A donde sea. Vos sos el de TikTok. Y no sé, la verdad, porque no sé qué mierda hay en TikTok,
2310580	2316260	no sé qué recorte puede ser que haya en TikTok. Y el chabón procede, el chabón me mira y grita,
2316620	2322300	vota al tipo normal. Así, grito, grito out of context. Vos sos el de TikTok, vota al tipo normal.
2322420	2331560	Y después se estalla, se estalla solo. Se ría, yo sé que se ría. Demi, conmigo, un poco de ambas.
2331980	2340520	Pero el tipo viene y se vota al tipo normal. Se moja, se moja el pelo y se va riendo.
2341240	2350080	¿Qué acaba de pasar? Yo soy el de votar al tipo normal. No sé si soy eso. Hago un programa
2350080	2356700	alguna hora donde hablo freestyle con las cosas que me llaman la atención y el mundo es cada vez
2356700	2363060	más raro. Y ahora tuve que ver por ese programa, por esos 10 segundos, por esos 10 segundos,
2363060	2371460	cada mierda que pasa en la República Argentina, tengo 48 millones de menciones en Twitter diciendo
2371460	2376340	¿Esto te parece normal? Tomás reward, no me rompas los huevos. Unos videos de masa,
2376580	2382900	los videos más raros de masa que hay en mi vida, más así. Y el tipo, no sé qué está haciendo,
2383160	2388620	no sé qué le pasa a nadie. ¿Te parece normal esto, reward? ¿Qué vas a hacer ahora, reward?
2388620	2395000	¡Volar en el jubilado! ¡Vas a violar tu jubilado! ¡Todos están muy drogados! ¡Todo el mundo está
2395000	2401960	drogado! ¡Hagan lo que quieran! ¡Que droguen! ¡Cada uno se drogue con lo que se le cae al orto!
2402280	2408020	¿Esto te parece normal, reward? No sé nada, me parece normal. Pero sin lugar a dudas,
2408180	2415280	me parece menos normal aclarar que no te cojes a tu hermana. En la escala de lo normal viene
2416020	2423460	aclarar que no te cojes a tu hermana. Es raro, es una aclaración que uno nunca tuvo que hacer en
2423460	2429320	su vida. Quizás en Santiago del Estero. Un saludo ahí para cuando quiera que vaya a rewardice cosas
2430600	2439080	especial parientes. Aclaración rara, pongámoslo en una escala de rareza. ¡Vamos a ordenar!
2439080	2447460	¡Vamos a ordenar! Video de masa rarísimo, rarísimo. Mi interpretación, ¿quieren mi
2447460	2450900	interpretación? Mi interpretación gratuita, todas las cosas. Como hago todo en Maga,
2451220	2455560	absolutamente todo. Y que me chupen la verga a todos. Para mí, para mí, así como cuando
2455560	2462680	Miley dio la nota contra Buck, que fue rarísima, yo no creo que Miley estaba drogado. Viste que hay
2462680	2467240	un lugar común en la Argentina que es que todos están duros. Voy a hacer una confesión de parte,
2467240	2472760	yo nunca tomé falopa, ¿sí? A pesar de que les gusta ver Maga y poner, mira que duro que está
2472760	2479000	reward, mira que duro que está reward. ¿Esto te parece normal, reward? ¿Viste reward en Maga?
2480640	2484840	¿Viste reward en Maga? Bueno, yo nunca tomé falopa. Vi mucha gente tomar falopa, vi gente
2484840	2491180	tomar falopa. Ninguno hacía esas cosas, ninguna de las dos. Ninguno estaba completamente con la mirada
2491180	2496940	perdida y en otra. Entonces yo creo que quizás es por verde que digo esto. Yo tiendo a creer que
2496940	2500700	la gente que se droga siempre cree que están todos duros. Viste que hay como un lugar común
2500700	2506400	en la Argentina que es, estaba re duro. ¿Viste cómo gritó? Típico de duro. No sé, yo nunca
2506400	2511980	creo que alguien está duro. Sí creo que la gente está en una. Yo creo que Miley, muchas veces da
2511980	2517060	nota al borde de su conciencia, es un tipo socialmente muy incómodo y que Maza en Córdoba estaba
2517060	2522760	básicamente con muerte cerebral. No sé cómo era eso. Era una persona que no podía más. Y las dos
2522760	2528960	me parecen graciosas. Las dos me parecen graciosas. Después hay una escala de posibilidades. Vamos con
2528960	2535960	la escala de la rareza. ¿Estás fundido en Córdoba? ¿Estás escuchando voces contra Buck? Ok, dale.
2536100	2540940	Están los dos muy cansados. Estamos todos cansados. Si yo tuviera que hacer una campaña presidencial,
2541140	2547100	yo sería un déspota. Yo creo que el quinto abrazo lo empujó al argentino que me ven a abrazar y le
2547100	2554520	digo soltame. Sucio. Estás traspirado. ¿Vos crees que te voten? Sí, rata. Esa sería mi declaración
2554520	2561800	más light si a mí me hacen ponerme en campaña durante tres meses. Porque el estado de agotamiento
2561800	2566200	generalizado es absoluto. Si yo estoy cansado, me imagino que si tuviera que dar cinco notas por día
2566200	2570780	aclarándole a la gente que no me cojo mi hermana. Yo también estaría raro. Creo que todos estaríamos
2570780	2578180	raros. Entonces vamos a conceder un piso de rareza. Concedido el piso de rareza de Bastetomy para que
2578180	2582780	todos tienen un cartón de rareza. Todos tenés un comodín que puede decir, perdón, loco, estaba raro,
2582820	2588460	estoy cansado. ¿Cuántos comodines para cada uno? ¿Dos para cada uno? ¿Tres para cada uno? Vamos
2588460	2593900	con tres para cada uno. Miley usa uno contra Buck. Massa usa uno con el video Córdoba falopeado. Te
2593900	2599200	quedan dos todavía. Bueno, vamos a empezar a hacer. Flyer, ¿querés seguir cagando en un balde negro de
2599200	2607080	mierda violado? Ok. Toma un cartón. Te lo doy. Toma un cartón. Era un bemardo. Era un bemardo.
2607160	2613800	Quisiste jugar. Uy, sos cateto, presidente. Te pasan un bemardo. Un poco te reís. Un poco decís.
2615100	2621200	No, nadie quiere cagar en un balde. Es un bemardo. Postear. Segundo cartón utilizado. Vamos con el
2621380	2632320	cartón. No me cojo a mi hermana. Ok. Bueno. Tercer cartón. Usalo con sabiduría. No te cojes a
2632320	2638240	tu hermana. Es una aclaración un poco rara, pero entiendo que todos podemos llegar a entenderla.
2638440	2643660	Familia de Miley viendo, ok, bueno, no cojen. Si no, no lo hubieran puesto en un flyer. Bueno.
2644160	2652780	Bueno, clonar a tu perro. Eso no fue en campaña. Eso es una decisión. Vos te gustaba mucho tu perro
2652780	2658920	y lo que eres, eso yo lo respeto. A mí me gustan los animales. No sé si me gustan al punto de no
2658920	2663740	poder respetar los ciclos de la vida y la muerte porque tenés un nivel de apego emocional tan
2663740	2669000	insano que necesitas que una forma de vida se reproduzca ocho veces de manera genéticamente
2669000	2675240	idéntica. Entonces es un poco raro. Decir que no te reunirías ni una sola vez con Lula porque es
2675240	2681860	un comunista de verga. Es un poco raro. Entiendo que ellos tienen una fantasía de que podés comerciar
2683660	2688920	como... Yo voy a abrir la Pimea Gov y voy a venderla a Brasil. Entonces hablo con Omaguiña y le digo che,
2689620	2696060	loco, tengo unas remeras de John Kennedy. ¿No? ¿Les gustan? Se las mandamos para allá. Ok. Bueno,
2696060	2701380	el comercio a gran escala simplemente no funciona así. En general hay muchas cosas que ameritan que
2701380	2706340	vos te reúnas con quien sea el presidente de Brasil en el caso de que seas presidente argentina,
2706340	2711160	¿no? Incluso el presidente de Brasil es un hijo de re mil puta. Incluso el presidente de Brasil es
2711160	2716600	un brasidero de mierda que cuando va la gente visitante a jugar a su país no garantiza la
2716600	2721320	seguridad para los argentinos. Y eso es lo que debería hacer un argentino de bien siendo presidente.
2721320	2727040	Debería hoy apurar a Lula. Debería reunirse con Lula y decir Lula la concha de tu madre. El nombre
2727040	2732380	de la 12. Esto es por el rapadiseo. Eso es lo que haría un presidente normal. Pero bueno, ponene que
2732380	2736900	no te querés juntar y que querés que la gente comercia. Ok, ahí ya no me quedan cartones de rareza.
2737320	2743360	Vamos con otra. Debate nacional, Argentina, te están mirando todos. Margaret Thatcher.
2747400	2757460	¿Vos podés elegir decir? No. No. O sea, era una persona criminal de guerra. Yo entiendo lo que
2757460	2762420	quiso hacer, ¿eh? Porque mi ley... Yo entiendo lo que quiso hacer. Yo entiendo lo que quiso decir,
2762680	2768680	es una figura histórica cuya estatura ha aportado algo a las doctrinas que a mí me... Yo lo entiendo.
2770540	2775760	Se pasa menos si lo haces con Reagan, boludo, porque justo es una mina que hundió el Ara
2775760	2782160	General Belgrano por fuera de la zona de exclusión. Criminal de guerra. Criminal de guerra. Hay una
2782160	2790740	sola puta oportunidad tipo chique pesa de Thatcher. O sea, digamos. ¿Alguien pensó en Mbappé? ¿Qué?
2791340	2803620	¿Qué está pasando? ¿Cómo puede ser ese el hilo argumental? Y mira que Mbappé fue heavy lo que no se hizo
2803620	2814460	saber. Pero hay una distancia entre el Turtle Man, la tortuga francesa de French Turtles y
2814460	2823620	Margaret Thatcher, boludo. Y el poderoso alemán Krif. ¿Qué está pasando, boludo? ¿Qué mierda está
2823620	2831540	pasando? ¡Por Dios! ¿Qué divertida puede ser esta semana? Aceleremos. ¿Saben qué? Aceleremos.
2831760	2840300	Aceleremos hacia la confusión final. Aceleremos. Clonemos nuestros perros. Aclaremos que no cogemos
2841900	2847140	parientes. Condecoremos enemigos de la República Argentina. Históricos. Históricos. Todavía no
2847140	2853560	dijo nada del Imperio Español. Todavía no dijo nada de los realistas. Lo dicen sus asesores. El
2853560	2858720	Veregas Lynch, que está como loquita. El Veregas Lynch cada día que pasa dice ¡Sí! ¡Esta es la
2858720	2864580	línea de la campaña, tibias, hijos de puta! Sí, se lo veo tratando de decir. Aguante la May Thatcher.
2864580	2872160	Me encanta The Crown. La temporada de Thatcher de The Crown es la mejor. Al fin alguien lo dice.
2873140	2878660	Aceleremos, papá. Quinta fondo contra el paredón. Me parece bien que cada uno haga lo que tiene que
