start	end	text
6300	11920	No pasa nada, así lo hace un profesional, me extraña, cómo están todos, cómo andan
11920	20860	compatriotas, cómo andan papaeldos, esmircolapios, cómo andan papaordiceps, cómo andan otorcedores.
21260	24520	Hay mucha gente que se está equivocando, está tratando de hablar de las hinchadas
25000	30700	brasileiras y se expresan como tocedores. Bienvenidos, bienvenidas a otro MAGA,
30720	34320	como todos los lunes a las 8. Hay gente que me sigue escribiendo y me dice,
34620	39200	pero ¿a qué hora es Reborda?, ¿a qué hora es? Y ni siquiera poniéndote un enlace con
39200	44680	un evento programado te das cuenta que es los lunes a las 8. Lunes a las 8 de la noche es la
44680	48200	cosa más sencilla del mundo. Y aparte, si no les sacaron las fichas hasta ahora, bueno,
48300	51640	lamento que se los diga así, pero me parece que no van a llegar a encajar ningún programa.
53300	62160	¿Cuántos MAGAS quedan hasta el GRAND REX? ¿Tres? ¿Tres? ¿Estamos frente a uno de los últimos
62160	67140	programas, últimos MAGAS de la historia y ustedes no lo están valorando? Les doy la bienvenida,
67160	71860	voy a hacer unos breves anuncios al principio. Como suele suceder, MAGAS de anuncios,
71960	74780	como más les gusta a ustedes, lo que la gente espera, lo que la gente está en la casa diciendo,
75440	81240	loco, hoy habla Rebord, ojalá tenga unos buenos anuncios para dar. Y es así, sucede.
81620	89320	Quiero agradecer a Tucumán por haberme recibido con tanta amabilidad y amor.
90080	97920	Creo que el acento Tucumano es mi acento favorito. Creo que es de los mejores acentos. No sabría
97920	104760	explicarlo bien, pero es un acento autoconclusivo. No, no lo podría imitar, no me sale. No me sale
104760	112100	porque no es un acento musical, no es como el cordobés, no se expande, es autoconclusivo,
112820	118760	termina sobre sí mismo, es muy interesante. Es filosóficamente interesante el acento Tucumano.
119000	124580	Y les quiero agradecer por su cálida y generosa bienvenida. Me trataron extremadamente bien.
124700	129200	Los abordajes más amables que tuve en mi vida fueron en calles Tucumanas. Gente que me pedía
129200	135740	una foto, un saludo, solo saludarme, solo hablar, fueron increíblemente amables. Así que eso es lo
135740	141060	primero que quería decir. Quiero agradecer. De hecho, una señora en Tucumán que me abordó y me
141060	147120	dice, vos sos Rebord, muy amable, muy Tucumanísima, súper respetuosa. No sé cómo entra esa
148820	154240	superamabilidad con apuñalar a tu antecesor político por la espalda, traicionarlo y asumir
154240	158620	o pegarle un Tucumanazo en la cabeza. Pero es como que congenian gran amabilidad y ternura con una
158620	165420	suerte de superviolencia concentrada. Pero una señora me dice, vos sos Rebord, mi hija te ama,
165740	171140	te puedo pedir una foto, sí, sí. Y en un momento ella me dice, lo único que a veces me pasa es que
171140	176460	sos un poco guaso, me dice. Y entonces yo digo, bueno, sí, señora, es verdad, le pido disculpas,
176500	181100	me pasa un poco eso, viste. Es un poco el código de mi programa, no sé. Y después me dice,
181920	189820	igual es cierto que los cogimos con la pija muerta. Y yo digo, oh, oh, oh, damn, señora,
190380	197620	diablo, señora Tucumana, le digo. Pero fue tan, fue tan tierno como lo dijo, que fue directamente
197620	205200	dulce. Así que les agradezco, les agradezco también en el espectáculo unos locos que me lo dijeron
205200	210900	después de la función, que hicieron 600 kilómetros para verme, locos, unas personas de más del
210900	215320	norte todavía, se enteraron que iba para Tucumán y agarró uno, lo convenció para ir en un auto,
215380	223380	hicieron 600 kilómetros, 600 kilómetros para ir a verme en Tucumán. Toma de acá, Taylor Swift,
223600	227660	loco. Mirá lo que es el movimiento agovero, mirá lo que es el agoberismo, papá. Y vos no sos
227660	232100	capaces de sacar una entrada para el Grand Rex en tiempo y forma, pedazo de hijo de puta. Mirá
232100	238440	qué desagradecido que sos. Quiero decirles, bueno, ya que mencioné el Grand Rex, el Grand Rex está
241000	248100	oficialmente agotado, así que primero, gracias. Segundo, felicitaciones, porque el agoberismo no
248100	254460	para de tener triunfos, no para de tener coronaciones de gloria. Oficialmente el agoberismo agotó un
254460	259360	Grand Rex y falta como un mes todavía. Ahí es donde todos los manijas te dicen hace otro,
259440	264560	mete otra fecha, qué sé yo. Pero me extraña, loco, me extraña. Yo nada de lo que hago,
264560	270860	lo hago por la plata. No me malinterpreten, me encanta la guita y estoy juntando mucha plata
270860	276780	y quiero juntar aún más plata, pero no lo hago por la plata. Si a mí alguien me da a elegir entre
276780	281620	la gloria y la trascendencia y el dinero, yo elijo la gloria y la trascendencia. Entonces voy a ser
281620	286140	un Grand Rex porque va a ser un puto evento canónico y así me tomo las cosas que hago.
286560	291280	Si yo doy una entrevista o aparezco en un lugar, quiero que sea especial para esas personas que
291380	295920	están ahí. Y esa es la fórmula del agoberismo en todas sus dimensiones. Ustedes saben que yo
295920	300220	siempre expongo la fórmula de la Coca-Cola. Se lo digo a la cantidad de personas que miran
300220	305060	asiduamente mis programas y buscan imitarlos después. Ahora que está de moda. Hay muchas
306480	313060	líneas Pepsi a esta altura de lo que nosotros hemos logrado. No sé si lo vieron. Pero te das
313060	319080	vuelta y aparecen tres, cuatro programilfos donde de repente se tratan contenidos muy similares. Y
319080	326180	eso está bien. ¿Por qué? Porque nosotros nunca fuimos gatekeepers de ninguna ciencia. No nos
326180	329720	identificamos como personas que le patean la escalera a los que quieren venir. Al revés,
329860	334360	le decimos vengan, crezcan. Siempre y cuando. Reconozcan la paternidad y la conducción.
334940	339200	Entonces le damos la bienvenida a la multiplicidad de formatos que están apareciendo las líneas
339200	342960	Pepsi de todo lo que están. Bienvenidos, bienvenidos. Ya hay lugar para todos,
343140	347340	pero solo hay uno con la poronga más grande. Lo que le quería decir es que me preguntan,
347340	352620	Rebor, Rebor, ¿cómo lo haces? ¿Cuál es la fórmula de la Coca-Cola? Simple. Yo trato cada segundo
352620	359060	de atención como sagrado. Y yo busco corresponderlo sagrado. Lo único que tenemos para dar en esta
359060	364580	vida es atención. Todo lo que tenés son espasmos de tiempo. Todo lo que tenés son segundos frente
364580	369920	al abismo que vos le dedicás a algo. Si vos mirás a los ojos de tu pareja y le decís te amo, es un
369920	374660	segundo único y repetible. Si vos elegís esos segundos para cuidar a tu hijo, es eso. Si los
374720	379740	elegís para mirar una serie, ahí se va tu energía vital. Y si los elegís para mirar maga,
379900	384180	a mí me corresponde brindarte lo mejor de mí. Corresponderlo sagrado es lo único que hago.
384420	389760	¿Qué piensan, que voy a empezar a emitir Rebor sin criterio para empezar a devaluar mi contenido?
390100	395020	No, papá. Mi contenido va a ser sagrado y puro para siempre. Por eso Rebor aparece exactamente
395020	399240	cuando tiene que aparecer y por eso hay un gran REX. Yo le quiero contestar a toda la gente que
399340	404740	está diciendo, pero escúchame, loco, me quedé afuera, no llegué a comprar, ¿qué podemos hacer?
405320	412120	Nada. No pueden hacer nada porque el gran REX tiene una capacidad limitada y yo te avisé como con tres
412120	417840	putos meses de anticipación. Si yo pongo una fecha, papá, la tenés que sacar y si vos especulas,
417980	422620	te vas a quedar afuera. Hablando de fechas, la semana que viene voy a Uruguay. Ahí todavía hay
422620	428960	lugares. Voy a ir a Uruguay. Va a ser la primera presentación internacional del agoberismo. Vamos a
428960	433660	ver qué sucede en Uruguay. Es el miércoles que viene. Voy a estar en Uruguay. Acá The Jungle Man en
433660	438540	la sala. Ya me está poniendo un enlace para que puedan comprar las entradas si es que son uruguayos
438540	443320	o si es que alguno de ustedes desesperadamente quiera cruzar el charco a nado para ir a ver una
443320	448520	de las últimas presentaciones que quedan de este año. Para que se me fué el chat acá y me gusta
448520	455760	leerlo cada tanto. Acá me ponen falacia ad agoverum. Ya vamos a empezar a hablar de eso. Fecha
455760	461040	Uruguay, Grand Rex. ¿Tenés algún audio para pasar? A ver, pásame, que lo escucho. Rebord,
461160	466960	entiendo la lógica de no grabar ningún rebord de esas cosas, pero dale. El de Grand Rex grabámelo
466960	472260	que si no me lo pierdo. Me comí el garrón, no te encontrá. Grabátelo, dale, que es histórico.
472500	485740	Abrazu. No, no lo voy a grabar. Lo que sí estuve pensando un poco es que hay un circuito ya
486340	491620	estoy para grabar uno y que quede. Y ahí sí, debería grabarlo en algún lugar donde no haya
491620	495800	ido nadie antes, así es nuevo y las reacciones son genuinas. O tener un público cautivo,
495880	500900	mercenario y comprado para que reaccione con mucha fusibilidad y risa frente a cada cosa. Ese lo
500900	505180	grabamos, lo empaquetamos y se lo vendemos a alguna plataforma, por supuesto la que más pague,
505400	510780	de manera completamente capitalista y explotando nuestro contenido al máximo. No, el Grand Rex y
510920	516180	algún registro haremos, pero no me gusta, no quiero grabarlo. Ahora me puse pesado. Me puse
516180	521800	pesado con mi arte como el cantante de Tool, que estuve aprendiendo durante el fin de semana,
522180	526180	que no quiere ser grabado. Vieron que hace recitales para que sea solo una única experiencia
526180	531600	irrepetible vivo y no se graba. De hecho, hay todo un recital que graban solo al batero porque
531600	540160	está haciendo un chivo para los palos y el otro está en sombras. O sea, es así de pesado. Es
540160	547300	mi arte tan sagrado que no será registrado jamás. No, yo no llego tanto a eso. Acá me van a preguntar
547300	554800	más cosas. ¿Vas a grabar o no el debate? ¿Qué más tengo? Ah, tengo un último anuncio. Tengo
554800	558140	un último anuncio y ya nos metemos un poco en los temas de la semana que la verdad hay un montón.
558300	563680	Recién acá me dijeron en Tucumán, descogieron a Rebord. Yo la semana pasada estaba muy cogido. No
563680	567920	fue solo Tucumán, pero Tucumán fue clave. Tucumán me hizo muy bien al alma. Me recomendaron mucho
567920	574600	leer el libro de Hobbes de la Biblia y es muy bueno. O sea, hay niveles de hay algo ahí
574600	579860	poderosísimos con un nivel narrativo tremendo. Comprendí también que uno de los mayores pecados
579860	585520	posibles es pretenderse justo frente a los ojos de Dios. Entonces ahí dije, claro, mira, es un
585520	591080	pecado de arrogancia. ¿Quién sos vos para determinarte justo? ¿Quién sos vos para medir el
591080	596060	criterio y los estándares de Dios bajo medidas humanas? Aprendí mucho de eso y voy a utilizar
596060	600100	gran parte de esos recursos. Así que eso me sirvió mucho. Me sirvió mucho las recomendaciones
600620	605360	literarias de mis queridos agoveros y agoveras. Ya pronto los explotaré. Me gustaría hablar de esas
605360	610720	cosas, pero bueno, urgen otras necesidades urgentes en la República Argentina que también tenemos que
610720	615720	atender. Pero ese libro sin duda tiene unos poderes, tiene unos niveles de hay algo ahí que me gustaría
615720	621260	transmitir entre eso. Tucumán, un poco del mero paso del tiempo, un poco de descanso también que
621920	629360	necesitaba. Pude recalibrar un poco mis chacras, mis energías agoveras para poder brindarles lo
629360	636240	mejor de mí, lo mejor de mí. Tomé una decisión también. Como estoy en estado de eterna mutación y
636240	640260	ustedes saben que yo me voy transformando con el paso del tiempo, de hecho todavía ni se imaginan
641000	650440	lo que va a ser Reborn 2024. Todavía no se imaginan lo que va a ser Jason Momoa Board 2024. Se van a
650440	655200	transformándome y ahora estoy en modo Basta Tommy. La gente que viene siguiendo Los Últimos Magas
655200	661360	sabe que estamos en modo Basta Tommy. Estoy viviendo los Basta Tommy y debo decirles que a los Basta
661360	665680	Tommy se vive mejor. Y tomé una decisión que quiero informar a la comunidad, que es que
667220	673520	cambié mis políticas y condiciones de uso en redes sociales. Yo antes tenía una lógica en la
673520	679820	cual nunca bloqueaba a nadie y siempre leía, veía los comentarios, era abierto a las interacciones.
679820	688440	Y ahora, ahora que vivo a lo bavi, a lo bavi se vive mejor. Ahora cambié y ahora hago todo lo
688440	696320	contrario. La más sutil molestia al comentario más, ni siquiera hace falta que me bardee,
696480	701720	me cae un poco mal o me cae demasiado bien. Me cae sospechosamente bien lo que hago bloqueando.
702180	709340	Quieren saber por qué tomé esta decisión por dos motivos principalmente. Estamos acelerando en la
709340	715540	República Argentina, de eso vamos a dedicar este programa al día de hoy. Y la otra es que empecé
715540	720860	a darme cuenta que, vuelvo al principio, como uno lo único que tiene esa tensión, estaba dándole
720860	725180	demasiada tensión a gente que simplemente no lo merece y ustedes no saben lo que son mis redes
725180	730720	sociales. Pero últimamente los fenómenos son de estas características. Cualquier cosa que yo haga
730720	738700	o diga aparece alguien abajo que dice, Rebord, en Santiago del Estero un peronista acaba de violar
738700	746080	un jubilado. Un grupo de cinco peronistas violó a un jubilado por el culo. El jubilado está en el
746080	753140	piso y mientras lo violaban le cantaban la marcha. Rebord, ¿vos defendés esto? ¿Qué vas a decir,
753140	760100	Rebord? ¿No te da vergüenza, Rebord? No, no sé qué pasó en Santiago del Estero. No me importa.
760340	768680	Estoy viendo un partido de boca. Si estoy viendo un partido de boca, necesito que vos, con lo que
768680	773280	y las pretensiones que tenés sobre las redes sociales, proyectadas por algún motivo sobre
773280	781240	mí mismo, necesito que respetes mi tiempo para ver cómo Cavani no hace goles. Durante un periodo
781240	786200	muy especial de mi tiempo, sagrado para mí, yo me dedico a ver cómo Cavani, por algún motivo que
786200	791860	todavía no logro dilucidar, anula las posibilidades de gol del club atético Boca Juniors. Es un 9,
791860	795920	es un 9 del recarajo de jerarquía, pero queda solo frente al arco y la corta y la manda para
795920	802040	atrás. Yo estoy viendo eso. No me puede chupar más un huevo. El jubilado violado en Santiago del
802040	807360	Estero por una horda de peronistas. Quiero establecer de vuelta información verídica en maga. Una horda
807360	811960	de peronistas violó a un jubilado en Santiago del Estero. ¿Puede hacer algo Rebord al respecto?
812120	818940	No. ¿Rebord quiere que violen ese jubilado? No, no, no. Rebord está en contra de que violen un
818940	824260	jubilado en Manada mientras cantan la marcha peronista. Rebord no hace una apología de lo
824260	829660	sea que pasó. Solo no me importa y no tengo ningún tipo de control ni dominio sobre esa
829660	835300	secuencia. Entonces, cada vez... Algo hizo ese jubilado, me ponen acá en el chat. Cada vez que
835300	839460	un grupo de ustedes viene a decirme Rebord, Rebord. O sea, es una locura. Han pegado tantas
839460	845000	vueltas todos que los nuevos moralizantes son los libertarios, boludo. Hace cuatro años los
845000	849980	corrían a la gente de Futurock por progresismo moralizante, que todo el tiempo era ¿y ahora
849980	855480	qué van a hacer con esto? ¿Qué van a decir con esto? ¿Y ahora qué vas a decir de esto? No me
855480	860620	importa. ¿Qué te pensás que hacemos? ¿Qué te pensás que puedo hacer? ¿Qué te pensás que vos me
860620	865340	vas a servir? Y digo, diablos. Ya mismo voy a salvar ese jubilado de esta violación en base a
865340	872040	peronistas. Es no ponerlo. Es inevitable como las 20 verdades han devenido en violación masiva
872040	877420	jubilados. Así que ahora que vos me pasaste ese enlace de Twitter, así que ya está. Ahora cada
877420	883780	cosa que veo que me molesta un poquito lo bloqueo instantáneamente. Y no les puedo explicar lo feliz
883780	890040	que soy desde que bloqueo. Es como cuando en WhatsApp sacas el último visto, viste, que es
890040	895340	como una nueva forma de vida. Yo durante mucho tiempo sostuve el visto frente a WhatsApp. Y ahora
895340	900640	que lo saco, nadie sabe qué veo y qué no veo. Y soy invencible. Siento lo mismo. Ahora yo entro a mis
900640	905640	redes sociales, que claro, son mis putas redes sociales. Si hay un lugar en donde yo establezco
905640	910700	mi dictadura, es mi Twitter. Y voy a gobernar con mano de hierro. Así que lo quiero avisar porque
910700	914380	muchos de ustedes han tenido una relación medio virtual, cínica conmigo, que eran las reglas de
914380	918640	juego. Ahora cada cosa que vea que me molesta un poco lo voy a bloquear y no pierdo ni un segundo.
918920	925000	Y la sensación que tengo es liberadora. Como es raro decir, ya está. Como humano, dejaste de existir.
925220	930180	Y después esas personas dicen, oh, me bloqueo Rebord, me bloqueo Rebord. Y a mí se me están
930180	936340	corriendo las pelotas. Y eso lo aprendí desde que soy basta, Tommy. Porque alobabi se vive mejor.
936720	941640	La gente que tiene 60 años en medios y que se putea todos los días con la gente por la calle,
941740	946860	sabe algunas cosas. Eso es lo que quiero traerles. Así que voy a vivir alobasta, Tommy. Sí. Ahora
946860	950920	solo me falta comprar un arma, tener un buen rifle en mi casa y cagar a tiros cuando alguien
950920	955460	quiera entrar. Pero alobabi se vive mejor. Es innegable. Te puteas con él y decís, chúpemelo
955460	967080	huevos. Rebord, no vas a hacer algo de fraude electoral. Rebord, yo soy deformosa y yo boté y
967080	972520	me cagaron el voto. Chúpala, boludo. Chúpala, eso va a ser Rebord. Rebord, por favor, imparte
972520	979860	justicia sobre mí. Bloqueado. Como dice el libro de Hobb, el libro de Jobs, el libro de Steve Jobs.
980620	987680	Como dice el libro de Hobb, ¿quién sos vos para jugar a Rebord? Vos no podés jugar las reglas de
987680	993160	los Rebord. No sabés que está viendo Rebord en la violación masiva de ese jubilado, loco. El jubilado
993160	997160	está en el piso, todo violado. Vinieron justo un montón de peronistas a cantar la marcha, se la
997160	1002120	agarraron con ese jubilado. Vos decís, diablos. Sí que Rebord va a tener que pronunciarse sobre
1002120	1008540	esto. Y Rebord no se pronuncia. Y vos se agarrás y te quedas con tus 240 caracteres reculando en
1008540	1013580	sacletas como un chupabergas con tu pijita en la mano diciendo, ¿por qué Rebord no habla de esto?
1013720	1019220	Rebord tiene sus motivos, papá. Como Dios. Y vos no podés jugar a ninguno de los dos pedazo de
1019220	1026580	hijo de revil puta. Bloqueado. Bloqueado, papá. Oh, diablos. Captura de pantalla. Rebord sí que me
1026580	1033620	ha bloqueado. Me he metido en sus pantalones. Bloqueado. Bloqueado, papá. Bienvenidos a la
1033820	1038080	dicta final. Basta, Tommy. Vamos a hablar un poquito de lo que está pasando en la República
1038080	1041880	Argentina. Avísame, Maxi, si tenemos colaboradores, audios, gente que quiera también aportar su
1041880	1056520	ciencia, mándame. Me aclara, Maxi, que hay 20 audios tosiendo porque aparte, o sea, son muy
1056520	1063800	originales también, eso también creo que lo sepan. Evidentemente un chiste se le ocurrió a uno y ahora está tosiendo y
1063800	1068040	que a bloquear también me doy cuenta algo. Durante mucho tiempo yo quise crecer en la audiencia para que me
1068040	1073520	vea más gente. Ahora me doy cuenta de que tengo toda la gente que quiero. Que hay como 13 mil personas acá,
1073820	1079160	son un montón. Capaz quiero menos. Capaz quiero echar audiencia. A partir de ahora empieza un proceso a la inversa.
1079280	1084600	Si todos estos años acumulamos, ahora se viene la parte de templar a la audiencia como el acero. Vamos a
1084600	1089000	empezar a hacer que se caigan a los cachetazos un par de personas del carro. ¿Se entiende? Voy a hacer
1089000	1095280	que el contenido de Best Atomy sea difícil de ver. No voy a decir ni cuándo salgo ni por dónde salgo y si vos
1095280	1099700	agarrás algo lo agarrás y si no lo agarrás, andate a la concha de tu madre. Y si te quedás sin entradas,
1099980	1105320	dormiste, pá. Dormiste como el jubilado de Santiago del Estero, que lo durmieron y lo agarraron los
1105320	1113380	muchachos peronistas y se la dieron, pá. Porque estaba regalado el jubilado, ¿entendés? Eso pienso. Por eso no lo estoy visibilizando.
1113380	1120060	¡Bloqueado, hijo de puta! ¡Bloqueado! Vamos a hablar un poquito de lo que está pasando. Voy a hacer un ejercicio con
1120060	1124360	ustedes. Voy a hacer un experimento con ustedes que están en sus casas correspondiendo a uno más sagrado que
1124360	1131220	tienen que es su atención y me la están brindando a mí. Durante mucho tiempo hemos pregonado el
1131220	1136740	advenimiento de la era de la gran confusión nacional. ¿Sí? La gran guerra sagrada, la confusión nacional.
1136860	1141740	Venimos hablando en este canal. Todos vienen prestando atención, se llevan esta ciencia para
1141740	1148060	sus lugares. Quieren imitarnos, pero no podrán igualarnos jamás. Hay 400 marcas Pepsi de Rebord,
1148360	1154300	peronistas, libertarios, gorilas, progresistas. Ninguno tiene un ápice del best Tommy y los
1154300	1161540	poderes que asequemos acá. ¿Sí? ¿Qué estamos ahora o qué sucede en este momento? Bienvenidos a la
1161540	1168180	fase final del embudo. Bienvenidos al túnel de América. Bienvenidos al lugar donde te manotean
1168180	1174780	un poco el orto. Donde vos decís, che loco, no aguanto más. Falta un poco más. Porque esta es la
1174780	1179860	recta final de la recta final. Nadie aguanta más. La política se volvió insoportable y siempre que
1179860	1185100	la política se vuelve insoportable, la persona que propone un poquito más de bajar los ánimos gana.
1185360	1189720	¿Sabías? Eso también como dato interesante. Si una te garantiza más quilombo, inevitable más
1189720	1194260	quilombo porque quiere cambiar todo lo que pueda ser cambiado. Y alguno dice, relajémonos todos un
1194260	1199520	poco. En general a la población civil, no los enfermos como vos, como yo, los relaja un poquito
1199520	1203500	más cierto status quo si lo que quiere la gente es que no le rompan las pelotas. El argentino no
1203500	1207380	quiere hacer revoluciones. ¿Qué está pasando entonces? Vamos a hacer un experimento. Voy a
1207380	1215060	demostrarte la cantidad de cosas que has dado por sentadas como relativamente normales y no te diste
1215060	1222400	cuenta. Ni siquiera te diste cuenta. El otro día me pasó, yo tengo 30 años y a los 30 años los
1222400	1230440	grupos de amigos están en una fase bastante particular porque a los 30 años podés estar vos y
1230440	1235640	tu grupo. Podés estar tanto pensando en formar una familia y ver qué querés hacer y tener hijos y
1235640	1243580	todo ese tipo de flash o podés estar en un tour por el sudeste asiático fumando opio y teniendo
1243580	1252080	sexo trans. ¿Sí? Y sucede en el mismo espacio-tiempo. Entonces los grupos de WhatsApp unidos por la mera
1252080	1256980	amistad de haber coincido en un tiempo y espacio en una secundaria hace 15 años, atraviesan un
1256980	1262020	periodo muy interesante que cada persona habla al grupo y trae una realidad completamente diferente.
1262460	1268740	Algunos están diciendo, che loco, tengo 30, estoy casi seguro que creo que soy un adulto ahora. Tengo
1268740	1273140	la edad que siempre creí que era la edad a la que uno llegaba y de repente era un adulto de verdad.
1273460	1281320	Y hay otros que están diciendo, voy a roquear forever pa, tengo solo 30, tengo solo 30. Soy joven,
1281320	1286600	voy a hacer una gira por el sudeste asiático. Me pasó el otro día que hablaba con mi... ¡Basta,
1286720	1291520	Tommy! No voy a parar un carajo. No voy a parar un carajo. Está recién arrancando, Tommy. Arranca
1291520	1295780	Maga ahora. Pónganlo después en los comentarios. Acá arranca Maga. Está hablando con un amigo,
1296740	1302900	mi querido amigo Tomás Obregon, el Obi, el Obi Kenobi, el Obi Wan Kenobi, que está en una gira
1302900	1309480	por el sudeste asiático y agarraba y se fue a meditar. Se internó una suerte de gran meditación
1309480	1314640	durante toda una semana. Están aislados del mundo, aislados del mundo una semana. Y me di
1314640	1323800	cuenta cuando él salió y me dijo qué onda, qué pasó, que yo realmente no sabía cómo decirle que
1323800	1332860	en el espacio de una semana que él estuvo aislado en Asia, yo había hablado con Myrtle Grand, me había
1332860	1342700	vuelto de Brasil con el culo roto y que el debate inminente que se venía iba a ser sobre qué tan
1343240	1347220	envaselinados querés los niños, que es como el otro gran punto que se debató hoy por él en la
1347220	1350580	Argentina. Me di cuenta que tenía todos mis parámetros rotos para hablar con un amigo,
1350660	1355560	para decirle en qué andaba la República Argentina, que andaba mi vida en particular. Ni mencioné lo
1355560	1362660	de la gala de gente, pero dos hechos salientes muy interesantes. El primero es que fui, estos son los
