start	end	text
1264840	1267100	Te lo firmo, ¿eh? Se va a estudiar.
1267440	1268880	Porque solo un idiota cree que no hay
1268880	1271000	poder en la mística. Perdón, ¿acaso? A ver,
1271160	1273000	ustedes creen que
1273000	1275300	que Julio César le ganó
1275760	1277340	el clásico a Pompeyo
1277940	1278860	por mejor
1278860	1280860	táctica, por mística le ganó Julio César.
1282580	1283660	Pompeyo tenía ejércitos
1283660	1284740	cuatro veces más grandes.
1285260	1286880	Y Julio César estaba armado con sus
1286880	1288860	inmortales. ¿Creen que Julio César le
1288970	1291590	ganó a Vercingétorix, el galo,
1291590	1292830	el invencible
1292830	1295190	a través de movimientos de escuadra?
1295370	1297170	¿Eh? Como acusaba
1297170	1299190	Facundo Quiroga al Manco Paz,
1299430	1300350	movimientos de ballet.
1300810	1302770	Cuando Quiroga pierde con el Manco Paz,
1303010	1305150	como el Manco Paz era mejor táctico
1305150	1306850	militar que él, uno de los pocos en la Argentina,
1307350	1308930	Quiroga lo quería denostar diciendo que le
1308930	1311310	ganaba con movimientos de contradanza.
1311850	1312570	Todo caliente.
1312830	1314670	Quiroga todo rabioso diciendo ¿qué está haciendo?
1314730	1316610	Eso no se vale. Es offside, ¿viste?
1316610	1318410	Que no le quería cobrar que no valía eso.
1318690	1320910	Ustedes se creen que son... es por mística,
1320970	1322950	hermano. Es por mística.
1324110	1325030	Y, y
1325030	1326490	lo que se nos juega hoy
1326490	1328730	en la Argentina es un partido
1328730	1330870	por la recuperación metafísica
1330870	1331770	de la argentinidad.
1332650	1334530	Tenemos que poder hacer
1334530	1336170	nuevamente grande a nuestro país.
1336450	1338390	A condición de creerlo.
1338690	1340790	Creo que si no era Lenin le pego en el palo
1340790	1342410	el que decía que sostenemos
1342410	1345030	nuestras utopías a condición de creer en ellas.
1345590	1347350	Hoy soy una máquina de citas.
1347590	1349070	Anda a chequearlas, ¿no? Pero era algo así,
1349130	1350810	no importa. Lenin decía algo así.
1351150	1353550	Hay que creer, hacer rimamente
1353550	1354630	en nuestras utopías.
1355470	1357170	Y nosotros, compatriotas, creemos en
1357170	1359170	una sola. Que es que la Argentina
1359170	1360310	va a ser grande otra vez.
1360870	1363010	Esa es la única discusión real. Es más, anota esta
1363010	1364970	también. A vos que estás escuchando, vos,
1365110	1367010	compatriota que te quejaba, eh, fútbol, fútbol,
1367190	1368930	anota esto, anota esto.
1369850	1370930	Todas las discusiones
1370930	1372590	son una sola discusión.
1373130	1374330	Todas las discusiones
1374330	1376370	son una discusión espiritual.
1377070	1378750	Todas. Y todas se reducen
1378750	1380610	a si vos querés que la Argentina sea grande
1380610	1382810	o no. Todas las discusiones
1382810	1384170	son una sola discusión.
1384670	1386670	Discusión sobre el modelo productivo argentino.
1387310	1388290	Eh, no, yo creo que no.
1388370	1389790	¿Vos querés que la Argentina sea grande o no?
1390870	1392750	Ahí definís. Te estás matando
1392750	1394090	con alguien, no importa de qué palo seas.
1394150	1396150	Sois de derecha, sos de izquierda, sos peronista,
1396670	1398250	sos trosco, sos socialista
1398250	1400670	y estás discutiendo con otro. No le preguntes
1400670	1402510	ni cuál es su ideología, eso no sirve para nada.
1402610	1404610	No le preguntes en qué cree. Agárrese y le para,
1404890	1406390	para, para, para, para. ¿Vos querés
1406390	1408150	una Argentina grande o no?
1409370	1410630	No, no, no, te dice.
1410790	1412650	No, no quiero, no. Listo, bueno,
1412670	1414510	no hay nada más que hablar. Te sacudí la mano.
1414610	1416890	Esa es nuestra batalla. Esa es nuestra batalla celestial,
1417130	1418310	como la de Megafon, ¿viste?
1418790	1420930	Esa es nuestra serpiente enroscada sobre sí misma.
1421570	1422710	Y si te dice que sí, seguís
1422710	1424670	discutiendo y de alguna forma te vas a poner de acuerdo o irás a
1424670	1426670	una guerra sagrada para ver quién se impone sobre
1426670	1427510	el final. Los escucho.
1427510	1430010	Hola, Rebord. No tengo idea
1430010	1431690	cuál va a ser la consigna, pero yo quiero
1431690	1433750	decir de la que zafamos
1433750	1435810	como humanidad de que Racing
1435810	1437730	sale a campeón y el COVID se
1437730	1439350	transforma en un apocalipsis zombie.
1439790	1440510	Gracias a Valeros.
1441230	1443750	Era muy probable que si Racing ganaba el COVID
1443750	1445810	mutase en una cepa zombie
1445810	1447370	sin dudas.
1447530	1449590	¿Saben ustedes que Plutarco,
1449930	1451690	gran historiador de la antigua edad,
1452110	1453650	decía sobre Julio César?
1453790	1455750	Tenía una anécdota, Plutarco sobre Julio César.
1455750	1458130	Plutarco era como nosotros, compatriotas.
1458210	1459950	A Plutarco no le importaban ni las
1459950	1461870	fechas, ni los lugares,
1461970	1463650	ni el rigor. Él quería
1463650	1465650	captar los pequeños detalles,
1465810	1467810	las pequeñas anécdotas en las vidas de grandes
1467810	1469670	hombres para hacer una
1469670	1471590	disección espiritual de quién eran.
1471970	1473650	Así construyó sus vidas paralelas,
1474030	1475790	una de las mejores biografías en la historia de la
1475790	1477570	humanidad. Por empezar,
1477710	1479670	es una biografía con una dinámica muy rara porque
1479670	1481630	siempre son en tándem.
1481850	1483870	O sea, él hace las biografías de Julio César
1483870	1485610	y la de Alejandro Magno,
1485910	1487570	y las compara espiritualmente.
1487870	1489750	Estoy hablando de uno de los libros de cabecera de Perón,
1490390	1492270	vidas paralelas, de Perón,
1492470	1494310	de Napoleón y de tantos otros.
1495050	1495950	¿Qué decía Plutarco?
1495990	1497970	Que no solo decía que Julio César lloraba
1497970	1499790	frente a la estatua de Alejandro Magno.
1500190	1501730	¿Te lo saben estos? Julio César
1501730	1503750	miraba la estatua de Alejandro Magno y lloraba
1503750	1505830	porque se mortificaba al respecto de todos
1505830	1508070	los logros que Alejandro ya había logrado a su corta
1508070	1509910	edad y él ya era un tipo grande, ya había
1509910	1512090	fracasado. Entonces, fíjate,
1512090	1514310	¿no? Agarrá esto, vos que estás ahí
1514310	1515950	peleándola, teniendo un día malo.
1516090	1518170	Pensá que Julio César,
1518170	1520010	hermano, Julio César
1520010	1522150	se postraba ante la estatua de Alejandro
1522150	1524150	y lloraba y pedía perdón
1524150	1525910	por no ser lo suficientemente grande.
1526730	1528190	Ese Julio César, según
1528190	1530030	Plutarco, padecía
1530030	1532110	de un mal terrible. Plutarco
1532110	1534290	lo llamaba una especie de
1534290	1535570	envidia de sí mismo.
1536150	1538090	Él decía que Julio César era como que
1538090	1540490	apenas lograba algo, apenas lograba algo imposible,
1540490	1542150	algo que nadie más podía realizar.
1542690	1544650	Julio César empezaba a tener bronca
1544650	1546610	de ese logro. Como que decía
1546610	1548550	puta madre, tengo que
1548550	1550510	hacer algo más grande todavía. ¿Entendés lo que
1550510	1552670	te digo? O sea, Julio César le ganaba a Versingetorix
1552670	1554690	y decía, bueno ya fue esto,
1554890	1556370	ya fue, quiero hacer algo más grande.
1556870	1558410	Vamos por Pompeyo, crucemos
1558410	1560770	el Rubicón, vamos... Esa
1560770	1562610	hambre es la que
1562610	1564030	necesita la República Argentina.
1564830	1566550	Argentina debe tener envidia de sí
1566550	1568570	misma. Argentina debe mirar su
1568570	1571070	pasado y querer quintuplicarlo.
1571530	1572550	Argentina, hay un tema
1572550	1574950	de, si no me equivoco, una murga uruguaya,
1575030	1576110	creo que es Araca Lacana,
1576790	1578930	que tiene una estrofa, una frase muy linda,
1578970	1580490	una frase muy linda,
1580890	1582690	que dice, no quiero que
1582690	1584650	me miren los pasados
1584650	1586430	creyéndome incapaz de
1587130	1588210	repetirlos. ¿Sí?
1588750	1590290	Eso mismo tenemos que hacer con nuestra
1590290	1592570	argentinidad. La primera condición es creer,
1593730	1594910	creer que la Argentina
1594910	1596570	va a ser grande otra vez. Lo estoy
1596570	1598550	diciendo así, es en términos de fe. La fe
1598550	1600470	tiene poder. Si todo, es como el Bitcoin,
1600590	1602550	lo dije cien mil veces, si todos creemos que algo
1603170	1604550	vale cien mil millones de dólares,
1604630	1606650	vale eso, boludo. Uno cree que las
1606650	1608430	finanzas son súper complejas, pero potas son así,
1608610	1610610	mucha gente se pone de acuerdo en algo. Si nosotros
1610610	1612690	creemos que el peso, todos, escucha,
1613410	1613610	sí,
1614890	1616610	esto hay que chequearlo, si nosotros,
1616930	1618570	todos nosotros creemos que el peso vale más
1618570	1620710	que el dólar, no te digo que va a
1620710	1622530	pasar cien por ciento lineal, ¿eh? Pero que
1622530	1624550	le vamos a pelear, ¿sabes cómo le vamos a pelear?
1624550	1626350	O sea, si todos los argentinos empiezan
1626350	1628730	tipo, che, boludo, el peso vale más,
1629050	1630550	el peso vale más que el dólar, el peso
1630550	1632450	está pasando, ¿eh? Está pasando, está pasando, está pasando,
1632470	1634530	no, no, se cae en la cripto, se cae en la cripto, está pasando,
1635210	1635930	ganamos, ¿eh?
1636630	1638210	Y es tan loco que sea así.
1638350	1640410	Después necesitas la parte material también,
1640490	1642490	pero ¿cómo acompaña? Si todo
1642490	1644790	está monesa, si todo está monesa,
1645210	1646590	remontás cualquier cosa, boludo,
1646650	1648690	de eso trato de hablarle, de eso se trata
1648690	1650610	este programa. Para eso
1650610	1652610	uso sus impuestos, los
1654170	1654610	escucho.
1655750	1656630	Hola Rebord,
1656970	1657730	buen programa.
1658750	1660930	Te envío este audio recién vacunado,
1661130	1662610	pronto a entrar en un estado febril
1663170	1664630	de astrazeneca. Uh, dicen que es re
1664630	1666710	heavy. ¿Sabes si lo escucho en diferido o
1666710	1668610	aguante? Vamos, la patria.
1670190	1670810	Viva la patria
1670810	1672630	compatriota, otro audio, escuchamos más.
1673350	1674350	Hola Rebord. ¿Qué haces?
1674350	1677010	Julián de la inexorablemente misteriosa
1677010	1678610	Cinco Santos. Hoy te hablé enojado.
1678730	1680810	Uy. Enojado porque hace unos días leí un tweet
1680810	1682750	de Agop que hablaba
1682750	1684610	de Tomás Rebord como nuestro líder.
1684850	1686990	A ver. Y a mí eso me
1686990	1688810	atacó porque yo lo siento
1688810	1690450	como una jerarquización
1690450	1692810	de un espacio en el cual somos todos iguales.
1693450	1695210	Somos todos compatriotas.
1695690	1696770	¿O quién financia esto?
1697070	1699090	¿Los grandes intereses o el pueblo
1699090	1700890	con sus tributos? El pueblo
1700890	1703010	con sus impuestos. Por favor,
1703170	1704950	esto se tiene que rectificar ya mismo, ¿eh?
1705330	1706770	¿Cómo estás, compatriota? Te mando
1706770	1708470	un saludo. Yo te voy a explicar
1708470	1710270	un poco de lo que padecés.
1710470	1711930	Sos un poco zurdo.
1712250	1713570	Sos un poco hippie también.
1714710	1716470	Hay algunas cosas que dijiste que son ciertas.
1717750	1718630	¿Verdad? Número uno.
1718770	1720410	Este espacio de ustedes. Por eso
1720410	1722450	por ejemplo hablaste vos que sos zurdo y
1722450	1724390	hippie, por ejemplo. ¿Acaso alguien te censuró?
1724470	1726130	No. Hablaste vos. ¿Por qué de todo?
1726190	1728290	Porque vos lo pagás. Lo cual
1728290	1729950	no significa linealmente
1729950	1732050	que vamos a hacer todo lo que cada uno quiera
1732050	1733910	en un estado de asamblea permanente.
1735010	1736570	No somos Luis Zamora.
1736570	1738910	Esto no es autodeterminación y libertad, ¿viste?
1739410	1740610	Pero no excluimos a nadie.
1741090	1742830	Si hay troscos, ¿qué los hay?
1742870	1744690	Me consta. Que quieren hacer a la
1744690	1746730	Argentina grande otra vez, nos encontraremos
1746730	1748630	ahí. Y voy a decir algo
1748630	1750670	muy fino, es esto que voy a decir.
1751210	1752790	Pero necesitamos troscos para hacer
1752790	1754930	a la Argentina grande otra vez. ¿A quién
1754930	1756570	vamos a reprimir en Panamericana?
1758030	1758710	Por ejemplo,
1758970	1760850	mucho, perdón, ¿me fui? ¿Fue mucho
1760850	1762390	amarilla? Dejame
1762390	1764610	cierro esta idea y sigo. ¿A quién vamos a reprimir en
1764610	1766910	Panamericana el día de mañana
1766910	1768730	si no hay troscos? ¿Te imaginas
1768730	1770890	un mundo sin trosquistas? Es horrible,
1771090	1772930	¿viste? Todos son felices. No queremos
1773510	1774610	tipo el paraíso.
1775350	1777070	En la Argentina siempre hay conflicto
1777070	1778730	por delante. Entonces lo que
1778730	1780690	trato de decirte es que no hay ningún problema con que vos seas medio
1780690	1782810	hippie, pero nosotros sí tenemos
1782810	1784610	un esquema de organización centralizado,
1786010	1786490	vertical,
1787090	1788370	asambleista en algunas áreas,
1788630	1790710	con falsos plenarios. Son muy importantes
1790710	1792870	los falsos plenarios para toda organización política.
1792870	1795170	¿Vieron? Cuando se juntan todos
1795170	1797010	y dan conclusiones premasticadas,
1797210	1798970	eso es clave. Si no lo haces cada tanto
1798970	1800910	tiempo, la organización se te hace pija, no sé por qué.
1801230	1803370	Una buena interna que ha tanto para revitalizar,
1803690	1804830	pero bueno, yo no,
1805170	1806130	y ahora hablando,
1807010	1809190	haciendo una aclaración más, por supuesto
1809950	1810910	que jamás
1810910	1812770	necesitaría que nadie reconozca a nadie
1812770	1814830	como un liderazgo, ni mucho menos.
1817010	1818430	Pero, qué sé yo,
1818910	1821090	el único que tiene un micrófono unilateral
1821090	1823070	para hablar con todos ustedes circunstancialmente soy yo,
1823110	1825190	entonces hasta que me asesinen, eso va a seguir así.
1825350	1826330	¿Vos podés asesinarme?
1826970	1828390	¿Vos podés asesinarme?
1830570	1833250	O sea, eso es legítimo, es legal,
1833310	1835030	¿viste? O sea, ¿qué pasa Maxi?
1835130	1837150	¿Por qué miras así? Eso es legal, están las reglas,
1837470	1839350	están el código de nuestro manual de estilo,
1840050	1841170	vos podés deponerme
1841170	1842890	y liderar los AGOB.
1843010	1845030	Podés hacerlo. Hasta que eso no suceda
1845030	1846490	te comando a organizarte.
1847010	1848710	Organizate como interna, es más.
1849730	1851090	Hola Rebord, ¿qué opinas
1851090	1852950	del regreso del Pata Medina leyendo
1852950	1855210	el Corán? Saludos desde Villa Antarrita.
1856510	1857190	El Pata Medina
1857190	1859010	leyendo el Corán, esa entrevista por supuesto
1859010	1861170	era uno de los temas obligados que íbamos a tratar hoy
1861170	1862250	porque fue,
1862950	1864750	ustedes lo vieron loco, fue una ACB
1864750	1866830	de Finesa, ¿viste? Y yo cuando
1866830	1868910	compartí, los invito por favor, leanla,
1868930	1870470	es una entrevista que le hacen en letra P,
1870570	1872550	no se queden solo con las impresiones estéticas
1872550	1874610	que son importantísimas, el contenido de la nota
1874610	1876950	está buenísima, buenísima
1877510	1879310	pero bueno, yo la compartí y me empezaron
1879310	1881130	a llegar un montón de anécdotas del Pata Medina
1881130	1882810	de cuando se lo llevaron en Cana,
1882990	1885210	que paró 500 tipos a
1885210	1886890	revelarse básicamente, no lo
1886890	1889230	querían entregar, impresionante, impresionante
1889230	1891150	y el tipo cumplió todos los pasos
1891150	1892550	de lo que es nuestra
1892550	1895050	teoría estética metafísica, ¿viste? Porque el tipo
1895050	1896990	post-estar en Cana
1896990	1898850	y dicho en sus términos ser un
1898850	1900790	líder en el circuito
1901370	1902390	carcelario, sale
1902950	1905110	redimido, sale como mensajero de Dios
1905670	1906730	leyendo el Corán
1906730	1909550	con un extrañísimo
1910530	1911250	shrek budista
1911250	1913110	peronista, o sea, uno de los engendros más
1913110	1915490	horribles que vi en mi vida y al mismo tiempo me parece ahora
1915490	1916910	una de las mejores, un totem,
1917190	1919190	es un totem de la argentinidad ese shrek
1919190	1921150	insólito. Y el Pata Medina
1921150	1923130	es un tipo que fue tremendamente perseguido
1923130	1925090	por el macrismo, yo no, a ver, acá
1925090	1927090	en Maga no jugamos a nadie, ustedes lo saben
1927090	1929250	y tampoco hacemos controles de calidad, ¿viste?
1929690	1931350	Yo que sé que mierda hizo el Pata Medina
1931350	1932710	o no lo hizo, yo lo único que sé
1932710	1935190	es que hay cientos de dimensiones de lo que el tipo
1935190	1936950	sufrió que fueron enormemente
1937590	1938570	injustas, ¿por qué?
1938630	1940830	y esto es blanqueado por los
1940830	1942730	cráneos del macrismo, por su mesa judicial
1942730	1944690	por todo lo que fue la estrategia de poder
1944690	1946790	y de implantación de hegemonía
1946790	1949010	que Macri la tuvo y muy clara
1949010	1950710	eligieron al Pata Medina como emblema
1951910	1953170	como dice el progresismo ahora
1953170	1954470	de todo lo que está mal
1954470	1956910	bueno, eso, eso lo hizo Macri con el
1956910	1958950	Pata Medina, fue tipo la representación
1958950	1961010	corpórea de la Argentina que querían destruir
1961010	1962670	el poder sindical
1962670	1964930	un negro de la UOCRA, ¿viste?
1965370	1967110	todo turbio y enigmático
1967110	1969190	y mafioso con camperas de cuero
1969190	1971150	y cadenas doradas, el chabón era
1971150	1973350	eso, era el físico rol de lo que
1973350	1975150	necesitaban ver arrastrado
1975150	1977430	ver a la Argentina de rodillas
1977430	1978770	y lo hicieron
1978770	1981190	y el tipo estuvo ahí resistiendo
1981190	1983110	estoico, entonces al Pata Medina
1983110	1985350	se le reconoce un lugar en esta historia como una de las tantas
1985350	1987350	personas que encarnaron
1987350	1989270	un proceso que va más allá de ellos mismos
1989270	1990430	entonces esto pasa muchas veces
1990430	1993370	el sabalero agujereando una urna con el que hablamos un ratito
1993370	1995270	fue más que él, fue más que Martín González
1995830	1997070	por un ratito
1997070	1999270	es lo que hace mucho venimos hablando en nuestra ciencia
1999930	2001170	de los catalizadores
2001170	2003130	de la mística, viste, cuando uno funciona
2003130	2004930	como representación de algo más
2004930	2007090	de algo superior así, el Pata Medina
2007090	2009070	fue eso y saludamos su regreso
2009070	2011110	porque entendió perfecto
2011110	2013550	su rol estético, ustedes ven esa entrevista
2013550	2014870	el chabón literalmente dice
2014870	2017470	soy un instrumento de Dios
2017470	2018990	o sea no puede estar más fino
2018990	2020610	el Pata Medina está dulce
2020610	2023630	le tirás una pelota y la baja, pero tipo sin impacto
2023630	2025790	los escucho compatriotas
2025790	2026690	que haces de rebordo
2026690	2029190	hoy me pasaron dos situaciones
2029190	2031670	que para quien no tiene el ojo afilado para la mística
2031670	2033010	son completamente
2034290	2034770	inconexas
2034770	2037670	pero para aquellos que entendemos de la mística
2037670	2039470	que haría la Argentina Grande otra vez
2040430	2041510	sabemos ver la relación
2041510	2043930	hoy me desperté cantando la marcha de San Lorenzo
2043930	2044810	tranquilamente
2044810	2046410	la pongo
2047610	2049170	y mientras leía Twitter
2049170	2051510	y sonaba la parte de cabral soldado heroico
2052430	2053290	apareció la noticia
2053290	2055090	del tipo este que recibió
2055090	2057190	a los chorros en su casa con una hacha y una pesa
2057190	2057910	y se defendió
2058410	2060990	y yo ahí sentí un momento místico
2060990	2062670	que hace la Argentina Grande otra vez
2065210	2065650	hermoso
2065650	2066890	gracias compatriota
2066890	2068990	vieron lo que es esto, esto es lo que nos une
2068990	2070290	esto es lo que nos une
2070810	2072490	y pensar que hay gente que no cree
2072490	2074490	yo no lo puedo creer de lo que se están perdiendo
2075170	2076350	no vi esa noticia
2076350	2078110	si me la pueden pasar ahora
2078110	2080530	la otra que vi que me pareció fascinante
2080530	2082250	y no vi que me la hayan recomendado
2082250	2084870	fue al abuelo ese que
2084870	2086230	expulsaron de un geriátrico
2086230	2088610	por vender pastillitas que las pintaba de azul
2088610	2090630	para venderlas como viagra
2091650	2092530	es espectacular
2093550	2094410	es el tío
2094410	2096650	de los sopranos, dejate de joder
2096650	2098150	es un genio absoluto
2098150	2100230	esa persona está haciendo la Argentina Grande otra vez
2100230	2101250	leía por ahí en twitter
2101250	2103990	después dicen que bancan a los emprendedores
2104650	2106030	hermano, por favor
2107750	2108870	hola Rebort
2108870	2111170	che, porque no arrancó Maga
2111170	2111650	como?
2111850	2113950	que pasa que no arranca, estoy acá en Twitch
2113950	2115210	esperando la transmisión
2116450	2118230	tengo acá el Twitch abierto todo
2118890	2120010	un palito
2120010	2121990	para nuestra directora Micaela Luzardi
2121990	2123550	que vino acá
2123550	2125170	Miki, pregunta para Maga
2125170	2127690	pregunta para arroa Miki Luzardi
2128190	2130510	Miki Luzardi nos trató un poco de boludos
2130510	2132010	a los compatriotas
2132010	2134450	pregunta, no es una
2134450	2135690	por favor, no es una acusación
2135690	2138490	es la patronal de esta radio
2138490	2139870	yo la respeto, la quiero
2139870	2142190	fue el otro día su cumpleaños, le mando un saludo
2142190	2143930	nos una una relación de compañerismo
2143930	2144890	respeto y amor
2145450	2148350	pero vino acá, habló de un Twitch
2148350	2149210	no?
2149570	2151250	que se yo, para pensar
2152970	2153730	hola Rebort
2153730	2155630	se puede decir que la salida de tv
2156290	2157910	representa la caída del último
2157910	2159470	Bastión Macrista
2159470	2161150	se puede decir eso?
2161410	2163930	la verdad, aprobo totalmente esta limpieza
2163930	2165730	y esta refundación que está haciendo
2165730	2167810	Román en boca, basta de esos jugadores
2167810	2169530	que los ves de vacaciones y están en
2169530	2170950	Monte Carlo, en Disney
2171630	2173430	los ves a los primos, a los de la otra
2174550	2174990	vereda
2176570	2177650	tiene los fines libres
2177650	2179650	está en el campo, el secario roja está
2179650	2181450	se vuelve a Paraguay, está cosechando
2182190	2183650	mandioca, basta de esos jugadores
2184850	2185630	yo creo que
2185630	2187870	con la llegada de nuestro líder espiritual
2187870	2189830	es más, confío en que
2189830	2192030	esto va a cambiar, hay que profundizar
2192030	2193730	hay que profundizar, nada más
2193730	2195610	saludos desde Gualeguaychú
2195610	2197210	la tierra de Alfred
2197210	2198970	de Angeli
2199570	2201570	se puede decir que el dirigente rural
2201570	2202950	con más mística del país
2204490	2205690	un saludo grande
2205690	2207850	compatriota, este tema es tan complejo
2207850	2209650	que lo quiero tratar a la vuelta de la tanda
2209650	2211410	me dejan, se puede ahí, producción
2211410	2213650	estamos ok, perfecto, nos vamos a una tanda
2213650	2215710	y volvemos con la premisa
2215710	2216630	de este compatriota
2216630	2219850	si la salida de TV es una derrota para el macrismo
2219850	2221470	lo analizamos en Maga
2221470	2223410	Lunes de 20 a 21
2224790	2225390	Maga
2225390	2227030	En esta cuarentena
2227030	2228690	te quedaste en casa
2229890	2231410	y cocinaste con rock
2233450	2235830	caramelos en forma de corazones
2236630	2239530	Para hacer caramelos con forma de corazones primero
2239530	2241550	prendete a una botella vacía
2241550	2243810	entonces se empieza a derretir chocolate
2244410	2245630	manteca, azúcar
2245630	2247410	y bicarbonato a baño María
2247410	2249750	coloca todo en una fuente
2249750	2251910	y una vestibio, usa un cortante
2251910	2253330	en forma de corazón
2253330	2255350	dicen que hay algo que tener
2255350	2257630	y no muchos tenemos, por eso
2257630	2259750	no te los comas todos de golpe
2259750	2261730	también hay
2262750	2263350	caramelos
2263350	2265990	con forma de corazones
2265990	2267650	En medio de cualquier pandemia
2267650	2269650	el rock tiene sus recetas
2270610	2271590	cuídate
2271590	2273650	para cuidar
2275210	2277750	93.7
2277750	2280050	Nacional Rock
2297650	2299410	93.7
2299410	2301890	Nacional Rock
2301890	2303330	Hazé la tuya
2303330	2304550	Hazé la tuya
2304550	2307490	pero no hagas cualquiera
2307490	2310530	Termina el día lejos de casa
2310530	2312610	Estamos en la luna
2312610	2314230	Un viaje por la música
2314230	2316070	y la imaginación
2316070	2318610	Estamos en la luna
2318610	2319890	de lunes a jueves
2319890	2321510	de 21 a 0
2321510	2324010	con Tranquilando, Griselda Angelo
2324010	2325290	y Agustín Camisa
2325290	2326890	Estamos en la luna
2326890	2328450	por 93.7
2328450	2329990	Nacional Rock
2331210	2333690	Hazé la tuya
2333690	2335350	93.7
2335350	2336390	Seguinos en Facebook
2336390	2338370	Nacional Rock 93.7
2338370	2339370	Tomás Rebor
2339370	2344790	Hola Rebor, de acá te saludo Iñaki
2344790	2345970	desde Monte Grande
2345970	2348330	ya tenemos la parrilla prendida
2348330	2349650	una tapita de asado listo
2349650	2351530	para hacer a la Argentina Grande otra vez
2351530	2353390	Nos merecemos ser felices Rebor
2353390	2354710	De acá el conurbano
2354710	2357190	un fuerte saludo fraterno
2357930	2359670	Un fuerte abrazo
2359670	2362090	compatriota, nos merecemos ser felices
2362090	2363710	que lindo todo eso
2363710	2365690	Yo me quiero remitir a la frase
2365690	2367370	de otro profeta espiritual
