start	end	text
3469990	3471690	no importa, yo como dijo el compatriota
3471690	3473910	en el gran esquema de las cosas soy un mero accidente
3473910	3476250	no soy relevante, pero son días difíciles
3476250	3478030	para mí y quiero que sepan que
3478030	3479690	hacer este programa me hace feliz
3479690	3482410	enormemente feliz, gracias a ustedes, gracias al intercambio
3482410	3483650	gracias a la producción acá
3483650	3485950	gracias al equipo nacional rock, incluso
3485950	3487750	aunque Mickey no quiera poner un Twitch, pero bueno
3487750	3489730	son cosas que pasan, no, tiro un abrazo grande
3489730	3492230	a Mickey también que permite este espacio
3492230	3492690	si
3494770	3495570	nos vemos
3495570	3496490	nos vemos
3497790	3499570	perdón Max, ya sé que me pasé
3499570	3501070	ya estoy, ya voy
3501630	3503790	nos vemos juntos
3504810	3505690	la semana
3505690	3507290	que viene, el lunes de vuelta
3507290	3509190	el mejor día de la semana, el lunes
3509190	3511150	para hacer a la Argentina
3511150	3512630	grande otra vez
