start	end	text
1363120	1365940	¿Sabes lo feo que es eso? Es feo para ellos y para nosotros.
1367220	1371720	En cambio, Fede Quintana, todo preso, todo cao piña, me lo va a agradecer porque va a decir,
1371720	1375440	al fin pusiste las cosas en su lugar. Y esto hace este programa, pone
1375440	1381260	espiritualmente las cosas en su lugar. Como creo, como creo, como creo, que en
1381260	1387840	algún punto, eh, lo hizo el nuevo gabinete. Vamos a hacer un análisis metafísico
1387840	1391580	del nuevo gabinete. Y esto, si quieren mandar audios, vamos a ver qué hago con los
1391580	1397620	audios, pues 11 39 39 88 88. Vamos a hacer un análisis, vamos a hacer un análisis, ¿sí?
1399380	1402960	Me preguntarán, chay, ¿por qué estás aliviado? ¿Por qué dijiste, se recuerdan? Yo dije la
1402960	1409040	palabra alivio con el nuevo gabinete. Porque yo creo, primero, y esto también, hubo
1409040	1413560	mucho, el fin de semana, viste, hubo mucho, mucho, mucho politólogo. Vamos a decirlo
1413560	1417640	como corresponde. Me mandaron un politólogo muy piola que hizo un pasacalle que decía,
1418040	1422260	viste, la Argentina grande. Y eso a mí me caeré bien y está todo bien. Pero yo hago un toque
1422260	1426440	igual, lo dije, viste, cuidado con los politólogos, cuidado con los politólogos. Si un
1426440	1431260	politólogo puede, te come, ¿sí? Entonces, ¿qué es lo que está pasando? Muchos analistas,
1431440	1435740	muchos expertos agarraban y decían, no, no, el nuevo gabinete no suma ni un voto. Este gabinete
1435740	1440860	no lo puede votar nadie. Me están jodiendo, traen aníbal, aníbal, el revival de aníbal,
1441000	1444180	¿entendés? O sea, que es el rostro de una derrota electoral terrible para nuestro
1444180	1449840	movimiento. Esa es la renovación. Y el tema es que confunden su misión espiritual. Confunden,
1450300	1454200	primero confunden el estado o situación general, o sea, tienen un mal análisis estratégico al
1454200	1457760	respecto de lo que está pasando, un mal análisis de cuestión macro y después la función espiritual
1457760	1464580	del gabinete, ¿sí? Estamos arrinconados. El peronismo está mal. La situación del país está
1464580	1469640	muy mal. O sea, ¿qué más falta para que lo vean? Los resultados de las últimas elecciones no
1469640	1475140	fueron suficientes para que vean que la cosa está mal. Estamos en una dimensión supervivencial. Es
1475140	1481620	decir, nuestras necesidades políticas son básicas y están insatisfechas. Son cuestiones estructurales
1481620	1485780	de orden. Yo ya me cansé de decir esto porque ahora se hace el análisis de todos. Pero este
1485780	1490220	gobierno viene con una falla en el origen muy jodida en tema del ejercicio del poder, que es
1490220	1494480	la propia decisión que lo hace existir, lo condena a la vez. Y es el hecho de la renuncia a Alberto
1494480	1500580	Fernández a ejercer poder propio, porque no pudo, no quiso, no supo. Pero cuando Alberto decidió no
1500580	1507420	armar el albertismo, es como cuando la estrella de la muerte decidió poner una válvula que disparas
1507420	1511080	ahí y le das directo al corazón. Vieron cuando los ingenieros de la estrella de la muerte en
1511080	1516000	Star Wars dijeron, y si dejamos una aeroventila expuesta por donde puedan matarnos a todos. Bueno,
1516040	1521840	es exactamente lo mismo que pasó, no previsible. Yo no creo que él vio venir esto. Él no quiso
1521840	1526560	armar el albertismo con mucha justeza y con mucho atisismo para no generar un conflicto al interior
1526560	1530460	del frente de todos. Pero en algún punto esto fue una gran condena para el ejercicio del poder.
1531120	1536220	¿Por qué? Porque al no tener fuerza propia, paulatinamente todos te pierden el respeto. Al
1536220	1540140	mismo tiempo que él nunca salió espiritualmente de su función de mediador del poder, ¿viste?
1540140	1544840	Él es administrador del poder por su condición de armador de toda la vida y de gestor armador,
1545020	1550140	no tanto gestor, ¿viste? Entre fuerzas lobista. Él es como un presidente lobista de sí mismo.
1550540	1556280	Análisis que ya hemos hecho tanto, tanto, tanto, ¿viste? Y después se dedicó a dilapidar su propio
1556280	1559820	capital político mediante sus declaraciones. Era un tipo que no podías defender porque cada
1559820	1564300	vez que lo defendías él solo te dejaba en offside. Alguien lo atacaba. Vos salías a decir,
1564420	1568320	esta persona es una hija de puta, y después salía él a la tarde a decir, no, no es una hija de puta,
1568320	1570740	es verdad, tengo que modificar. Y vos decías, bueno, está bien, andate la concha de tu madre,
1570840	1576100	¿entendés? O sea, tomaba una medida. Vos salías a bancarla, después lo salían a reputear,
1576140	1579500	vos bancabas, y después se agarró y decía, no, es verdad, voy a dar marcha atrás. Bueno,
1579760	1584460	a la tercera que nos hizo esa el chabón se empezó a exponer solo y el chabón rifó mucho su capital
1584460	1588800	ahí, algo que es muy jodido. Y no estoy jugando, esto es lo que pasó. No estoy jugando, yo no saco
1588800	1594120	los pies del plato, pero esto es lo que pasó. Es así. Eso sumado a una gran dificultad en el
1594120	1597660	ejercicio del poder al respecto del loteo horizontal de los ministerios. El hecho de que
1597660	1600960	los ministerios no sean verticales. ¿Qué significa el ejercicio vertical del poder?
1601040	1605680	Ya lo hemos hablado acá. Se toma una decisión, se ejecuta. Acá cada decisión era una asamblea,
1605680	1614480	¿se entiende? Y todo el gabinete anterior actuó como mediador del poder. No fue un gabinete que
1614480	1619940	se manejó como lo que estaba pasando en realidad, que es una crisis total. Estamos en Vietnam y eran
1619940	1624900	un gabinete escandinavo. Eran un gabinete que tenía tiempo. Tenían tiempo. Si vos le mandabas
1624900	1630200	un whatsapp te contestaban. ¿Cómo puede ser? ¿Entende? Un gabinete con tiempo con la Argentina
1630200	1633160	prendida a fuego. Tienen que estar apagando incendios todos los días. Tienen que no poder
1633160	1638480	ni respirar. ¿Por qué? Porque yo los obligo. No, yo soy un boludo. Ellos se metieron en esa. Si vos
1638480	1643440	te metés en la política es para que te caguen a piñas y bancártela. Entonces, ese gabinete estaba
1643440	1647540	muy jodido. ¿Viste? Acá en el chat ponen fuerza alberto. Y sí, cuando arrancamos con los fuerza
1647540	1652060	alberto no podía parecer más débil, ¿no? Es la paradoja. La paradoja es toda una gran paradoja en
1652060	1656000	ejercicio del poder. Entonces, ¿qué es lo que sucede? Eso, más la situación actual, nos llevo
1656000	1662160	una crisis estructural terrible. Terrible. El problema era supervivencial. Los grandes
1662160	1666440	sesudos analistas también dicen, no, Cristina se equivocó. ¿Cómo va a poner en jaque así al
1666440	1670540	frente de todos, viste? Porque son muy agudos. Son muy agudos. Después no pasan los pasos,
1670540	1674960	pero son muy agudos, viste? Entonces vos decís, ¿sabes por qué Cristina hace eso? Porque no le
1674960	1680640	dejaron otra, boludo. No le dejaron otra. Si vos va a hablar... A ver, ustedes saben que yo no creo
1680640	1683600	en las conspiraciones. Las conspiraciones son una conspiración. El poder siempre es mucho más
1683600	1688900	lineal. Las cosas son tal cual como las ves. El 90% de las veces. Cristina lo fue a ver 18 veces,
1688940	1697240	como contó. No da pelota. No activa. O sea, no se pone en el mood espiritual, químico, ¿sí? De
1697240	1701840	jugos gástricos que hay que tener para lo que está pasando. No lo podés despabilar. Bueno,
1701860	1707000	vamos a pudrirla. A veces hay que pudrirla. La política es así. Electoralmente, para ahora,
1707000	1710680	quizás no es conveniente, eh. Yo no estoy diciendo, hoy jugada maestra de ingeniería
1710680	1716080	electoral. Estoy diciendo, hermano, tenemos que salir del rincón. Yo lo dije cien veces,
1716100	1721900	lo he dicho en la radio con Navarro incluso. O sea, la táctica pugilística de Alberto Fernández
1721900	1726940	era la de Homero Simpson en... Era dejarse pegar hasta que el otro se caiga. Era... Te llenaron
1726940	1732760	tanto la cara de dedos que de repente el rival se cae. ¿Entendés lo que digo? Entonces desde ese
1732760	1736360	lugar que te dijo espabilate, espabilate, espabilate. No, así ya voy a hacer los cambios. No,
1736440	1741060	mira, no me estás entendiendo, eh. No me estás entendiendo. Porque ahí cuál es la derecha que
1741060	1746880	yo le doy a Cristina. Ella se para desde que el capital es de ella. Eso es verdad, boludo. No digo
1746880	1751360	que la alcanzaba sola, no sé. Hay gente que dice que si yo, no sé. Pero lo que digo, el capital
1751360	1755020	grueso es innegable que es de ella. Y si ella compara con la elección de unidad ciudadana,
1755340	1759900	en esta elección se sacaron menos votos que cuando ella fue sola contra el planeta Tierra. Yo... Ponete
1759900	1765760	medio segundo en el lugar de Cristina, analista cesudo de la realidad, vos sos Cristina. Saqué
1765760	1771820	cuatrocientos mil votos menos que la elección anterior. Yo te cago a cachetazo. ¿Pero qué crees
1771820	1780040	que haga? No sé. No, pero es muy difícil. No me expliques más. No me expliques más. Hacé en
1780040	1784580	cualquier dirección. Porque ustedes saben, nosotros adherimos a la doctrina de Teodoro
1785320	1792360	en un momento de decisión. Lo mejor que puedes hacer es tomar la decisión correcta. Lo segundo
1792360	1795960	mejor que puedes hacer es tomar la decisión incorrecta. Y lo peor que puedes hacer es hacer
1795960	1802600	nada. Entonces, por eso yo sentí alivio en un primer lugar. Primero sentí alivio. Segundo,
1802840	1807320	vamos en análisis metafísico. ¿Qué simboliza este gabinete? Este gabinete es literalmente
1807320	1813940	una one last mission gigante. Ustedes saben, yo tengo debilidad por esa narrativa. ¿Cómo no voy
1813940	1821640	a bancar a los expendables de la política? Yo lo decía. El gabinete tiene que ser malo, feo,
1821980	1827480	sucio, oscuro. Porque hay que empezar a devolver trompadas. Esa es la necesidad del primer orden.
1827800	1832760	Un gobierno que vuelvan a respetar. Un gobierno que se vuelva a plantar. Si nos llenan la cara
1832760	1838400	de dedos, por lo menos devolvamos una. Ni siquiera te digo a voltearlo. Que se me escuche bien esto.
1838540	1843620	De acá a noviembre. Hermano, yo no la veo. Ojalá me equivoque. Porque bien saben que prefiero ganar
1843620	1847980	a tener razón. Bien saben que prefiero ganar a tener razón. Pero yo no veo que la hemos
1847980	1853120	vuelto acá a noviembre. Hay mucha diferencia. Y la cosa está muy mal. Y no lo resolves en dos meses.
1853780	1859800	Este gabinete no es para dar vuelta a la elección. Es para activar. Es para devolver piñas. Son los
1859800	1867440	expendables de la política. Trajeron... Estaba Aníbal achando leña en el monte. Así. Lo fueron a
1867440	1872520	buscar Aníbal. Una última misión. No, no dijo. Tenía más ganas. Aníbal le faltaba. Iba día por
1872520	1877820	día a cinco venes a decir falta alguien con experiencia. Y con bigote. Este. Los fueron a
1877820	1883160	buscar al monte. Una última misión. Los fueron a buscar a Julián Domínguez. Exiliado. Todo calloso.
1883200	1888580	Con vacas. Yo siempre lo imagino. Julián Domínguez rodeado de vacas. Vacas y campo. Con las fuerzas
1888580	1895180	agrestes del campo. Esa hora Julián. No, no. Yo ya me retiré. No, no, no. Eso ya no es para mí. Esa
1895180	1901980	hora. One last mission. Decime si no es el escuadrón suicida, boludo. Decime quién de ese grupo está
1901980	1907480	pensando en su capital político. El presidente es Alberto. O sea, el presidente te recibe y te dice
1908120	1914180	ayuda. Bueno, ¿cómo está el país? ¿Tenemos indicadores para levantar? Ninguno. Bueno,
1914520	1921820	¿tenemos caras que sumen votos? Ninguna. Bueno, qué sé yo. Vamos a morir. Vamos a ganar o morir.
1921880	1928800	Vamos a combatir. Vamos a pegar. Es el suicide squad del peronismo. ¿Dónde ves que estamos
1928800	1936020	yendo a seducir blandos? ¿Dónde ves que está tu necesidad de que Manzur no me gusta? ¿Vos sos la
1936020	1941260	última prioridad de este estado en protoguerra civil? Yo puse. La función de este gabinete no es
1941260	1945160	ganar votos, es evitar una guerra civil. Y había muchos libertarios imbéciles que me contestaban
1945160	1948900	diciendo, fue guerra civil, qué exagerado. ¿Vos crees que las cosas están bien, la concha de tu
1948900	1953940	madre? O sea, paradójicamente entonces la situación está mejor de lo que yo creo. ¿Vos crees que no da
1953940	1960840	para esto? Es un consejo de guerra que necesitas. El gabinete debería haber cambiado al instante que
1960840	1965680	arrancó la pandemia. Al instante. Vos no podéis seguir con ese gabinete escandinavo de politólogos
1965680	1970620	y carilindos al frente de una crisis total. Necesita gente horrible, hermano. Necesita gente
1970620	1976640	horrible. Yo ya veía, leía una nota ahí en corta. Informate bien, informate rápido. Ah, metía chivos
1976640	1983020	de costado. Leía una nota en corta que decía, Aníbal yendo a reunirse con Perotti para resolver
1983020	1992900	la inseguridad en Rosario. No es tan difícil, es otra mentalidad, es otro espíritu, es otra alquimia,
1993920	1999400	es otro jugo gástrico espíritu. La vieja medicina, la antigua, la que creía que eran todos humores,
1999780	2005680	tenía mucho de verdad, boludo. Después la ciencia vino con, ah, son células. ¿Qué células? Son
2005680	2013560	espíritus, boludo. ¿De qué está hecho Aníbal? De fuego, hermano. Fire. Fuego. Fuego. Eso hace falta.
2013960	2019540	Hermano, vos sos ministro de seguridad. Vos sos ministro de seguridad. ¿Cuáles son tus preocupaciones?
2021380	2028760	Una. Resolver la inseguridad. No importa que tanto sea venderme humo todos los días,
2029060	2034340	pero tu única reputa preocupación es evitar el crimen. Sos Batman, ¿entendés? Si sos
2034340	2039380	ministro de seguridad. Sos Batman. Tienes que subir helicópteros, bajar, caer en un batimóvil.
2040460	2048180	¿A mí sabe la tranquilidad que me da leer Aníbal va a Rosario a resolver la inseguridad? Va a tener
2048180	2055960	una reunión, pero la resuelve. Ya está. Aníbal resolvió la inseguridad. Después tapamos los números,
2056000	2062700	no hay un puto muerto más. Aníbal lo resolvió. Aníbal resolvió la inseguridad. A otra cosa,
2062700	2067520	más acordar a cuando estaba María Eugenia Bielsa en vivienda, con perdón de la casa Bielsa a la que
2067520	2074360	saben que yo tributo espiritualmente, y cuando fue el quilombo de Guernica. O sea, si sos ministro
2074360	2082020	de vivienda, ¿cuántas más prioridades podés tener que un escándalo nacional por falta de
2082020	2089040	vivienda? ¿Cuántas? ¿Cuántas más prioridades tenés? Vos sos ministro de seguridad. Sos Batman.
2089040	2093780	Vos sos Julián Domínguez, sos ministro de agricultura. No me acuerdo cómo por ongas se dice. Vos tenés
2093780	2100140	que dormir con vacas. Vos sos jefe de gabinete. Vos sos jefe de gabinete. Y tenés que poder
2100140	2105620	mandar una cabeza de caballo a tus enemigos para que se despierten al otro día con toda la cama
2105620	2111200	ensangrentada, hermano, ¿entendés? Y eso es el cambio. ¿Sabés por qué, Banco? ¿Sabés qué es lo que me gusta de
2111200	2118880	Manzur? Ahora que volvió de moda los análisis más lombrocianos, los trajimos nosotros. Nosotros
2118880	2125040	recuperamos al hombroso. Acá es maga, ¿eh? Recuperamos al hombroso. ¿Sabés por qué me gusta Manzur? ¿Por qué es feo,
2125180	2138440	boludo? ¿Sabés por qué me gusta Manzur? ¡Ay! ¡Ay! No opines de, viste, Manzur. Manzur es negro, gordo y pelado y tucumano.
2140920	2146920	No opines de los cuerpos de la gente. Escúchame, yo no estoy jugando, eso es muy distinto. Hay
2146920	2155520	mucha gente que cree que cuando uno dice esto está jugando peyorativamente. Y como ellos proyectan su
2155520	2160820	malicia, quieren censurarla en voz. ¿Saben qué les pasa a eso a mucha gente? Cuando hablan de la
2160820	2168880	corrección política, ven un chiste que ellos creen que es ofensivo por cómo ellos lo dirían y resulta
2168880	2173920	que lo quieren callar. Pero lo que quieren callar no es el chiste, es lo que ellos piensan, hermano, y
2173920	2180140	eso no se calla, eso te vas a dormir de noche y lo pensás igual. A mí me encanta Manzur negro,
2180500	2189620	gordo y pelado. Son activos, son lo que necesitamos. Manzur negro, gordo y pelado me parece el tipo
2189620	2196720	más sexy de Argentina. ¿Vos crees que eso es cancelable? Porque tenés vos tus propias
2198380	2201940	normas heteropatriarcales al respecto de lo que son los cánones de belleza. ¡Me cago en tus
2201940	2209160	cánones de belleza! Aguante Manzur. Pasamos del tipo más, en términos canónicos, estéticamente
2209160	2215340	lindo de toda la política argentina. Santiago Cafiero es hermoso, Cafiero. ¿Cómo se llama esto?
2216240	2221480	Ejemónicamente hermoso. Ejemónicamente hermoso, Cafiero. No es tiempo para lindos, hermano. No es
2221480	2226400	tiempo para ese tipo de belleza. Es tiempo para un Tony Soprano a la Argentina. ¿Vieron que es igual
2226400	2230980	a Tony? Es muy parecido, boludo. Yo lo veo, tiene los ojos de... ¿No lo viste vos, Maxi? Tiene los ojos
2230980	2236940	de Tony Soprano, boludo. Es Tony Soprano negro. Necesitamos eso. ¿Saben lo que me tranquilizó la
2236940	2244020	foto, la primera foto de Alberto, Fabiola y Manzur? Cambió todo. Cambió todo el gabinete. Ustedes
2244020	2248300	pensarán, ¿qué pelotudez es analizar esto? ¿Qué, boludo? Ay, qué superficial. A mí me la pasan
2248300	2253500	puteando en redes. Sigan puteando la concha de su madre. Me chupo un huevo. El 60% de la política,
2253980	2259140	64% de la política, es estética. ¿Sabían eso? Y no estética en términos de qué ves, cómo te
2259140	2263220	miras. La gran mayoría de diferencias que vos crees que tenés en política son diferencias
2263220	2268160	estéticas. Te podría gustar la misma idea en otro receptáculo. Y lo que necesita la Argentina hoy
2268160	2273720	es Juan Manzur. ¿Sí? Vamos a ver cómo funciona eso, obviamente. Vamos a ver cómo funciona. Pero
2273720	2279060	a nivel estético, a nivel... La imagen que me proyecta ese gobierno es diametralmente diferente.
2279420	2283920	La política muchas veces es eso. Vos te pensás que es más complejo. Vos sos politólogo. Vos me
2283920	2288360	querés hacer un análisis de las fuerzas en Tucumán, de los lobbies de Manzur que tienen,
2288360	2292740	en el plano internacional, de qué sé yo. Manzur es gordo, hermano. No puedes tener un gabinete
2292740	2298220	sin un solo gordo. No puedes hacer nada sin un solo gordo, armando sindicatos sin un gordo. En
2298220	2303660	serio, está todo bien con los análisis deconstruidos y con perspectivas no hegemónicas. Y yo banco
2303660	2308180	todo eso. Yo banco la deconstrucción de los cánones para no ensalzar unos en desprecio de
2308180	2313600	otros. Pero después la información sigue existiendo, hermano. Arma un sindicato sin un
2314220	2321600	gordo. Goberna una crisis con esa caterva de politólogos, antropólogos y sociólogos. Necesitás
2321600	2327820	carne. Necesitás alguien que te pueda poner un sopapo, aunque no lo haga. Son expresiones
2327820	2333140	simbólicas. Son expresiones espirituales. Son expresiones de otra cosa, simbología.
2334500	2338740	Por eso, por eso no llegué a desarrollar todo. Ahora seguimos con el gabinete. Vamos a pasar
2338740	2343500	una tanda, ¿no? Vamos a ir una tanda así y volvemos entonces. Volvemos con el gabinete. Vamos, tanda.
2349480	2353240	Quédate y mira para arriba. Estamos en la luna.
2356880	2366660	Franky Landon, Griselda Angelo y Agustín Camisa. 21 a 24. Estamos en la luna. 93.7. Nacional Rock.
2368220	2375540	Termina el día lejos de casa. Estamos en la luna. Un viaje por la música y la imaginación.
2377480	2385560	Estamos en la luna. De lunes a jueves, de 21 a cero. Con Franky Landon, Griselda Angelo y Agustín Camisa.
2386040	2392860	Estamos en la luna. Por 93.7. Nacional Rock. Hace la tuya.
2392860	2398060	Hace la tuya. Desafiaras. Escuchas.
2400120	2410060	Nunca lo conformamos. 93.7. Nacional Rock. Estás escuchando MAGA. Por Nacional Rock.
2417420	2423260	Acá me van a putear, me van a putear. Sacarán el recortecito y lo pondrán en alguna página
2423260	2429660	donde analizarán. Mirad qué horror esto, cómo atrasa, que esto que lo otro. No entienden que yo
2429660	2432840	no juzgo, ¿eh? O sea, de verdad, eso no lo van a entender nunca, pero perfecto. Ustedes,
2432860	2438920	agoveros, ya lo saben. A mí me parece hermoso. Yo banco que cada uno ame y garche con lo que
2439880	2443660	atractivo. Siempre que seas consensuado, no como lo que le pasa a Fede Quintana en la cárcel,
2443680	2449600	en el futuro. O sea, yo banco todo, no juzgo. Por favor, atiendan esto que les digo. Pongan
2449600	2456820	esta vara. La gente que cancela mucho en términos de humor, lo que tiene es el culo sucio. Lo que
2456820	2463840	tiene es el sueño sucio, ¿eh? Porque ven, ven en el otro el prejuicio, ¿sí? Que no quieren
2463840	2468780	confirmar en sí mismos. Y no entienden que uno habla desde un lugar desprejuiciado muchas veces,
2468840	2474180	o con sus prejuicios, qué sé yo. Y creen que es su mandato moral cancelarlo por el bien de la
2474180	2479020	humanidad, cuando en realidad lo único que están haciendo es tranquilizarse a sí mismos, en su
2479020	2483900	sueño, en su conciencia. Recuerdo, si no me recuerdo mal, hay un estándar muy bueno de un
2483900	2489160	pibe que hace humor, eh, hablando, hace humor re fulero. Creo que es Daniel Sloss con la
2489160	2493080	discapacidad, porque el loco tiene una hermana discapacitada y cuenta unas cosas que son terribles
2493080	2496760	y cuenta a su vez como el humor salva a su familia, a mí empecé hermoso y dice muchas
2496760	2500120	estas cosas. No recuerdo si era así, después se los mando igual, después lo pongo ahí en Twitter.
2500700	2504840	Pero piensen esto, es la gente que tiene mucha línea, a mí me encantan los gordos, a mí me
2504840	2508420	encantan los gordos. Yo soy gordo, hermano. Yo pensé, ahora estoy bajando de peso porque tengo
2508420	2513060	que llegar a un nivel metafísico diferente para este fin de año, aunque la hernia me lo quiere
2513060	2518060	impedir. Yo este año llegué a pesar 100 kilos y yo me sentía consagrado en un cenite estético
2518440	2522500	novedoso, porque estaba cumpliendo una misión espiritual diferente a la que haría flaco. Hay
2522500	2525800	cosas que puedes hacer gordo, hay cosas que puedes hacer flaco y hay que vivir todas las
2525800	2531760	transmutaciones de uno con belleza y con amor. Entonces, hermano, lo que necesita ver la Argentina,
2532320	2540480	no hay gente flaca y linda y antropólogos y finoli y esto. Necesitas un gordo tucumano y
2540480	2545920	sabes cómo necesitas decirle gordo tucumano, no cuerpo no hegemónico. Necesitas decirle gordo
2545920	2551440	tucumano porque es un hermoso gordo tucumano, es hermoso, es igual a Tony Soprano, le queda
2551440	2556340	un beso en la boca, es hermoso ese gordo. Yo vi la foto con Alberto, eso es lo que quería hablar
2556340	2562260	antes de la tanda. El balance cambió totalmente, el balance, o sea, lo que era antes el gabinete
2562260	2569600	está manzuriace, es buenísimo, es otra imagen. ¿Eso garantiza que vaya a salir bien? La verdad
2569600	2574220	que es muy difícil. ¿Por qué? Porque, vuelvo al bloque anterior, porque el problema está en el
2574220	2578640	origen. El problema es la falla en la estrella de la muerte. El problema es la dinámica de la
2578640	2582140	administración de poder que ejerce Alberto Fernández. Ojalá la pueda cambiar, vamos a estar ahí para
2582140	2586980	ver si la puede cambiar. Pero la realidad es que este gabinete tan experimentado, hoy lo que tiene
2586980	2594200	que hacer, entre muchas otras cosas, es ordenar al propio presidente. Yo lo puedo decir hasta que
2594200	2599620	me rajen. Igual ahora el jefe de gabinete es Manzur, así que capaz hay que mandarle las cosas, él capaz nos
2599620	2605440	banca. Pero yo lo puedo decir hasta que me rajen, ¿sí? Capaz Manzur le tiene que pegar algún que
2605440	2613660	al presidente. Quizás esto no sale. ¿Cuál es el peligro, obviamente? Alberto es muy poderoso en su
2613660	2620300	albertismo. Alberto tiene un nuevo tipo de poder, un poder que todavía no ha sido escrito. Alberto
2620300	2625620	te albertiza. ¿Cuál es el gran riesgo del nuevo gabinete que de acá a dos meses estén todos en un loop
2625620	2631580	ininterminables de escenas y charlas y anécdotas y se la pasen hablando el propio gobierno como si
2631580	2637620	no fueran ellos los gestores del mismo? Ese es el peligro. Alberto es muy poderoso en un sentido
2637620	2642480	loco, pero Alberto los puede albertizar. Entonces el gabinete se tiene que cuidar de no ser albertizado.
2642740	2647700	Tienen que estar muy concentrados. Pero son tipos laburantes, son tipos que laburan mucho. Más ya
2647700	2652120	si te cagan mejor o peor, son enfermos de laburo. Es toda gente con mucha experiencia, con muchas
2652120	2657080	cicatrices de guerra, que se cagó mucho a trompadas, que probablemente no sumen ni un voto,
2657080	2663240	pero se la aguanta, hermano, y va a devolver piñas. Su primer desafío es no ser albertizado y yo quiero
