start	end	text
2663240	2668880	ser enfático en eso, porque no está ganada esta batalla. Tienen que evitar la albertización por
2668880	2675200	todos los medios. El cerco, bueno, capaz hay que cercarlo un poco, Alberto. Pero es un gabinete de
2675200	2680680	expendables, es el suicide squad y esa es la sensación que a mí me genera. Es espiritual,
2680880	2686600	por supuesto. Es gente que esto no le gusta, porque lo que quiere son otras cosas, porque quieren
2686600	2694600	aplicar su teoría a la realidad. El morenismo ya perdió, hermano. El morenismo, no digo guillote
2694600	2698520	moreno. Lo único que pasó es que no pasó la Paz o guillote, pero yo lo banco y los banco los morenistas
2698520	2703160	también. El morenismo es el otro. Capaz son muy chicos ustedes. El morenismo del frente de
2703160	2708100	izquierda, el morenismo, los viejos morenistas, los que hacían entrismo. Siguen existiendo esos
2708100	2713460	hijos de puta. Y a veces nos atrasan, nada más. Tampoco nos condiciones mucho, pero a veces nos
2713460	2718420	atrasan, nos hacen enroscar, no en discusiones. Y la realidad es que no son peronistas. Y ellos
2718420	2722380	están conflictuados y nosotros no estamos conflictuados. Entonces vaya, vaya, siga, siga, siga,
2722520	2727420	anda, anda, viste. Esa persona que todo el tiempo está explicando dónde está parada. No, yo quiero
2727420	2732020	aclarar que permanezco acá en este frente policlasista para lograr la reivindicación de...
2735260	2740340	¿Quién te preguntó? ¿A quién le estás hablando? ¿Estás todo el tiempo explicando por qué estás
2740340	2746500	donde estás? Eso no significa estar tranquilo, eh. O sea, estás muy conflictuado, hermano. Tenés que
2746500	2751720	dar... ¿A quién le das explicaciones? Yo no doy explicaciones. Aguante Mansur. ¿Por qué? Porque es un
2751720	2758220	gordo tucumano pelado. No, Mansur es... No, no, aguante Mansur. ¿Por qué? Porque es indistinguible
2758220	2766500	de Shrek. ¿Se dieron cuenta de eso? Pongan una foto de Shrek, sácanle las orejitas, pongan un
2766620	2773900	poco de pelonchers, bájenle unos tonos a su tez. Es indistinguible de Shrek. Es igual. ¿Cómo no voy a estar a favor?
2774240	2780600	O sea, ¿cómo no voy a bancar? Por supuesto que banco, boludo. Es tipo, me pones un jefe de avionista, ¿entendés?
2781100	2786780	Este es Shrek. Bueno, vamos, vamos con ese, boludo. No sé quién es, no sé ni qué piensa, ¿entendés? Pero vamos con ese.
2787180	2792640	Así es la política, boludo. Así es la política real. La otra está muy manoseada, muy sobreanalizada,
2792640	2799240	muy tipo, no, acá... Tenías algo que no funcionaba, tenías algo que funcione, tenías algo que funcione, nada más.
2799960	2806020	El principal objetivo del gabinete es que no implosione el gobierno. Es cambiar ejecutivamente su matriz inoperante,
2806360	2813180	completamente inoperante. Un ministerio como hace Aníbal ahora. Aníbal ahora se va a ir a Rosario a resolver la inseguridad.
2813820	2820000	Me sigue dando risa ese título. Aníbal se junta para resolver la inseguridad. ¿Qué va a hacer?
2820000	2826020	No, bueno, acá lo que... Acá lo que hay que hacer... Sí que hay que hacer. Quiero muchas fotos con mapas.
2826200	2833960	Quiero fotos señalando mapas, ¿entendés? Quiero que Domínguez se junte con el campo a resolver el cepo, a resolvélo.
2834380	2840060	¿Sí? Quiero que Manzur se ponga a cachetear prensa, ¿entendés? Quiero que Manzur les desconecte el wifi.
2840200	2844840	¿Sabes qué quiero que haga? Que les desconecte el wifi. ¿Sabes qué quiero que haga? Que lo deje sin celular.
2844840	2850840	Primera medida de Manzur, ponen todos sus celulares en esta caja, como en el colegio. ¿Cómo? Sí, sí, ya no tienen más celular.
2851400	2855660	Ya no tienen más celular. Y para ahí, ¿cómo voy a hacer? ¿Y vas a tener que salir a resolver problemas? ¿Qué?
2856060	2859280	¿A dónde? ¿Dónde están los problemas? Bueno, pues ya averiguarlo, boludo.
2859720	2864340	Pues ya averiguarlo. Tenés recursos del Estado, tenés plata, tenés asesores, tenés gente.
2864780	2869040	Bueno, ¿puedo hacer un pequeño zoom con...? No, ¿qué zoom? ¿Qué zoom?
2869560	2872860	Juntate la concha de tu madre. ¡Andá! ¡Andá!
2873600	2878240	No, bueno, pero la pandemia. ¿Qué pandemia? No hay más pandemia. ¿Qué pandemia?
2878880	2883840	Estamos perdiendo por paliza las elecciones. ¿Qué pandemia? ¿Qué pandemia, pedazo de finlandés?
2884420	2888560	¿Qué pandemia? ¡Basta! Necesitamos otro modelo, ¿sí?
2888800	2892060	Y eso es lo lindo que tiene una ideología, ahora sí, como el peronismo.
2892100	2895040	Esto no la tienen otras porque son más rígidas. El peronismo se adapta.
2895600	2898760	Capaz el peronismo algún día hubiera funcionado bien con un gabinete escandinavo.
2898840	2901300	Yo no quiero ser tan malo con los otros compañeros que pasaron por ahí.
2901420	2904540	Porque la política es una picadora de carne. La política es siempre injusta.
2904760	2907580	No quiero ser malo con esa gente. A veces parece que yo los odio.
2907700	2909680	No, nada que ver, boludo. Nada que ver.
2910040	2912220	Ante todo los comprendo. Pasaron por un lugar rejodido.
2912700	2916300	No era su momento. Espiritualmente no era lo que estaba necesitando la Argentina.
2916760	2919920	La Argentina es caos ahora. Necesitamos un gabinete del caos, ¿sí?
2920740	2923860	Voy a pasar un audio, si tenemos. ¿Tenemos? ¿No?
2923860	2925160	Hola, Revo.
2925540	2929160	Tengo un programa para profundizar. Yo creo que es el momento de profundizar
2929160	2933160	y que la campaña 2023 sea Mansur Donda.
2934020	2934880	Abrazo grande, compañera.
2937580	2942780	¿Dónde está Donda? Donda lo renunció a decir atrincherada en el Inadi, ¿no?
2942780	2946620	Como Jaldo con Tucumán. No la sacan ni con espátula Donda, ¿eh?
2947920	2950760	A Donda la dejaron entrar también. La puerta grande.
2950760	2951840	La puerta grande.
2952220	2955240	Es el problema, que son lo que gobiernan, hermanos. Son lo que gobiernan.
2955520	2956340	Son lo que gobiernan.
2956600	2959340	Permítanme decir una cosa, porque todos estos días me putearon mucho,
2959360	2962000	me putearon mucho, mucho. Recortecito puteada, puteada.
2962080	2964200	No, rebore esto, rebore lo otro, rebore esto.
2965080	2968280	A mí me chupa un hueco que puteen. Puteenme más, me dan poder.
2968620	2972220	O sea, sus puteadas me agrandan. Me hacen increíblemente poderoso.
2972620	2974720	Acumulo gran energía con sus puteadas.
2975500	2976880	Pero quiero decirles algo también.
2977580	2979080	Yo entiendo que estén enojados.
2979080	2982080	Porque la realidad está profundizando.
2983300	2985400	Y eso da bronca y molesta. Molesta que lo diga así.
2986100	2989780	Pero mucha gente de muchos palos diferentes y de muchas ideologías vienen a Maga,
2989840	2992940	vienen a Maga, algunos a confirmar sus prejuicios
2992940	2997660	y algunos a enfrentarse con cositas que tienen adentro que no les gustan, ¿sí?
2998040	3002580	Estos son los conflictuados que todavía no salieron del closet de sus respectivas ideologías, ¿sí?
3002800	3005180	No estoy hablando de Jorge Piba, no estoy hablando de Fede Quintana.
3005180	3010040	Estoy hablando de los que todavía vienen acá y vienen a pelearse consigo mismo, ¿viste?
3010080	3011860	Entonces yo les sirvo de puchinbol.
3012120	3014360	No, Rebor es un hijo de puta, ¿cómo vas a pensar eso?
3014580	3015740	Yo no pienso así.
3016080	3019380	Yo sí soy bueno, porque yo si bien soy peronista,
3019520	3022040	no pienso como Rebor en que ver ni capaz.
3022340	3025100	Y hacen esas grandes alquimias.
3025280	3028260	Y yo los veo, los veo, siempre los ubico, los reconozco al toque.
3028440	3029980	Porque yo alguna vez estuve conflicto con mi ideología.
3030040	3032400	Yo estaba buscando mi ideología. Entonces reconozco esa etapa.
3032400	3036880	Cuando necesitas como referencias para pelearte, ¿viste? Para trincherarte.
3038720	3041400	Si te peleas mucho con todo esto, permíteme resolvértelo, hermano.
3042180	3043020	No sos peronista.
3044140	3045260	Sos gorila, está bien.
3045960	3048580	Estadísticamente, si naciste en la Argentina, es muy probable que seas uno u otro.
3049720	3052440	Pero a veces tenés muchas ganas de pertenecer a algo y vos espiritualmente no lo sos.
3052520	3054880	Y estás en conflicto, estás en conflicto.
3056060	3061300	Hay algo que le tenemos que reconocer al ministro de Ambiente, Juan Cabandier.
3061300	3062360	¿Cómo aguantó?
3062820	3065200	Su política de reciclaje.
3065420	3071800	Recicló a Mansur, recicló a Aníbal, recicló a Julián Domínguez y recicló a Filmus.
3072180	3073580	Hermano, ¿cómo aguantó Cabandier?
3074340	3080480	Cabandier, el viernes a la tarde, era la condición de acuerdo de todo el resto.
3080600	3081940	O sea, tipo, pero Cabandier se va, ¿no?
3082540	3085040	Y de callado, un genio.
3085320	3087600	Aguantó todas, ¿eh? Muy bien, muy bien.
3088220	3091380	Buenas tardes, Rebor. Buenas tardes, compañeros.
3091940	3093140	Acá Fran de La Plata.
3093660	3096920	Para mí el desafío de la política es representar a todos.
3097820	3101660	Incluso si son gordos, tucumanos, españoles, celestes.
3101720	3106480	Para mí, estoy muy muy contento con todos.
3108340	3113060	Incluso con que Jimmy, no Jimmy el Santo, que también lo van a cocinar,
3113060	3121380	Jimmy Persico, como corno ese apellido, sea el nuevo ministro de Educación.
3121700	3125080	Al fin, los profes de Educación Física pasamos al ataque.
3126160	3130320	Agárrense, infieles, agárrense. Se viene la dictadura de la Yoguineta.
3130440	3135020	¿Vos sabés cuándo arrancó la revolución de los profes de Educación Física con Scaloni?
3135660	3139000	¿Te saben qué? Simbólicamente esa batalla arrancó a ganarse ahí.
3139000	3144260	Scaloni con su Yoguineta marcó el Zenit, la nueva era de profes de Educación Física.
3144480	3147260	Me interesaba acá uno en el Twitch que dijo algo muy interesante.
3147860	3150680	Se me fue el usuario. Te pido perdón porque no llegué a leer tu usuario.
3150840	3152500	Pero uno decía, anoten esto.
3153100	3156160	Haldó no cagó a Manzur quedándose con la gobernación.
3156340	3158140	Manzur lo cagó a Haldó.
3158380	3160780	Tiró una verdad. Dijo que era tucumano.
3161420	3166460	Así que vamos a tomar esa corresponsalía de un agobero tucumano que nos dice
3166460	3169900	Atención. Atención. Es Manzur quien cagó a Haldó.
3169960	3171460	Vamos a ver. Vamos a ver cómo sale.
3171800	3174720	Yo les digo. Obviamente difícil, eh. Obviamente difícil.
3175100	3177300	¿Vamos a ganar? Probablemente no.
3177660	3181640	Pero la apuesta es esa. Créanme que la apuesta es devolver alguna trompada.
3181960	3183680	Así de baja está la vara, hermano.
3183880	3187060	Y este gabinete sin dudas muerde más que el anterior, eh.
3187620	3189780	Sin dudas muerde más que el anterior.
3191100	3191540	¿Pasan?
3192360	3194420	Ay, qué haces de reborro.
3194540	3198600	Yo también, loco. Sentí alivio. Un alivio total, boludo.
3198820	3202220	Hubo un cambio. Volvió a Aníbal. Volvió a Aníbal, boludo.
3202420	3206200	Qué lindo. Qué lindo que haya alguien que te responda.
3206220	3208100	Que se lleve a la marca. Que haga todo eso.
3208880	3209820	Qué lindo. Qué lindo.
3210880	3213960	Qué lindo programa que estás haciendo, boludo. Qué lindo todo, eh.
3214660	3216700	Venía re bien. Estaba pensando.
3217000	3220140	Uy, este programa se lo voy a pasar a tal compañera, a tal compañera.
3220140	3222420	Hasta que pensaste con las violaciones, la concha.
3222640	3224500	No, no lo puedo recomendar.
3226400	3227280	Compatriota. Compatriota.
3227520	3230180	Primero, muchas gracias. Y segundo, ¿qué es ese temor?
3230680	3232200	Es maga. No te vemos, eh.
3232780	3235420	Acá no venimos a temer. Acá no venimos a temer.
3235500	3237540	Acá no nos da cagazo nada. Ya pasamos.
3238020	3240440	Esto es post cancelación. Pasale lo que sea.
3240600	3243140	Pasale lo que sea y que reaccionen como tengan que reaccionar.
3244080	3245380	Seamos la zarz ardiente.
3246100	3248900	Algunos serán creyentes y otros serán nuestros enemigos.
3248900	3251840	Quizás vos se lo pasás a un amigo y le le pasás.
3252200	3255260	Y el chabón dice, o la mina dice, che, esto es horrible.
3255700	3257300	Esto es una monstruosidad, esto es una aberración.
3257400	3260120	Yo soy enemiga de esto. Bueno, perfecto. Perfecto.
3260200	3261340	Eso es lo que necesitamos en este momento.
3261700	3266580	En este momento necesitamos solo máxima decisión y ejecución.
3266660	3267920	Que es todo lo que no hubo antes.
3268300	3273920	Antes hubo gateo, atientas, todo mucho miedo de ofender a nadie.
3274320	3276180	No le podés, no podés ofender a nadie.
3276180	3278260	Porque no puede decir ah, porque se ofende tal, no puede.
3278580	3281900	En este momento necesitamos máxima ofendibilidad.
3282520	3283880	Eso necesitamos, ¿entendés?
3284280	3286320	O sea, no vamos a pedir ni perdón ni permiso.
3286560	3289040	Vamos a ser, vamos a ser.
3289480	3291160	Esa es la marca de este nuevo tiempo.
3291420	3293260	Por ejemplo, mira, con esta cierro.
3293440	3295160	Me preguntaban unos agoveros.
3295420	3297420	Che, ¿lo que hizo? ¿Qué fue el de educación?
3298080	3300640	¿Fue el de educación? El que corrió la Biblia.
3300940	3302020	Me decían, ¿qué onda esto?
3302140	3304100	Rebón, esto tuvo de distintos palos ideológicos.
3304100	3305100	Me decían, ¿qué onda esto?
3305200	3306840	¿Tuvo mística? ¿No tuvo mística?
3307380	3309460	Permítanme decirles, porque nosotros siempre separamos la mística
3309460	3310740	de las preferencias personales de uno.
3311360	3313820	A mí, estéticamente, recuerden que les dije,
3313940	3316680	el 64% de las diferencias políticas son solo estéticas.
3317020	3319880	A mí, estéticamente me dio paja el gesto.
3320020	3322080	Por mis propias alquimias espirituales.
3322340	3324720	No me chupo nuevo justificárselas, ni se las voy a explicar.
3325160	3327540	Solo les digo que a mí espiritualmente me dio paja.
3327820	3329400	¿Sí? Espiritualmente.
3329900	3332260	Ahora, ahora, me corro.
3332260	3336260	En términos de análisis de mística, sí tuvo mística.
3337180	3339340	La tuvo. Es así, es así.
3339640	3343840	Porque tuvo una decisión consciente y exagerada en una dirección.
3344280	3347840	Y lo que necesitamos hoy, lo que necesitamos hoy en la Argentina
3347840	3351260	es máxima decisión, verticalizada.
3352380	3353820	¿Sí? ¿Se entiende?
3354340	3357680	Si el compañero de educación sale mañana y quema una Biblia así,
3358100	3360780	¿entendés? Si dice, ya fue el cristianismo,
3360780	3364880	que viene el nuevo ateísmo de educación, lo que sé carajo, necesitamos eso.
3365340	3368280	¿Saben qué es lo más importante? Que no pida disculpas.
3368680	3370600	En este momento, no digo que nunca hay que pedir disculpas.
3370720	3373080	Yo repido disculpas. Yo me mando una cagada, le pido disculpas a todo el mundo.
3373400	3375380	Porque a veces les quiero aclarar esto. ¿Por qué ser como un personaje?
3375880	3377260	Rebor, profundizar, no pida disculpas.
3377360	3380040	Yo si me mando una cagada, voy con la gente que quiero con que se le oche flashe.
3380340	3381500	Perdón. Siempre lo hago.
3382180	3384980	Esto es política. Esto es análisis metafísico de la Argentina.
3385300	3388200	Lo que necesita el gobierno hoy es no pedir disculpas por dos años.
3388200	3390160	Te juro, de verdad, necesita eso.
3390520	3394420	Necesita ofender gente y no decir nada.
3394740	3397420	Es decir, yo lo que rezo, quieren ver si algo cambió o no.
3397660	3399500	Vamos a medirse algo. Vamos a hacer un experimento.
3399520	3400440	Un experimento gobero.
3401040	3402300	Vamos a ver si algo cambió o no.
3402900	3406000	Si el compañero este pide disculpas, pésima señal.
3406200	3411200	Si dice, uh, che, a quienes se sintieron ofendidos, que esto que el otro, pésima señal.
3412300	3416420	Si agarra y dice, como dice Racingera acá, metete la Biblia en el orto.
3417400	3418460	Necesitamos eso, ¿entendés?
3419040	3422900	Y después ojalá salga Mansur y que me hacía un pañuelo verde, ¿entendés?
3422900	3424820	Tipo, che, esto se acabó en este gobierno.
3426580	3431120	A otra cosa, necesitamos un gobierno que haga en todas las direcciones posibles.
3431380	3434120	Pero hacer, no deshacer, ¿sí?
3434540	3436160	Así y solo así.
3436520	3437780	No te digo vamos a ganar en noviembre.
3437940	3440920	No se trata de ganar. Lamentablemente no se trata de ganar.
3441300	3443240	Se trata de meter un par de piñas.
3443640	3444420	Se trata de volver trompadas.
3444560	3449600	Y esto, en estos días, estamos hablando mucho del oficialismo, mucho del peronismo.
3450060	3451980	Pero esto es transversar a todas las ideologías, ¿eh?
3452260	3453560	Esto es transversar a todas las ideologías.
3454260	3455720	Y acá no se escuchan gorilas.
3455920	3459240	Acá vienen troscos, vienen gorilas, vienen libertarios, vienen de todos los palos.
3459360	3462660	¿Por qué vienen? Porque quieren hacer la rendida grande otra vez, hermano.
3463620	3466220	Compatriotas, agoveros. Se están juntando los agoveros, ¿eh?
3466760	3469240	Atención a los agoveros. En Twitter están llenando un forum.
3469320	3470780	Se van a juntar por todo el país.
3471100	3472820	Ahora hacen spaces de Twitter.
3472820	3473820	Yo no sé ni qué son.
3473960	3476100	Pero hacen spaces. Debaten.
3476540	3477540	Compran armas.
3478260	3479740	Piden armas ahí a Libia.
3480000	3482260	Hacen pedidos. Las meten por la triple frontera.
3482480	3484640	Tienen unos agoveros misioneros trayendo armas.
3485080	3486180	Está pasando eso, ¿eh?
3486560	3488320	Métanse, métanse, ¿eh?
3489480	3491920	Compatriotas, agoveros, gracias por estar acá.
3492180	3493220	Como todos los lunes.
3493360	3494360	Espero sus comentarios.
3494740	3496220	Espero verlos esta semana en redes.
3496580	3497800	Espero sus puteadas también.
3498100	3498920	Espero que combatan.
3498980	3500800	Son momentos donde el peronismo tiene que combatir, ¿eh?
3501260	3503740	Devolver las piñas y no retroceder, ¿eh?
3504220	3506480	Y los retornaziologías también. Están en una parecida.
3506900	3510060	¿Recuerden eso que les dije de los que se meten un lugar solo para cambiarlo estructuralmente?
3511480	3513260	Quizás no son de este lugar, hermano.
3513460	3514200	Y no pasa nada.
3515060	3515840	Nos vemos el lunes que viene.
