start	end	text
0	2060	de nación nacional
2820	5400	hay pan pan, hay vino, vino
6460	8880	sobre las cartas de la mesa
8880	10860	¿para qué cazó a esos pájaros?
11120	11340	¿para qué?
11440	15460	hay que tener una jaura, un abrido y ese
19000	21700	el problema es que la deuda es como la faropa
21700	23700	al principio es rica
23700	25020	pero después te mata
25020	26740	vos sabés que sí
26740	28000	vos sabés que sí
29200	30500	vos sabés que sí
30500	32100	si esta gopa es de leche
32100	33760	te la tomaste toda
33760	36000	te la tomaste toda chingüengüencha
36680	38480	no se ve ni hablar, brutos
38480	39900	vaya a estudiar
39900	44220	acaba de contar la medicina porque metiste un cuchillo y te fue a quedar traficado, loca
44220	46780	ah bueno, no hay nada más que molir
50260	51060	eh
55920	58780	¿Cómo andan compatriotas? ¿cómo andan?
59780	60680	¿Cómo están?
61340	62780	agoberos, agoberas
63360	64960	¿cómo están?
65220	66780	yo, como siempre
66780	69400	feliz, feliz de encontrarlos acá
69400	70780	feliz de encontrar este equipazo
71360	72860	feliz de tener
72860	75520	maga, ¿no? el espacio donde nos encontrábamos
75520	79320	reflexionábamos, ponderamos los hechos de máxima fineza metafísica que se
79320	83400	dan en nuestro territorio nacional y los analizamos juntos, ¿no? Les pido disculpas
83400	87480	por la vez pasada, no pude pasar muchos audios, por muchos audios quiero decir
87480	91240	ninguno, ¿no? No pasé ningún audio, pero había mucha, había mucha verdad que
91240	95900	derramar y hoy, hoy les advierto, hoy les advierto el programa que hoy viene
95900	102380	parecido, porque hay mucha verdad, mucha verdad que decir, demasiada, por momentos
102380	108540	me duele y este va a ser un programa, lo sienten, sienten eso, sienten el peligro
108540	112660	de este programa, hay un nivel de peligrosidad en este programa que es
112660	118300	inusitado, hay mucho peligro, máximo peligro, es más, le diría a las personas
118300	121520	que no están dispuestas a exponerse a semejante nivel de peligro que, que se
121520	126000	vayan, que se vayan, porque hoy es jodido, hoy tenemos un par de cosas complicadas
126000	129200	para decir, permítanme exponer rápidamente algunas cuestiones de
130180	134480	nosotros vamos a hablar ahora durante este, ya saben, primer maga bloque de
134480	137820	algunas erupciones espirituales que se dieron en la patria, hubo mucha
137820	141540	discusión durante el fin de semana, mucha discusión, mucha discusión, vamos a hablar
141540	144900	un poco de esas discusiones, porque ustedes saben, ustedes saben, quizás los
144900	149300	nuevos no, pero tenemos principios en maga, ¿no? Tenemos principios dogmáticos, uno
149300	152320	de los cuales, ¿cuál es? Ustedes ya lo saben, ¿cuál es? ¿Cuál es uno de nuestros
152320	156720	principios fundantes? No hay discusiones teóricas, solo hay diferencias
156720	160920	espirituales, ¿no? Ese es uno de nuestros principios fundantes, y durante el fin de
160920	165380	semana se dieron muchas discusiones de orden espiritual, muchas discusiones de
165380	170860	orden espiritual, vamos a estar elaborando un poco eso ahora, ya. Durante
170860	174200	el segundo bloque vamos a hacer un análisis metafísico de la composición
174200	178600	del nuevo gabinete, no un análisis político, no los curros de todo, ya, ya
178600	182060	para los curros lea la nota de alguien, viste, tipo, no, lo que pasa con este
182060	188680	gabinete, no, no, no, eso ya, eso ya existe, acá hacemos análisis metafísicos y
188680	192140	análisis del orden de lo espiritual, de lo que está pasando con el nuevo gabinete,
192200	196220	eso es el segundo bloque, y en el tercero podemos hacer un foro más abierto, una
196220	200280	cosa a mover como llegamos también, porque insisto, hay mucha carga, hay mucha
200280	205420	carga para lo que hay que hablar, ¿eh? Arrancando por lo primero, las diferencias
205420	210620	de orden espiritual, ustedes saben, ¿no? Que se anunciaron los cambios de gabinete,
210620	213380	si no me equivoco fue el viernes a la noche, vieron, el tiempo es confuso en la
213380	217040	República Argentina, creo que fue el viernes a la noche, y ya ahí saltaban
217040	221580	todos a la puteada, viste, no, que esto lo otro, yo pienso que este yo, le voy a
221580	225320	decir de vuelta, eh, de vuelta, no me interesa hacer análisis, quieren venir acá a
225320	229740	buscar la posta, acá no está la posta, acá no, no, no, la posta está en otro lado, se
229740	234520	fue, la posta está ganando en dólares, cobrando en dólares, y laburando así para
234520	239460	una consultora yanqui desde billiortuzar, ahí está la posta, acá estamos los que
239900	244420	estamos en el fondo del pozo, ¿sí? Está por supuesto Carly, está ahí, no la ven,
244560	248320	Carly, Carly está, no solo pelada, tiene barba, tiene tres hijos y está afiliada
248320	253300	a UPSN, ahí está Carly, bancando los trapos, está como siempre Jorge Piba,
254180	258160	Jorge Piba tiene mucha plata, pero viene acá este programa, tenemos compañeros
258160	261600	libertarios que se han incorporado, tenemos compañeros troscos, como siempre,
261920	264740	tenemos gente de derecha, de izquierda, en este programa es transversal a las
264740	268340	ideologías, transversal, incluso cuando analizamos los hechos más salientes,
268340	272300	viste, porque podemos analizar a cualquier partido, a cualquier movimiento, e incluso
272300	277500	en esa transversalidad de ideologías hay mucha sintonía espiritual a encontrar,
277580	281180	porque cuál es el único pre-requisito que te pide Maga, querer una Argentina
281180	285300	grande, otra cosa, otros nuestros principios dogmáticos, vos podés tener
285300	288140	cien mil diferencias con una persona, pero si le decís, ¿cómo crees que es la
288140	293780	Argentina? Grande, perfecto, venía Maga, vamos a hablar, vamos a hablar, ¿yo qué
293780	298820	sentí al respecto del gabinete? Sensaciones, intuiciones espirituales,
299900	303620	alivio fue lo primero que sentí, si tengo que decirlo en una palabra, alivio
303620	310580	común, ah, eso sentí con el gabinete, ¿sabes por qué? Porque se hizo algo,
311340	317640	algo, ya vamos a hablar del gabinete, pero antes del gabinete quiero hablar de cómo
317640	323500	sintieron otras personas, porque en ese sentir está todo, en una gota de
324180	329180	emoción caben todas las ideologías del mundo, ¿escuchaste eso? ¿Escuchaste el
329180	333000	nivel de belleza de lo que acabo de decir, aleatoriamente? Es como la frase de
333000	336660	Martí, de que en un grano de maíz cabe toda la gloria del planeta tierra, bueno,
336720	341360	en una gota de emoción caben todas las ideologías del mundo, no hay
341360	345560	diferencias teóricas, entonces los que sintieron otra cosa con el anuncio del
345560	352280	gabinete, están expresando algo que les pasa, y lo quiero analizar también, lo
353160	359280	el famoso, el no es por ahí abuelas, no, llamémoslo el no es por ahí abuelismo,
359620	364180	sí, el no es por ahí abuelismo se expresó mucho durante el fin de semana,
364820	367900	¿por qué? ¿qué es lo que pasa? ¿qué es lo que pasa? Voy a decir algo que es muy
367900	372580	polémico, ¿eh? Vieron que el peronismo siempre gusta de joder con el hecho de
372580	378020	que todos somos peronistas, hasta que se demuestra lo contrario, ¿no? La famosa, la
378020	381420	famosa, no, pasa que vos sos peronista pero todavía no te diste cuenta, ¿no?
382040	385040	Eso lo decimos todo el tiempo y nos encanta, ¿por qué? Porque somos un
385040	388820	movimiento creciente, somos como el islam, nosotros llamamos a tener más y más
388820	392820	hijos y a crecer y a tener cada vez menos pre-requisitos ideológicos para
392820	396820	entrar, no tenés que llenar un formulario para ser peronista, basta con
396820	401180	auto-percibirte tal, ¿no? Eso es la puerta de entrada, el problema no es entrar,
402060	406460	el problema es que haces adentro, porque permítanme decir algo polémico, voy a
406460	413780	decir algo polémico, a mí no me gusta sacar el peronómetro, no me gusta, es
413780	418740	más, no creo en el peronómetro, no creo en el ah, vos no sos peronista, esa cosa
418740	422800	andar denunciando quién es peronista y quién no, ¿por qué? Porque en general el
422800	427000	peronómetro se usa por categorías o morales, que a mí no me gusta la moralidad
427000	431180	metida en la política, hace cosas raras las categorías, las tuerce todas, no me
431180	434300	gusta y la otra cosa es que el peronómetro muchas veces se usa por
435200	439980	sangre azul, ¿por de dónde venís vos? ¿Viste? Y te quiere correr el tataranieto del
439980	445060	tataranieto, ¿viste? Del uber a decir, no, ustedes no son, no, bueno, yo no creo en eso, yo
445060	447780	creo que el peronismo es un movimiento así histórico porque tiene puertas muy
447780	451880	grandes, ¿entendés? Y quien sea, de donde sea, si se auto-percibe, peronista puede
451880	455500	serlo, es como ingresar a la República Argentina, para cualquier ciudadano del
455500	459340	mundo que quiera ser argentino y agrandar su patria, vos sos argentino, el
459340	462940	peronismo es igual, entonces por eso a mí no me gusta, ¿viste? Grandes referentes
462940	467240	para mí re contra peronistas venían de cualquier otro lado, el turcoasís, a mí me
467240	470960	encanta escuchar turcoasís, me encanta, y el turcoasís arrancó a militar en el
470960	477040	PC y así como ese ejemplo hay 4.000, viste, hay cientos de miles, entonces yo hice
477040	479920	todo este preludio por supuesto porque ahora en cierto sentido voy a usar el
479920	484760	peronómetro, por eso me estoy excusando tanto, pero permito hacer
484760	490220	una diferencia porque de vuelta el problema es de sentir, el problema es de
490220	496420	sentimientos, es de feelings, es de spirits, el problema no es de teoría, yo no creo
496420	500260	que algunos no sean peronistas porque no leyeron suficiente las 20 verdades,
500480	505280	viste, porque no, vos no interpretaste bien comunidad organizada, pero permítanme
505280	511680	decirles que hay gente que no siente peronista,
513500	518780	permítanme decirles a contramano de esta frase tan popular de vos sos
518780	526960	pero todavía no te diste cuenta, hay gente que cree que es peronista y todavía no se
526960	533580	dio cuenta que es gorila, se entiende cómo estoy usando esto, no se trata de
533580	538660	dónde venís, no se trata de dónde vas tampoco, yo soy peronista, quiero
539220	547000	instaurar el libre mercado en todo el cono sur, pero sentís peronista, sentís
547000	551160	ahora, yo lo que quiero hablar ahora y voy a hablar de todas las ideologías, lo que
551160	554580	les voy a decir ahora, o sea, el nivel de verdad es lo que les voy a decir ahora,
554660	558200	espero que lo puedan asimilar, porque esto es para todos, para libertarios, para
558200	559900	macristas, para todos, para todos,
561960	570380	si tu única condición de pertenencia a un lugar es generar herramientas para
570380	579360	modificar ese lugar, vos no sos hincha de ese lugar, sos un infiltrado, se entiende
579360	586460	lo que acabo de decir, va de vuelta, va de vuelta, si lo único que te ata a un
586460	590980	lugar, si lo único que te ata a un lugar es querer cambiarlo,
591840	596940	y no estoy hablando de mejorarlo, dar debates, crítica adentro, bardo, piñas,
598220	603600	estoy diciendo, hola che, vos de que cuadro sos, no, soy de River, ah, por que sos de
603600	608160	River, no, porque Bianchi es el número uno, viste como juega Román, a mi me gustaría
608160	614780	que River, viste, juegue con enganche y juegue en todos a ganar el minuto 90, para vos no
615620	622280	sos gallina, vos sos de Boca, no, vos me vas a decir eso, yo soy del millonario,
623360	630620	esto pasa en todos los partidos, eh, vamos a hacer un ejemplo para otros, vos sos un
630620	635480	militante del Pro, me meto en discusiones libertarias, me meto en discusiones libertarias,
635600	641480	los que dicen, no, vamos con la lista interna de López Murfi, no se que poronga, si, los que
641480	646620	están en esa lista interna, por que estas ahí, discuten con sus compañeros libertarios, no,
646620	652020	porque yo creo que al Pro hay que cambiarlo desde adentro y dar la batalla, y dar la
652020	660820	disputa, para, y así el Pro va a hacer todo lo que yo, por que estas ahí, o sea, no cabe la
660820	667640	pequeña posibilidad de que esa no sea tu ideología, de que ese no sea tu sentir más que ideología,
668140	671860	y saben por que lo digo, por que hay una sobreinterpretación muy tardía al respecto
671860	677300	de la teoría revolucionaria de John William Cook, no, y yo respeto muchísimo a John William Cook,
677360	681220	es alguien que por la resistencia peronista se agarró a tiros en Plaza de Mayo, el delegado de
681220	686240	Perón en la Argentina, eh, palabras mayores John William Cook, pero hay una interpretación de una
686240	691140	de sus palabras, que es esto de, si nosotros le generamos los suficientes hechos revolucionarios
691140	696360	a Perón, vamos a condicionar a Perón para, si, para hacer al peronismo de izquierda, para hacer
696360	703320	al peronismo lo que reporonga sea, que eso, esa frase, de esa frase, se han construido catedrales
703320	709680	de mierda, entende, es catedrales de pelotudez, por que esa frase te la cita gente que no es
709680	715920	peronista, y está convencida de que muerto Perón tienen que infiltrarse en el movimiento para
715920	721020	condicionarlo, ya no pueden condicionar a Perón, entonces tienen que condicionar a todo el conjunto
721020	727640	del movimiento, se entiende lo que estoy diciendo, vamos a especificar aún más, quieren detectar
727640	737900	infiltrados, esto, es, es un, es medio turbio, no, es como un maga del 75 esto, no, es como un maga desde, desde
737900	745780	bienestar social, no, maga edición 75, quieren detectar un infiltrado, y esto no es en el peronismo,
745920	751840	es en cualquier lado, eh, en cualquier lado, vos sos radical, es fácil, es fácil, vos sos radical,
751980	757080	por que sos radical, por que me gusta Nicéforo Alem, que se rompa pero no se doble, quiero tener
757080	761520	la barba super larga, revolución del parque, que se yo, bueno, boludo, sos radical, por que sos radical,
761640	767300	por que van a morir a, a Jacobiti, es un capo, Jacobiti, bueno, sos radical, vos por que sos radical,
767300	773800	por que quiero que una de estas estructuras partidarias centenarias logre ser parte del motor de cambio,
774060	782060	como, como, ah, ah, ahí para la oreja, ahí para la oreja, como, si, vos sos radical para, o sea,
782980	789100	cual es uno de los factores de detección de un infiltrado, uno de los factores de detección es
789100	794760	cuando la explicación del por que uno está en el lugar en el que está, es tanto más compleja que
794760	800820	simplemente sentido de pertenencia, hay algo raro, boludo, cuando vos permanentemente tenés que estar
800820	807700	explicando teóricamente, teóricamente, la cantidad de filaciones y cruces tácticos que tenés que hacer
807700	813740	para sostenerte adentro de acá y por eso, viste, hermano, vos por que sos peronista, por que me gusta Perón,
813880	818220	vos por que sos peronista, por que soy argentino, bueno, vos por que sos peronista, porque creo que el
818220	823360	peronismo a partir de su, a pesar de su carácter bonapartista y de alianzas de clases, sigue siendo
823360	828000	el motor más popular en los vehículos de demandas y conquistas de derechos de la República Argentina,
828680	831960	por eso yo creo que a pesar de sus contradicciones intrínseca...
832680	841440	Pará, pará, pará, pará, pará, ponos a Peronita, no lo sos, entendés, no lo sos y está todo bien,
842000	846640	se puede entender esta parte porque acá parece que nos estamos acusando, viste, uno con otro,
846720	852520	no, no, boludo, está todo bien, no hace falta que todos seamos peronistas, acá en Maga hay gente de
852520	858120	las ideologías, pero hay gente, vamos a llamarlo a seguir, no son infiltrados, ni siquiera son
858120	861720	confundidos, la confusión es buena, protege tu confusión y tu confusión te protegerá,
862100	866320	pero son conflictuados, hay gente que está conflictuada con su identidad,
866640	871100	hay gente que necesita salir del closet de su propia ideología y una vez que vos,
871580	875660	como cualquier persona, yo no entré directamente al peronismo, yo tuve que pasar por largos
875660	882120	penares, penares, pesares, no importa, inventame una palabra, pesares, hasta que comprendí que
882120	887880	era peronista, yo creo que siempre lo fui, pero cuando me liberé fue tan hermoso, yo sentía el
887880	894300	llamado, a mí me interpelaban esas cosas, yo veía, a mí me gusta eso, cuando me liberé es hermoso,
896320	902940	hermano, hermano, si vos cortás boleta por Miriam Bregman, no sos peronista y está bien,
904180	911180	está bien, está bien que no lo seas, se entiende, nadie te va a jugar, nadie te va a jugar,
911580	916160	el tema es el conflicto, el tema es que todos estos años de anti macrismo nos juntaron para
916160	921680	bien con un montón de gente que no es peronista y está bien y siempre queremos que entren,
921940	924740	siempre queremos que entren, sabes cuál es el problema, el problema no es entrar,
924800	930960	el problema es romper la pelota, el problema es entrar y creer que porque entraste por la
930960	939640	puerta, de golpe vos decís, no, no es por ahí peronismo, ¿qué? ¿qué? ¿quién chota sos? ¿quién carajo sos?
940220	944460	cuando vos hablás con estas personas que quieren condicionar los grandes movimientos hacia sus
944460	950560	ideologías verdaderas, viste, estos grandes tácticos, son todos Churchill, boludo, son Churchill,
950760	956160	Churchill con fotocopiadoras, son Churchill con tres amigos, son Churchill con una página de
956160	962240	Instagram diseñando tácticamente cómo a través de su alianza van a lograr, viste, ¿qué sé yo? ¿qué
962240	967340	estás haciendo, boludo? estás acá porque botaste esto, ¿no? rompa la pelota y vos le preguntás,
967500	971600	preguntale a esas personas, para, para, para, ¿cómo es tu gabinete ideal? ¿cómo es tu gabinete ideal?
972000	979780	no, bueno, estaría compañero Juan Gravois, la compañera Miriam Bregman, ¿eh? pero eso no, o sea,
979920	985080	ah, boludo, hubieras empezado por ahí, no estamos de acuerdo, porque perdemos mucho tiempo poniéndonos
985080	988300	de acuerdo al pedo, con cosas que simplemente no estamos de acuerdo, es tipo, ah, vos querés otra
988300	994800	cosa, claro, ahí entendí, vos querés otra cosa, y permítame poner un ejemplo, esto no es para jugar,
995020	998880	acá yo le dije, acá está Jorge Piba, Jorge Piba tiene mucha plata, boludo, mucha plata,
999000	1003980	yo nada es así si no saben la plata que tengo, acá, acá viene nuestro amigo Fede Quintana,
1004660	1010160	el trosco Fede Quintana, Fede Quintana es súper trosco, ahora, vos te pensás que si yo, imagínate
1010160	1014300	yo el día de mañana maga es gobierno, imagínate que somos gobierno, vos te pensás que le doy un
1014300	1021140	ministerio a Fede Quintana, que le digo, che, boludo, vos sos re trosco, pero es más, te digo más, te digo
1021140	1026960	más, si yo por un instante flaquease y diría algo como, uh, bueno, che, Fede Quintana, la verdad,
1027080	1032060	sos re agovero, para, no querés tener un ministerio, Fede Quintana, como buen agovero, no conflictuado
1032060	1038820	que es, me agarré así la mano, suavemente, con lágrimas en los ojos, me diría, Rebord, no, boludo,
1039240	1045340	no, yo no soy parte de este gobierno, yo soy trosco, boludo, filosóficamente soy trosco, saben que es
1045340	1051680	un trosco, saben que es un trosco, no, es mentira, los troscos no son porque aplican la teoría de
1052160	1056420	Trotsky, yo leí, eh, yo leí, Historia de la Revolución Rusa de Trotsky, yo leí cuestiones del
1056420	1061940	elinismo de Stalin, las diferencias son espirituales, son espirituales, un trosco es alguien que
1061940	1067420	prefiere tener razón a ganar, nada más, eso es un trosco, alguien que prefiere tener razón a
1067880	1073040	ganar, un peronista sabe que prefiere ganar a tener razón, entonces Fede Quintana me diría, Rebord, yo
1073040	1078540	espiritualmente no puedo ser parte de esto, no puedo, y yo le diría a Fede la verdad tener razón, y yo le
1078540	1082800	diría a Fede la verdad que lo que quiero es reprimirte, y él me diría, Rebord, es verdad, me voy a cortar
1082800	1090540	Panamericana, Fede se iría a cortar Panamericana, y yo iría y lo reprimiría, y después lo metería en
1090540	1095180	cana, ¿entendés?, y lo iría a visitar a la cárcel, porque lo banco, eh, lo banco, y en la cárcel le
1095320	1101660	diría, eh, Fede, ¿cómo estás?, mal, me diría, y yo le diría, ¿por qué?, y porque me están violando mucho, y yo le
1101660	1109860	diría, pero Fede, él me diría, mucho, mucho, mucho, Rebord, mucho, me están cogiendo mucho, y yo le diría, Fede, eso es hasta raro, de
1109860	1114720	hecho, me diría, me están como violando por encima de las estadísticas del sistema penitenciario, yo le
1114720	1118800	diría, es verdad, es raro, porque no sucede tanto, es más una estigmatización al respecto de lo que sucede,
1118900	1123160	Fede, y él me diría, sí, ya sé, y yo le diría, pero Fede, ¿cabas no estás haciendo algo vos para?, y él me
1123300	1131280	diría, Rebord, no te metas ahí, porque es raro, y yo le diría, no pasa nada, Fede, vamos a una tanda, y volvemos,
1131540	1140320	vamos a una tanda y volvemos, estamos en Twitter, Nacional Rock, noventa y tres siete, mujeres fuertes en la vuelta,
1141320	1149440	delirantes, también, ¿qué cosa sobre vos?, te diste cuenta de grande, y lo demás ya sabían, oye, Dios, bárbara, por favor,
1149440	1150840	que se atenciona, a ver qué dicen,
1151760	1159140	In Dubai, dos horas de alto contenido psicotrópico, Rosario dice, que el tema nunca me falte de Antonio Ríos,
1159380	1162380	dice, amor por favor, y yo siempre dije, agua por favor,
1162580	1176140	y subí, porque, amor por favor, ah, derribando, Rosario, nunca me falte, el nunca me falte, me parece que ahí te contextualiza que está hablando del amor y no del agua,
1176140	1181860	de dieciocho a veinte, con Tanya Belltoff, Charo López, y Barbi Recanati,
1182140	1187720	y Cupay, por noventa y tres siete, Nacional Rock,
1187820	1189780	Hacia tuya,
1191060	1191860	desafiadas,
1193320	1193500	escuchadas,
1195420	1196960	nunca nos conformamos,
1198300	1199420	noventa y tres siete,
1200160	1201340	Nacional Rock,
1202240	1204260	Terminal día, lejos de casa,
1204260	1206480	estamos en la luna,
1206480	1210340	un viaje por la música y la imaginación,
1211300	1212260	estamos en la luna,
1212800	1215480	de lunes a jueves, de veintiuna a cero,
1215700	1216820	con Frank Gilando,
1217160	1219140	Griselda Angelo, y Agustín Camisa,
1219560	1220740	estamos en la luna,
1220980	1222260	por noventa y tres siete,
1222660	1224660	Nacional Rock,
1224960	1226660	Hacia tuya,
1228100	1230500	lunes, de veinte a veintiuna,
1231020	1231540	MAGA,
1234260	1234260	
1241840	1242480	COMPANIEROS.
1243080	1243720	COMPANIEROS.
1243960	1245860	Hicimos recién un breve paneo espiritual
1245860	1248420	al respecto de las fuerzas en pugna.
1248620	1250820	Sí. Y acabo de dar una premisa
1250820	1253000	transversal a todos los espacios
1253000	1254640	e ideologías. Esto no es propio
1254640	1256820	del peronismo. Cualquier persona
1256820	1258740	cuya única condición de pertenencia
1258740	1260140	simbólica a un espacio es querer
1260140	1261420	cambiarlo por completo,
1262580	1268360	quizás no quiere pertenecer a ese espacio. Quizás estás forzando algo que
1268360	1273100	simplemente no está en vos. Y la sugerencia de este maga es que no entres
1273100	1278360	en conflicto, abandones esa pose tan castigada para con vos mismo o misma y
1278360	1283280	te entregues a tu verdadero sentir. Quizás sos radical, quizás sos radical,
1284160	1290880	quizás sos trosquista. Hay 400 partidos trosquistas para meterte, o sea, no pasa
1290880	1296040	nada, ¿se entiende? Es lo contrario a jugar, lo contrario a jugar, es aceptar.
1296280	1299800	Maga es aceptación profunda. Ustedes saben que acá nosotros creemos en la
1300280	1305680	genuidad, es decir, la preeminencia de lo genuino, ¿sí? Recién acá leía en Twitch
1305680	1308780	uno que decía, Fede, no te preocupes que si caes en cana, Reborn no te va a visitar.
1309020	1313180	Fede, yo te voy a visitar. Y cuando te estén recogiendo en la cárcel, yo voy a
1313180	1316820	decir, amigo, contá conmigo. O sea, no tanto porque no voy a hacer nada para
1316820	1319760	sacarte de ahí. Va a ser nuestro gobierno y está bien que vos estés preso. Porque,
1319760	1324460	o sea, te lo buscaste, boludo, y vos lo sabés. Vos lo sabés. Eso es lo hermoso. Él lo
1324460	1328820	sabe. Yo lo sé. Vamos a posar nuestras manos así sobre el vidrio, como en las
1328820	1334780	películas, y Fede va a tocar y va a decir, eh, va a decir, gracias, loco, gracias. ¿Sabes por qué va a decir gracias, Fede?
1336960	1343800	Fede va a decir gracias porque lo que más quiere un trosco es un peronismo pleno.
1345240	1349580	Lo que necesita el trosquista para verdaderamente, el trosquista está muy
1349580	1354220	confundido cuando está la derecha encarnizada, viste, porque se le pegan
1354220	1357720	los votos con nosotros. Es molesto para todos, molesto para todo. Tipo, es un
1357720	1362880	garrón para todos. Estamos todos pegoteados, viste, tipo, son, coincidimos en marchas.
