start	end	text
2412580	2415760	necesitas parir algo nuevo, algo nuevo y confuso,
2416080	2420780	más cuando, tenemos que decirlo también porque vimos venir el cambio metafísico de la gestión
2420780	2423280	cuando llegó el califa, ¿no?
2423740	2427360	Y ahora hay preocupación, ¿cómo están viendo eso ustedes?
2427360	2430020	Ahora hay preocupación con el cambio metafísico,
2430300	2433920	hay una paridad un poco entre los golpes que se como el frente de todos y boca,
2435700	2438640	no sé si lo vieron, pero las búsquedas son similares,
2438760	2443100	o sea, podemos hacer un paralelismo, hay algo de la recuperación romana y bostera del club,
2443460	2447520	como la recuperación del estado por el peronismo, o sea, se recupera algo,
2448780	2451780	se recupera para mí la gestión en términos ejecutivos y verticales de romanes
2451780	2454400	mucho más eficaz que la del frente de todos por lejos,
2454400	2460460	pero lo que digo es la cuestión del espíritu por parir, la identidad por nacer es muy similar
2460460	2464440	y vos fijate que coincidieron, esto en serio, parece que estoy loco, no me miren así,
2464660	2470840	parece que, o sea, ¿vieron cuando arrancó el batimóvil que tipo agarraron,
2471000	2474340	entraron a repartir, cayó el santo consejo del fútbol, cagó a piñas a tres,
2474420	2478200	se echaron colombianos, vino a batalle, dijo ahora vamos a ordenar,
2478580	2481640	coincidió con el arribo del califa Manzur,
2482580	2491420	¿sí? Fue el mismo proceso espiritual pero está en pugna, se traba, choca, dialoga, pierde, ¿no?
2491780	2496540	¿Qué le pasó al gobierno? Entró el califa Manzur, entró Insaurralde, el interventor,
2497420	2502680	Kicillof quiso revelarse, no, no pudo, no pudo, ¿viste?
2502720	2507260	Ahora lo tiene Insaurralde recorriéndole ahí la casa de gobierno
2507260	2510840	y son rápidos los que entraron aparte, ¿eh?
2510840	2517720	Son rápidos los que entraron, Manzur puede usar un Sony Ericsson pero es velocidad 5G, ¿eh?
2518380	2522300	Es tipo olfatean los recovecos del Estado Nacional y Insaurralde es exactamente igual,
2522380	2525120	entonces no es inocente la movida, es una disputa espiritual.
2525520	2529940	Yo lo que veo son signos preocupantes, signo preocupante uno el 17 de octubre,
2530120	2534780	hay que decirlo, el 17 de octubre cívico y extraño, ese gran camping de poetas
2534780	2536840	al que convocó nuestro presidente, ¿no?
2538000	2541360	Fue un tema, fue un tema, ¿cómo hay tanta duda con esto?
2541580	2542500	¿Cómo hay tanta duda con esto?
2543000	2546740	Y ahora están pasando otros descalabros que no se terminan todavía de entender qué son.
2547880	2549100	Lo de Bernie es una señal de eso.
2549620	2553560	Lo de Bernie es una señal que esto parece joda, pero de verdad se vienen dos años muy difíciles, ¿eh?
2554040	2561780	O sea, tuvimos un pequeño periodo de Pax Romana que es la gestación del frente de todos,
2561860	2564160	ahora ya me incluyo porque no puedo hablar desde otro lugar, no me sale,
2564680	2568180	pero sí es un pequeño periodo de frustración y Pax Romana
2568180	2573260	porque es casi tan impotente como convivencial, ¿viste?
2573800	2575520	Es tipo, yo nunca vi una cosa así mi vida,
2575600	2578960	nos estamos puteando entre todos y estamos todos ahí en el búnker, ¿viste?
2580520	2583580	Lo cual es increíble, es un nivel de civismo que no sé a quién le sirve, ¿entendés?
2583620	2588400	Porque creo que se enalteció el valor de lo cívico por encima de cualquier otra utilidad,
2588580	2589680	pues no sé si sirve tanto.
2589780	2591540	Bueno, ahora están viendo otros movimientos en contrario.
2592080	2594440	Máximo y Bernie se agarraron a trompadas.
2599660	2601300	Un bien aislado, ¿viste?
2603180	2605580	Pasa eso en todas las cosas que estoy haciendo, precisamente,
2605760	2609700	siempre hay alguien muy inconexo que tira como, o sea,
2609920	2612540	el otro día en la de doble mérito también, no sé qué dijimos de Israel
2612540	2614420	y uno dijo, ¡vamos, judíos!
2616340	2619220	Y fue como buenísimo, digamos.
2619220	2621600	O sea, eso es yo quiero ser de esa religión, ¿viste?
2621600	2625740	De los que sientan así, de los que griten, ¡vamos, judíos!
2625740	2627560	en algún lugar me parece espectacular.
2627880	2629620	Pero siempre hay algo de eso, siempre hay algo de eso.
2630140	2632080	Bernie y Máximo se agarraron a trompadas.
2635460	2637620	Yo tengo máxima información de lo que pasó.
2639440	2641060	Debo decirles, ¿quieren saber?
2641980	2643840	Acá un compatriota me dice, ¿quién ganó?
2644260	2644920	¿Quién ganó?
2645080	2646700	Una conflagración ahí.
2647220	2648660	Hubo frases dichas.
2648660	2651120	Se dijeron una cosa, se dijeron otra.
2651460	2654860	Había reclamos al respecto de la responsabilidad político-electoral.
2655500	2657900	Y Máximo dijo, es importante sepan,
2658040	2659940	toda esta conversación fue hablada en español neutro.
2660120	2661080	Ustedes saben eso, ¿no?
2662260	2666560	O sea, cuando arrancan estas escenas, todos tienen un doblaje, ¿viste?
2667620	2670520	Máximo le dice, a mí esa pose de milico no me va, maldición.
2671860	2674000	No lo intentes conmigo, imbécil, ¿viste?
2674360	2676180	Y cuando la gente empieza a hablar en ese tono,
2676180	2679180	el resto de presentes ya sabe que va en esa dirección.
2679240	2679800	Como dice, ¡uh!
2681180	2682100	Una conflagración.
2682420	2684180	Dicen eso también, conflagración.
2685060	2688000	Tú eres el imbécil, maldición, dice Bernie, ¿viste? ¿Entendés?
2688380	2691760	Y se revolearon, dicen que Bernie lo increpó, lo agarró del cuello.
2692320	2696320	Máximo le dijo una frase espectacular que no puedo pronunciar porque no me la permitieron.
2696700	2700420	Lo debo decir, así que voy a decir las otras que sí me dijeron.
2701740	2703820	Sí, sí, sí, sí.
2703820	2707320	No, no, no, Máximo le dijo, no te temo, imbécil.
2707880	2709080	No te temo, idiota.
2709940	2712320	Y Bernie, por supuesto, dice, deberías, maldición, ¿viste?
2712940	2714120	Hablan muy similar, ¿vieron?
2715460	2718300	Porque adquiriste el mismo tono cuando entras en una conflagración.
2719220	2721540	Y se midieron un poco y se pelearon.
2721600	2724000	Y después de una serie de movimientos extraños ahora con la cuestión de Aníbal,
2724320	2725860	yo creo que todo lo que está pasando es positivo.
2726020	2728820	Yo creo que ya pasamos el umbral de asombro.
2729600	2731240	¿Vieron que hay otros lugares que...
2731740	2733120	Lo vi ahí de todo el costado.
2733300	2734640	Así, así, así.
2735320	2735320	
2737160	2738800	Ya pasamos el umbral de asombro.
2739620	2743240	¿Vieron lo mismo cuando fueron las semanas esas de...
2744360	2747260	Cuando fue el golpe de Guado, ¿no?
2748040	2752200	Cuando Guado de Pedro hizo un golpe de estado, cuando armado fue con otros cámporas
2752200	2754860	y le exijo al presidente, ¿qué pasó, Guado?
2755160	2756120	No, vete.
2756360	2757420	Et tu Guado.
2757580	2759160	Una escena así romana, ¿viste?
2759780	2763260	Bueno, cuando sucedió eso, que por supuesto no creo que haya sido así,
2764000	2766940	siento que ya se pasó el umbral del riesgo de bardo.
2768560	2768920	¿Sí?
2769920	2770760	Esa es velocidad.
2770900	2774080	Luis la que me acaba de meter es relámpago.
2774780	2776380	Relámpago para la transmisión, ¿eh?
2777820	2779840	Se pasó, se pasó el umbral de asombro.
2779960	2782440	Ya no importa si...
2784720	2785600	Discusiones escandinavas.
2786680	2789520	Esto no suma, compañeros.
2790000	2790880	¿Dónde estás?
2791920	2793920	Compañeros, esto resta, ¿viste?
2794720	2797040	Esto es Vietnam, boludo, ¿entendés?
2797060	2800600	O sea, vos te das vueltas y estás salvareza sosteniéndose las tripas,
2801460	2802740	todo sangrando, ¿entendés?
2802980	2806040	Tipo, corre por mí, por salvareza, ¿entendés?
2806320	2808600	O sea, estás salvareza muerta en un costado.
2809600	2813280	Culfas que vieron al método de decir, soy invencible, de una, Culfas.
2813280	2815720	O sea, yo lo vi igual que ustedes.
2815860	2817640	Ahí se me ve la cara cuando me dice yo.
2818140	2820280	Ya va así, me dice...
2820280	2821740	Soy el mejor ministro.
2822700	2825260	O sea, lo que está pasando,
2825480	2829420	estamos viviendo un momento donde todos al mismo tiempo están diciendo esa hora.
2829640	2829960	¿Sí?
2830360	2831480	Y eso hay que respetarlo.
2831760	2834840	Porque cuando está pasando algo grande y difuso,
2834940	2836100	que todavía no se sabe qué va a terminar,
2836160	2837400	ya fue, ¿entendés?
2837580	2838280	Ya fue.
2838680	2840320	Por lo menos hoy se está peleando, ¿viste?
2840620	2842400	A mí me preocupaba más lo otro.
2842400	2845640	Ese clima de cordialidad cósmica, ¿viste?
2845660	2846260	Con todo mal.
2846280	2847760	No sé, me resulta extraño.
2847900	2848900	Me resulta extraño.
2849480	2850520	Compatriota, tenemos más.
2850920	2851560	Queremos sangre.
2851700	2852040	Bien, Dani.
2852120	2853020	Ahí tenemos más manos.
2853520	2854840	El flanco izquierdo está muy...
2854840	2856080	Soy Jabo 3 de Ferrero.
2856220	2856840	¿Qué haces, Jabo?
2858980	2861960	Quería preguntarte sobre qué opinás del gringo Schiareti
2861960	2863680	y sus últimos dichos contra el gobierno en la anterior.
2864580	2864980	¿Qué?
2866260	2869460	Quería consultarte sobre qué opinás sobre el gringo Schiareti
2869460	2870620	y sus últimos dichos.
2874400	2876400	Espectaculares dichos de Schiareti.
2879180	2879820	Espectaculares.
2880180	2882420	Quiero ser lo más enfático posible.
2883660	2885740	A Córdoba no le fue bien en su elección.
2886640	2887500	¿Y cuál es...?
2887500	2888100	¿Cuál es...?
2888100	2889000	De vuelta, de vuelta.
2889480	2891740	Vamos a los alineamientos espirituales.
2891860	2892940	¿Qué prefieren ustedes?
2893000	2894480	¿Ustedes prefieren ganar o tener razón?
2898300	2898940	Bien.
2900660	2901100	Ok.
2901820	2903280	Prefieren ganar, ¿sí?
2903940	2904720	Los gritos...
2904720	2908580	Esto creo que no sale por Twitch, pero hay un nivel de locura que...
2908580	2909960	Prefieren ganar, prefieren ganar.
2910060	2913160	Bueno, si vos sos cordobés, ¿no?
2913160	2915100	Y estás seteado...
2916460	2918260	En el sur hablé con unos cordobeses.
2918860	2920240	Unos empresarios cordobeses.
2920680	2922300	Le pregunté cosas del cordobesismo.
2922860	2925100	Y ellos me contaron una tradición heredada
2925740	2929100	de el concepto insular de angelos.
2929100	2931060	De hecho, no esta cosa de...
2931060	2933100	Córdoba para los cordobeses, ¿no?
2933520	2936260	Que después de la Sota,
2936280	2937140	de la Sota,
2937380	2938500	con gran habilidad,
2938960	2941360	funda el cordobesismo, ¿no?
2941360	2942860	El peronismo a la cordobesa.
2943640	2944680	Eso es excepcional.
2945040	2945700	Eso es excepcional.
2945920	2947780	Yo creo que el modelo de Córdoba...
2947780	2951280	No digo el modelo de Córdoba en términos institucionales, ni ideológicos, ni lo que sea,
2951580	2953860	pero porque saben que para mí eso es una categoría menor.
2955320	2956780	Ya lo he dicho 400 millones de veces,
2956840	2958180	ustedes ya están todos quemados, están locos.
2958180	2960240	Ustedes saben que yo creo que
2960240	2963020	no hay diferencias teóricas, solo espirituales.
2963440	2966160	Cuando se viraliza un recorte que hace acá a Agob,
2966180	2967460	no importa lo que yo esté diciendo.
2967860	2968460	No importa.
2968980	2971080	Si alguien lo ve del otro lado y yo ya le caigo mal,
2972300	2973180	va a decir...
2973780	2975380	Sabía que era un hijo de puta, ¿entendés?
2975380	2977000	Y va a seguir en esa porque es sumisión
2977000	2979120	hasta que algo conecte por otro lado si es que pasa.
2979780	2980600	En el mismo sentido,
2980800	2982720	el modelo espiritual de Córdoba es excepcional,
2982900	2985900	debería ser implantado por todas las corrientes políticas que quieran tener éxito.
2985900	2988900	Vos no podéis tener una línea que a costa de ser correcta
2989720	2993120	para con tus valores de orden cosmopolita te haga perder tu distrito.
2993520	2995140	Porque no estás haciendo el objetivo primero
2995140	2997340	lo que quieres hacer que es representar y transformar.
2997560	3001400	Yo creo que Córdoba receptó, receptó la lección
3001400	3003960	que le está costando mucho deglutir al frente de todos
3003960	3006900	y salió a decir, el frente de todos es una poronga.
3008800	3012100	Y lo dicen de un ifecelismo que tiene que ordenar,
3012180	3013140	que tiene que resolver.
3013140	3016640	Después de ver cómo juega en la Gran Guerra Sagrada,
3016640	3017400	¿sí?
3017880	3019920	Porque después es tipo, ah, acá está, ¿viste?
3020200	3021120	Nos cagó el griego.
3021340	3022680	Sí, todo te cagan, ¿entendés?
3023680	3024640	Es lo que pasa.
3024940	3027380	Pero espiritualmente es excepcional lo que está haciendo.
3028660	3029940	Gildo hizo lo mismo, ¿eh?
3030880	3033980	Gildo hizo lo mismo, pero tuvo menos saña.
3034740	3036560	Porque el cordobés nos odia en serio.
3037520	3040400	Entonces el cordobés de verdad tiene un sentimiento profundo, ¿viste?
3040400	3043380	De decir, de porteños hijos de re mil puta.
3044880	3045980	Y le metió como una cosita más.
3046100	3048140	Pero Gildo hizo lo mismo, no sabe ni plantar lechuga, dijo.
3048680	3051300	No habían pasado ni dos días, estaba tibio todavía, Alberto.
3054300	3056220	Y sale así de, no sabe ni plantar lechuga.
3056260	3056880	Es excepcional.
3057120	3057620	¿Qué más tenemos?
3057920	3058380	Tenemos, sí.
3058720	3061160	Borde, querido, acá un cucumelo suelto.
3061620	3063360	Quería preguntarte, ¿tenés mucha información
3063360	3066120	sobre cómo vivió Alberto el Wanda Chinagate?
3066620	3068240	¿Cómo lo pensó, cómo lo vio, cómo lo imaginó?
3068240	3069540	Por supuesto, por supuesto.
3069540	3071540	Sí, con gran consternación.
3073400	3074680	John no nada más.
3075140	3077540	Estaba por supuesto, como saben, siguiendo los últimos acontecimientos.
3078180	3078880	Estaba en el día a día.
3079000	3079740	No puede ser.
3080440	3083180	¿Cómo va a ser una historia ahora con ella durmiendo?
3083660	3085720	O sea, John no lo podía creer.
3085900	3086540	No lo podía creer.
3087640	3089800	Principalmente porque el mayor interés del gobierno estaba
3089800	3091660	en que el Wanda Gate dure lo más posible.
3093340	3095220	Todas las preocupaciones, todas las alarmas
3095220	3096220	se encendieron ahora en Olivos
3096220	3098540	porque le quieren dar un sello de concluido.
3098740	3102560	O sea, hay una gran, lo puedo decir yo como receptor de impuestos,
3103040	3106860	hay un gran operativo destinado a prolongar eso.
3107080	3108180	A estirar un poco más.
3108780	3110700	A decir, pero che Wanda, no te di un poco de bronca.
3110780	3112940	O sea, DMs todo el tiempo, ¿viste?
3113440	3114840	Lo de Icardi es impresionante.
3115040	3115700	¿Hablamos un poco de eso?
3115780	3116600	¿Quién habló un poco de lo de Icardi?
3117760	3120240	Lo de Icardi es impresionante.
3120640	3121100	Lo de Icardi.
3121100	3122680	¿No hay tantos ejemplos?
3123040	3126480	¿Cuántas personas se han hecho verbo aparte de Jesús?
3128920	3129320	¿Nisman?
3130600	3131000	¿Nisman?
3131800	3132200	Bien.
3134080	3134520	¿El Diego?
3134600	3136960	El Diego es muy, no sé si no es más grande, ¿eh?
3137140	3138860	Porque, porque ¿qué es?
3140320	3141700	Puede ser muchas cosas, ¿viste?
3142640	3144840	Claro, pero es un verbo polifacético, digamos.
3145180	3146600	O sea, es un verbo con amplitud.
3147080	3148780	Lo que digo es, ¿quiénes se han hecho, viste,
3149180	3150000	carne en el verbo?
3150060	3150400	¿Qué se yo?
3150460	3152960	Dale, Jesús, Nisman, tal cual.
3154420	3156320	No muchos, no muchos,
3156320	3159460	se han hecho carne en dos verbos.
3160440	3165380	Icardi promulgó universalmente el significado de icardear.
3165780	3167560	¿Qué era icardear hasta hace un mes?
3170780	3171700	Traicionar, exacto.
3171760	3172600	Acá el unísono.
3172620	3173160	¿Cómo está el Twitch?
3173220	3174000	No estoy viendo nada.
3174800	3175140	Rucci.
3175400	3176380	Bueno, está bien.
3179640	3180120	Siempre...
3180120	3181120	¿Sabes qué me pasa a eso?
3181400	3183560	Es complejo estar hablando y estar teniendo
3183560	3185440	estímulo input, viste, en simultáneo.
3185440	3189380	Y cada vez que miro el Twitch de Maga,
3189440	3191320	hay una cosa oscurísima siempre, ¿entendés?
3191560	3192840	Siempre son como...
3192840	3194620	Siempre veo balas no ignorables,
3194820	3195440	¿entienden lo que digo?
3195500	3196400	O sea, no es que digo así y digo,
3196700	3197180	ah, sí, bueno.
3197340	3198180	Siempre veo como un tipo,
3198300	3200360	uy, boludo, están...
3200360	3204440	O sea, oscuro, tipo Deep Maga, digamos, siempre.
3204820	3207800	Pero bueno, Icardi logró algo único, histórico,
3207840	3210000	que es transformar icardear.
3210020	3211300	O sea, ¿qué es icardear hoy?
3212420	3213260	Fata de lana.
3215480	3216040	Arrastrarse.
3216540	3217780	Es la procesión.
3218600	3221300	Es la autoflagelación, el sufrir,
3221440	3223980	el sangrar por la misión, ¿sí?
3224580	3227260	Es lo propuesto acá, en este mismo micrófono,
3228060	3230640	de Alberto peregrinando a Luján, ¿recuerdan?
3231020	3233260	Era Alberto de rodillas, siendo escupido,
3233360	3235920	siendo vilipendiado, purgando su propia alma.
3236500	3237480	Ahora icardear es eso.
3238060	3239980	O sea, ahora hubo ministros que le dijeron,
3240340	3242300	Alberto icardeal a esa hora, ¿entendés?
3242300	3245580	Tipo arrancaba, viste, un proceso así autopurgatorio.
3245880	3246940	Y eso es fascinante.
3247200	3249260	No hay muchas personas que tengan la capacidad de hacer eso.
3249620	3252460	Sin lugar a dudas, lo puede hacer frente al otro gran símbolo argentino,
3252660	3253600	que es Wanda.
3255000	3258140	Wanda es una cosa impresionante, ¿eh?
3260860	3261300	Wanda...
3261300	3263160	Lo veo allá yo, lo veo por la pantalla.
3263480	3265620	Wanda es una cosa impresionante, ¿eh?
3266100	3267580	Porque Wanda, o sea, de vuelta,
3267740	3270700	así como Icardi tuvo la capacidad de transmutar en dos verbos,
3270700	3272900	record, record,
3273580	3274700	Wanda junto con
3276060	3277580	Román y Cristina.
3279240	3279760	¿No?
3280020	3281340	¿No me dejes mentir?
3282560	3284100	Si tenés que...
3284100	3285400	Si tenés que...
3285960	3287700	Si tenés que más o menos hacer un podio.
3288600	3291940	Personas con la capacidad de diciendo una sola cosa,
3292280	3293700	poniendo a todo el país a hablar de ellos.
3294440	3295640	No hay tantos, ¿eh?
3296720	3297860	¿El presidente seguro que no?
3297860	3300420	O sea, descontemos fácil, ¿el presidente no?
3301420	3304260	El Diego sin dudas, el Diego sin dudas.
3304420	3306840	Es Cristina, es Román y es Wanda.
3307780	3309340	O sea, Wanda es una historia
3309340	3312300	diciendo otra familia más que te cargas por zorra.
3312600	3314060	Ni siquiera diciendo quién
3314060	3316940	y ya todo el mundo sabía quién era, qué hacer.
3317500	3318480	Misiones, ¿viste?
3319940	3320480	Encolumnados.
3320720	3321960	Tipo, marchando por Wanda.
3322300	3325560	Gente dispuesta a apuñalar a Icardi en el estómago,
3325700	3327220	como cualquier cosa, ¿entendés?
3327220	3329260	O sea, eso es lo interesante de esas personas
3329260	3331140	con ese nivel de égida espiritual,
3331460	3333220	que pueden hacer, instalar personas
3333920	3335520	como parte de su círculo legítimo,
3335640	3337200	como tipo, ah, acepto Icardi.
3337440	3338760	Familia Wanda, todo ok.
3339500	3342340	Y de repente es tipo, Wanda dice no, muere Icardi, ¿entendés?
3342940	3345680	Es tipo, de vuelta Game of Thrones for the Watch, ¿viste?
3345760	3349040	O sea, lo apuñarás así con los ojos en blanco aparte, como...
3349040	3350220	Perdón, no es personal, Icardi.
3351080	3353620	Solo caíste, ya no tenés más el favor de Wanda.
3354180	3354600	Ya está.
3354600	3357000	Y si vuelve, vuelve, se lo acepta.
3357160	3358200	Es verticalismo total.
3358320	3359120	Para mí es impresionante.
3360260	3362520	¿Sabes por qué me hace muy feliz lo de Wanda?
3364140	3367100	Porque renueva para mí el panteón de héroes.
3367680	3371960	Ustedes saben, ustedes saben que yo soy un obsesionado
3371960	3373920	por cuidar nuestro panteón de héroes nacionales.
3374040	3376800	¿Cuánto tiempo vamos? ¿Cuánto tenemos? ¿Cuánto...
3376800	3377300	¿Qué hora es?
3377980	3379880	Ah, estamos bien.
3380180	3380840	¿Alguien más quiere decir algo?
3382460	3382860	Dani.
3382860	3388220	No, Rebord, primero que nada, yo no voy a hacer una pregunta.
3388360	3390940	Yo le quiero agregar épica a esto.
3391300	3392660	Le quiero agregar épica.
3393180	3396940	Porque otra vez convocaste un lisiado
3396940	3402480	y otra vez en condiciones de subir escaleras.
3403340	3405940	Volví a caminar, carajo.
3406440	3407400	Volví a caminar.
3414580	3416840	Sos el único organismo del Estado
3417480	3420980	que cumple el cupo de discapacitados en los lugares.
3422180	3423740	¡Llega, Rebidu Carlos!
3425080	3425640	Sí.
3426980	3428100	No solo eso.
3428340	3431920	Ustedes saben, el público agobero sabe que Dani ya es un apóstol.
3432160	3434260	O sea, Dani es un apóstol del agoberismo.
3435200	3440540	Y estamos haciendo eventos exclusivamente en lugares con escaleras.
3440540	3442900	O sea, pedimos...
3442900	3444540	De hecho nos dicen, no, ella, ¿no entras cómo?
3444560	3445840	Y decimos, no la veo entonces.
3446600	3448040	Dame dificultad de acceso.
3448860	3450340	Dame cosas complejas.
3450780	3452320	Y sí, Dani, vos ya estás caminando tanto
3452320	3453940	que es como lo que hago los martes, ¿no?
3453940	3455860	O sea, es venir algo.
3455940	3457560	No sé si venir mañana también, pero...
3457560	3458780	Voy mañana, voy mañana.
3459100	3462980	Y si me permitís algo más, gracias por esta gratitud.
3463200	3466480	Quiero convocar a los lisiados de la Argentina
3466480	3470920	a formar el frente del lisiados agoberos.
3471240	3475460	Y confoco a todos a que vengan a protegerte.
3476400	3478100	Vamos a hacer tu primera línea.
3478540	3480480	Vamos a levantar ruedas por el aire
3480480	3484220	y a prender fuego a los franquibotitos de la vida.
3493320	3495580	Prender fuego a los franquibotitos de la vida
3495580	3498540	es lejos la cosa más violenta dicha
3498540	3500780	en la historia del Estado Nacional.
3501180	3503800	Por suerte, como saben, Dani es nuestra línea radicalizada.
3504020	3505760	O sea, Dani es...
3505760	3507580	Dani es nuestro equivalente...
3507580	3509860	Yo se lo dije, Dani es nuestro equivalente vikingo
3509860	3511300	a Ibar, el de Huesado.
3511780	3512560	¿Ustedes recuerdan?
3512860	3514740	O sea, los vikingos tuvieron una gran épica
3514740	3516460	con un líder sin gambas
3516460	3518360	que estaba completamente loco como Dani.
3518620	3520860	O sea, y básicamente estaba legitimada
3520860	3524100	la máxima violencia por sus poderes cósmicos
3525500	3526740	deliciado, sí, básicamente.
3527320	3530120	Por ende, es increíblemente útil una vanguardia lisiada.
3532900	3533340	Porque...
3534780	3536660	Imagínate en los aprietos que pones,
3536840	3540400	esto lo decimos gente que ha armado columnas, viste, que se haga...
3540400	3543080	¿Qué ha hecho cualquier persona en una marcha sana
3543080	3544820	del movimiento nacional y popular?
3544980	3546380	Pelearse con el Evita, ¿no?
3546780	3549480	O sea, es tipo esa ABC de ir a una marcha,
3549640	3550700	de agarrarse a piñas con el Evita.
3550700	3553100	Imagínate si encabezás con una línea homogénea
3553100	3554400	de gente en silla de ruedas.
3555940	3556600	¿Qué vas a hacer?
3557060	3559080	Están todos ahí, armaron cordón de seguridad,
3559280	3561200	todos gordos, y vos decís, de ahí tengo...
3561200	3561860	¿Van a pasar ellos?
3562560	3563620	¿Qué? ¿Papelos rompés?
3564100	3565740	O sea, hay algo de...
3565740	3567680	No entiendo qué está pasando, no entiendo qué está pasando.
3567920	3569760	Pero esas son las cosas, esas son las cosas.
3570060	3571680	Dani caminando, aprovecho y digo,
3572200	3574880	vamos a estar mañana también ahí en Saavedra,
3575020	3577500	que nos invitaron de la comuna 12.
3579960	3581240	Estoy hablando tanto,
3581320	3583120	estoy hablando tanto que no tengo ningún recuerdo
3583120	3584680	ni registro de las cosas que estamos diciendo.
3584820	3586560	Así que por suerte existe, hago cinco
3586560	3588280	para dejarlo todo bien documentado
3588280	3593940	y que sea penalmente imputable el día de mañana.
3594900	3597360	Y voy a ir con esto que era este eje,
3597520	3598920	esta línea que quería desarrollar,
3599740	3602180	que tiene que ver con, para mí, la preocupación central,
3602380	3604500	el núcleo espiritual de la búsqueda de Maga,
3605240	3606920	que es algo que lo charlamos en su momento.
3606920	3609840	Lo recuerdo ahí cuando lo hablábamos con Miki, ¿no?
3609840	3612820	Que Miki me propuso hacer algo acá en la radio.
3612940	3613860	Me dijo, ¿qué querés hacer?
3613980	3614860	Y yo, yo quería hablar.
3616100	3617080	Y me dijo, ¿cómo solo?
3617140	3618860	Le dije, ¿solo?
3619040	3621000	Sí, sí, solo, una hora.
3621080	3621720	Quiero hablar solo.
3621800	3623660	Miki dijo, ¿no preferís?
3624420	3625300	¿No preferís?
3626160	3626820	¿Hay equipos?
3627160	3627600	No.
3628940	3629640	Estaba solo.
3630180	3631140	Quiero que haya cámaras.
3631160	3632380	¿Se puede hacer eso desde el estado?
3632420	3634800	Y Miki dijo, es ahora.
3635180	3636200	Y Miki está ahí parada.
3636200	3638460	Me gustaría agradecerle también la posibilidad de hacer esto.
3641640	3643900	Porque también la posibilidad de estar haciendo esto presencial,
