start	end	text
3644200	3644780	que cuesta, ¿eh?
3644780	3645880	Lo vamos a volver a hacer.
3645900	3646860	Yo creo que lo vamos a volver a hacer,
3646880	3649620	a lo tanto que venga más gente, cada vez más gente, ¿sí?
3649900	3651280	Claro que sí, eso va a suceder.
3651880	3652600	Está pasando.
3652700	3654300	Se dice alegre, sucede.
3654360	3655960	Perfecto, perfecto.
3656860	3657220	Perfecto.
3657400	3658600	Eso va a suceder.
3658640	3659620	Va a suceder.
3659680	3661360	Gran forma de lograr compromisos así.
3661440	3662500	Es algo que se dieron cuenta, ¿no?
3662540	3664240	Tipo, jaja, toda felicidad.
3664360	3665120	Y acá sacas cosas.
3666240	3669300	No, no, por favor.
3670700	3671720	Por favor, no.
3671840	3672400	¡Calma!
3672400	3673140	Por favor, no.
3673220	3674260	¡Calma, compatriotas!
3674620	3675180	¡Calma!
3677220	3677780	¡Calma!
3678420	3679200	Por favor.
3679980	3681200	Cuestión, cuestión.
3681780	3684620	¿Cuál era la búsqueda original de MAGA la que sigue,
3684680	3687080	la que hace, para mí, un espacio, un encuentro único,
3687220	3689720	entre todos los programas existentes de la historia de la humanidad?
3690500	3695480	El registro, el registro de estos acontecimientos que nos hacen sentir parecidos.
3695480	3697640	Yo en esto quiero ser enfático, quiero ser clave.
3697920	3698680	A mí me vuelve loco.
3698820	3701120	O sea, que haya gente acá que haga la plata.
3701800	3703300	La idea de las seccionales.
3703440	3708780	La idea de los observatorios de eventos de índole metafísico de la Argentina.
3709720	3712780	Y lo que quiero decir es que funcionan.
3713240	3713600	Funcionan.
3713640	3714040	¿En serio?
3714180	3715880	O sea, yo...
3715880	3717280	No está nucleado en ningún lugar.
3717340	3718380	No lo puedes ver en los medios.
3718420	3720080	No aprendes el noticiero y te dice eso.
3720400	3724200	Pero yo entro a Twitter y tengo las notificaciones de los eventos metafísicos de la Argentina.
3724200	3726220	Es así, estoy etiquetado en todos.
3728440	3729000	Saqueos.
3730720	3732440	Revoleo de mayonesas, ¿entendés?
3733120	3735200	Y en el mismo género, la historia de Icardi.
3736760	3737560	Y no tenemos...
3737560	3741040	Ya hay una capacidad acumulada, una capacidad de doctrina instalada
3741040	3743700	que no hay ni que explicar qué sí y qué no.
3743920	3744160	¿Se entiende?
3744200	3745400	Para mí eso es maravilloso.
3745720	3747260	Para mí ya se percibe.
3747680	3749340	Ya es aprehensible.
3749520	3752460	Con H en el medio, la difícil, digamos.
3752460	3754660	O sea, vos lo ves, la gente lo ve y los detecta.
3754840	3756220	Y los sagos funcionan.
3756380	3757460	Los sagos funcionan.
3757760	3758420	Y a mí así...
3758420	3760300	Ahí sí esto es lo que me interesa.
3760920	3765600	Yo creo que hemos tenido la fortuna, la bendición de haber nacido en la República Argentina.
3766200	3766420	¿Sí?
3768660	3769520	¿Qué es?
3769820	3770420	¿Qué es?
3771560	3772220	¿Qué es?
3772380	3773180	Lo saben bien.
3773300	3774200	Lo saben bien.
3774580	3778780	Está como en las películas de terror, fundada sobre un cementerio indio, pero en serio.
3779620	3779820	¿No?
3780720	3784960	Están literalmente erigidas sobre un cementerio indio con sus poderes conceptuales.
3785080	3791040	Y tenemos la mayor cantidad de mística por metro cuadrado y por habitante.
3791620	3795240	Yo creo que en eso, en eso la Argentina le compite a cualquier país del mundo.
3795540	3796540	No nos corre nadie.
3797000	3797600	Y lo sabemos.
3797700	3801780	Lo sabemos con la cantidad de figuras astrales que hemos tenido, los que conozcamos en cualquier lado.
3802080	3805260	Y eso es lo interesante de medir las cosas con ese lente.
3805260	3810580	Con el lente de, como decía Scalabrini y Ortiz, en su prólogo del hombre que está solo y espera.
3811540	3811980	Creer.
3812240	3813900	Es ahí toda la magia de la vida.
3814680	3819280	Esa propensión, esa cosa de querer creer, esa cosa de agarrar y decir...
3819280	3821100	Y ante la duda, bueno, qué sé yo, es ahora.
3822660	3823960	Viene la profecía que sea.
3824040	3825680	Viene la servilleta de Maslatón.
3827080	3829420	Y decimos, y sí, y sí, ¿viste?
3829620	3831020	Es ahora, y sí, dale.
3832200	3837000	Y ahí es donde uno pensará, vete nada más acá, son todos más de ese palo.
3837160	3838020	Pero así es como vienen troscos.
3838820	3840340	Así es como vienen libertarios.
3840620	3842060	Así es como vienen gente derecha.
3842280	3844200	Que de verdad vienen y de verdad lo disfrutan.
3844460	3846500	Porque hay algunas cosas que cortan en diagonal.
3847060	3847920	Y eso es interesante.
3848000	3851680	Y yo creo que ahí está esa esencia, ese sentir, ese disfrutar argentino.
3852040	3853540	Y hay gente que por supuesto no lo siente.
3853740	3854340	Y eso lo sabemos.
3854680	3856640	Y eso es imposible explicar.
3856940	3857280	Lo saben.
3857340	3858240	No sé si alguna vez les pasó.
3858240	3862540	A una vez les pasó compartir un hecho de índole metafísica con alguien.
3863700	3865240	Y que la otra persona diga...
3866400	3867600	Diga, no lo...
3867600	3869240	Esto es un papelón, ¿entendés?
3870380	3872520	Los refutadores de leyendas, exacto.
3872540	3874180	Y si vos vas a nuestra cultura nacional,
3874580	3876440	se habla de eso todo el tiempo, con distintos nombres.
3876560	3877180	Con distintos nombres.
3877240	3878640	Uno nunca no inventó nada.
3879080	3881780	Uno a lo sumo, creo que lo mejor que puede hacer es
3881780	3885340	formarse en comunidad para ser un mejor detector de estas cosas.
3885500	3886240	Y protegerlo argentino.
3887160	3888340	Proteger nuestros héroes nacionales.
3889220	3890320	Eso es lo que yo no quiero que pase.
3890660	3891920	Yo no quiero que se mueran, ¿viste?
3891940	3896340	Yo no quiero que se mueran en un sentido del ocaso de los ídolos, ¿viste?
3896620	3900960	Esta cosa que pasa, esta cosa que a veces es culturalmente difícil de entender o de sostener por momentos.
3901320	3903340	Porque nuestros ídolos son muchas cosas menos que perfectos.
3905040	3909860	Nuestros ídolos son una conjunción errática de lo que sea que les pasó en su vida,
3910200	3912340	en su biología y en sus condiciones socioculturales.
3913500	3914240	Son errados.
3914460	3915100	Como todos.
3915100	3917200	Y hay gente que ve peligro en los ídolos.
3917360	3919120	No porque, claro, tienen gran capacidad de daño,
3919200	3921980	de legitimar cosas que no están tan buenas o cosas que hay que transformar.
3922260	3925100	Y yo creo que todo eso puede hacerse, puede hacerse,
3925920	3930400	pero desde el más franco disfrute de las cosas que nos hacen únicos.
3930900	3932020	Eso es lo que me pasa a mí.
3932320	3935400	Y a mí me pasa que cuando veo Guandanara, yo digo, bien,
3935580	3939500	tengo un júbilo secreto, como decía Borges en su poema conjetural.
3939820	3943080	El júbilo secreto en el pecho cuando él lo están acribillando.
3943080	3945820	¿Vieron ese poema que le de Francisco Narciso de la Prida?
3946100	3948400	Y lo matan, lo matan los indios.
3948600	3951720	Y él incluso muriendo, incluso muriendo, dice,
3952140	3955060	pero habitaba en mi pecho un júbilo secreto
3955060	3958500	de estar cumpliendo al fin mi destino sudamericano.
3958780	3961520	En ese momento, derrotado y perdido, el tipo dice,
3961780	3966920	soy más argentino que nunca, morí en una ciénaga a mano de los indios.
3967400	3970260	Eso me gusta a mí, eso me apasiona.
3970260	3975500	Y yo creo que eso es lo que en estos pequeños santuarios,
3976160	3977560	encuentros, podemos proteger.
3977900	3979700	De eso se trata, de nada más.
3980140	3983040	Que cuando vemos estas cosas las protegemos, las cuidamos porque son nuestras.
3983700	3987400	Son nuestras, son solo nuestras, nos hacen únicos, nos protegen, nos hacen inmortales.
3988200	3992520	Cuando él a todo su novia le dice, dejá de escuchar a Rebordi, él dice, ahora soy invencible.
3992980	3993820	Es solo por eso.
3995020	3996920	Él no es invencible.
3996920	4002960	O sea, lo que quiero decir es que físicamente si alguien te daña estructuralmente, morirías.
4005580	4009020	Pero en ese momento, en ese momento, en ese momento,
4009500	4011580	hay una conexión con lo absoluto.
4012080	4014760	Hay una conexión con todo lo que nos hizo argentinos en algún momento,
4014820	4015960	y yo eso lo creo de verdad.
4016380	4019040	Hay una vibración, no estamos ahí todo el tiempo, digamos,
4019320	4022000	todavía no desarrollamos un nirvana hinduista
4022000	4024200	donde uno vibra en estado de mística permanente.
4025020	4028100	Sería peligroso, no sé cuál es la viabilidad social de eso después.
4028360	4031540	Pero uno entra, entra y sale por momentos, como en una sintonía.
4032200	4033040	Para mí más es eso.
4033320	4036180	Ese momentito donde entramos, declaradamente en esa sintonía,
4036500	4038140	eso para mí fue este encuentro.
4038300	4039800	Y debo decir, fue porque ya termina.
4040420	4043080	Pero compatriotas, les quiero agradecer una vez más por estar acá,
4043300	4046500	a la gente de Twitch por haber sido parte de este encuentro histórico.
4046740	4050100	Les pido un fuerte aplauso a la producción de Nacional Rock,
4050400	4052760	la gente en Twitch también que ha sido parte de esto.
4058080	4058460	¡Aplausos!
4072040	4074380	No, el Twitch no lo escucha,
4074580	4077940	el Twitch no lo escucha, pero hay cánticos de orden y espontáneo.
4079820	4084260	Compatriotas, sin lugar a dudas, hoy hicimos a la Argentina Grande nuevo.
4084580	4085140	¡Gracias!
4088320	4089720	¡Aplausos!
4115560	4116960	¡Aplausos!
